,Unnamed: 0,Time,Text,Sentiment
0,0,2018-12-31 23:59:56+00:00,"our latest podcast out. our tech predictions the impromptu video microsoft apple, sony, more. will facebook get hit massive gdpr fine? and a deep dissection how facebook moderates platform. podcast technology","[54.60484678572467, 49.142445440554816]"
1,1,2020-10-02 15:59:10+00:00,learn an overhaul nj competitive energy market would force state ratepayers pay higher electric bills.,"[75.93762458446804, 55.318903464494745]"
2,2,2018-12-31 23:59:04+00:00,new ebay microsoft xbox one s gb white console,"[38.79893531132588, 38.6398480594783]"
3,3,2018-12-31 23:58:46+00:00,jrno microsoft xbox bethesdastudios fallout xboxsupport the point anyways that charge backs get account banned. so a warning.,"[60.08953650904042, 44.52978302876057]"
4,4,2018-12-31 23:58:35+00:00,windowscentral why make articles device specific? why just say windows tablet laptop doesn have ethernet port??? you receive cheque microsoft time mention devices what?,"[46.15828019418061, 41.02952692569995]"
5,5,2018-12-31 23:58:00+00:00,"see signal alliance, microsoft, cisco teaming to help enterprises nigeria improve profitability azure stack","[31.384420555266875, 31.33649108575989]"
6,6,2018-12-31 23:57:57+00:00,avalanchetwitch dawgg got microsoft powerpoint webcam,"[31.55300988361815, 22.62997060542102]"
7,7,2018-12-31 23:57:55+00:00,"need wake call , i sick microsoft shit , have gotten away pissing off screwing over far long , time something done soon satisfy someone someone please , i be successful something t get my way","[29.225689190357304, 29.23199387766275]"
8,8,2018-12-31 23:57:48+00:00,"join microsoft graph security hackathon use microsoft graph security api solve challenges integrating different solutions, tools, intelligence. , cash prize pool for grabs. graphsecurityhackathon","[105.27790934409491, 74.49554758249784]"
9,9,2018-12-31 23:57:44+00:00,"davekawula sifusun microsoft veeam mvpdays thank for support i hope had happy christmas will a fantastic new year, happy holidays","[37.99261104065217, 36.9872125280311]"
10,10,2018-12-31 23:57:10+00:00,devops overview microsoft azure,"[9.10902772692251, 9.898469750966079]"
11,11,2019-01-01 23:59:44+00:00,new job business sales specialist jobs bc vancouver sale company microsoft location bur,"[47.31518125475035, 57.416426352344494]"
12,12,2020-09-03 18:26:48+00:00,"lenovo legion x playapex now your chance rise the rest. unmatched performance, purposeful engineering, modern design. gear with machine savage you are. stylish outside. savage inside.","[75.1630887480833, 54.2806501932506]"
13,13,2019-01-01 23:59:42+00:00,"microsoft xboxsupport xbox i’d like know i would need buy prepaid card renew membership middle december i already paid renew the rd, shown on this heavily censored card statement. i wouldn’t, bc i didn’t.. wtf?","[86.56725310580508, 46.45303348123105]"
14,14,2019-01-01 23:59:41+00:00,help get first ever montage views would mean world mixerstreamersunite lionsdenmixer ignore tags xbox microsoft…,"[41.191310847889206, 31.62937741592413]"
15,15,2019-01-01 23:59:05+00:00,"tln’s creator saying studio “massive business, legal &amp; funding issues” sounds lot like “microsoft pulled plug i publicly hate women”.","[72.87363943348004, 27.272750972828238]"
16,16,2019-01-01 23:58:34+00:00,"""there nothing amusing aboutmit’s psychotic bot norman microsoft’s fascist tay.technologists falling the trap considering ai systems make decisions analogous children, playing dolls marveling their dolly speaking""","[66.77070816879083, 69.77291380864835]"
17,17,2019-01-01 23:58:28+00:00,"reuters terrapower llc, nuclear energy venture chaired microsoft corp co founder bill gates, seeking new partner early stage trials its technology new u.s. rules forced to abandon agreement china, company officials told wsj","[95.9646168274623, 97.50525937417748]"
18,18,2019-01-01 23:58:12+00:00,anikakokatayy babysnitchery ......most people i know smart ass programmers microsoft are indian this girl just??? ?? ?????????????,"[17.4761879452842, 27.078738912476627]"
19,19,2019-01-01 23:57:51+00:00,"passcod eevee case point, microsoft offered automatically translate from romanian. it failed, it already english.","[53.80367756820611, 57.782915405524]"
20,20,2019-01-01 23:57:49+00:00,"“for intents purposes, we’re years year process moving analog digital,” said tim bajarin, a longtime tech consultant companies including apple, ibm microsoft. digitaldisruption futureofwork","[61.39612599482125, 52.70122005043011]"
21,21,2019-01-01 23:57:22+00:00,", year nuetral youtube gamers talk how microsoft changing brand.","[27.458589693845408, 19.606052081509606]"
22,22,2019-01-02 23:59:51+00:00,simonj neo “microsoft included separate software the office software [on desktop computers] regularly sends telemetry data its servers the united states.”,"[76.6903816178769, 76.80170125738343]"
23,23,2020-09-03 18:26:48+00:00,"lenovo legion x playapex now your chance rise the rest. unmatched performance, purposeful engineering, modern design. gear with machine savage you are. stylish outside. savage inside.","[75.1630887480833, 54.2806501932506]"
24,24,2019-01-02 23:59:13+00:00,maburgosjr xbox microsoft should’ve looked the reviews youtube buddy fuckedyourself finessed,"[38.17948562852485, 39.584276470192385]"
25,25,2019-01-02 23:58:00+00:00,rt pzerger join insider program the coming chrome powered microsoft edge windows browser,"[49.3792896311063, 39.23983436669139]"
26,26,2019-01-02 23:57:45+00:00,visionary fatkittyrun dayz well test patches the system obviously it easier implement pc don have jump microsoft sony hoops kind common knowledge days consoles have very strict restrictions updates,"[55.27589082963046, 73.20024241964275]"
27,27,2019-01-02 23:57:39+00:00,the grand tour game pre order ./£. via microsoft store,"[33.92029040416385, 34.4848658156149]"
28,28,2019-01-02 23:57:24+00:00,windows finally surpasses windows the popular operating system from tomcnamara microsoft microsoft windows,"[28.33332405130803, 34.5777579874968]"
29,29,2019-01-02 23:57:18+00:00,"simonj neo if company uses microsoft office even a desktop , are sharing contents the data documents. of course part used improving spell checking etc. one to remember that there not real privacy office suite.","[66.87824353571905, 81.1031915339511]"
30,30,2019-01-02 23:57:15+00:00,dirty tech microsoft board member caught funding dems&amp; ; anti roy moore operation,"[75.19495718762627, 68.09417865831836]"
31,31,2019-01-02 23:57:06+00:00,"edzitron the photos app do that. yup, makes sense. you also find old windows movie maker windows essentials suite, microsoft really t want to know existed.","[21.562877244774644, 23.65676992275937]"
32,32,2019-01-02 23:56:55+00:00,chrome adapt the theme the windows interface. microsoft browser not this,"[37.5751712290003, 40.56778841717033]"
33,33,2019-01-03 23:59:47+00:00,"the trump train leslieforlife from opensecrets university california , soros , lawyers , &amp; microsoft some the democrat party top donors","[36.30259360751279, 26.923783931421458]"
34,34,2020-11-25 17:06:25+00:00,learn the new cloud like way manage premise databases this depth article rds on vmware cloud solution architect blogger satyashr,"[64.00006532285462, 84.31429844722402]"
35,35,2019-01-03 23:59:36+00:00,"stickyatmosfear microsoft yeah come across a lot, thieving companies the worst it comes customer service","[47.50169590253655, 51.71959105717395]"
36,36,2019-01-03 23:59:34+00:00,"microsoft releasing new feature powerpoint skype , allow individuals hearingloss more easily follow presentations audio calls microsoft adding real time captions powerpoint skype","[75.51772348782883, 112.75212996852261]"
37,37,2019-01-03 23:59:02+00:00,"microsoft research testing “bali,” way users manage “all data collected them” onmsft data privacy a quite big topic last year the grpd eu law coming effect, various facebook related scandals, more. just last month, m","[114.8045965298047, 97.61252800412922]"
38,38,2019-01-03 23:58:58+00:00,"microsoft research testing “bali,” way users manage “all data collected them” onmsft data privacy a quite big topic last year the grpd eu law coming effect, various facebook related scandals, more. just last month, m","[114.8045965298047, 97.61252800412922]"
39,39,2019-01-03 23:58:50+00:00,tensoftinc want implement microsoft dynamics business central? choose implementation plan best suited your business needs. learn here. msdynbc msdyn,"[26.600075265077766, 24.41581053936954]"
40,40,2019-01-03 23:58:47+00:00,"pc, microsoft, sony still t figured how make system brings people together like nintendo does.","[43.17504783236787, 54.288963123897965]"
41,41,2019-01-03 23:58:40+00:00,microsoft and amazon add ontology ont to its cloud computing marketplaces data center,"[50.853552972784534, 62.317645457233496]"
42,42,2019-01-03 23:58:21+00:00,"microsoft privately testing bali, way to give users control data collected about them","[49.30546428237456, 51.136371577816185]"
43,43,2019-01-03 23:58:16+00:00,maureenjohnson microsoft t translate but say s dutch. hope helps.,"[30.923464279865502, 38.47490244194665]"
44,44,2019-01-04 23:59:57+00:00,tegomass derpyeon ...microsoft translate saying,"[19.46526493300868, 11.583205955297254]"
45,45,2020-11-23 15:22:11+00:00,"do self manage databases premises today? read vexpert blog azizaqeelvm understand rds vmware help set up, operate, scale databases improve productivity lower costs.","[102.41215412411215, 65.71314470116451]"
46,46,2019-01-04 23:59:49+00:00,really envy people knows to use microsoft excel,"[6.7139161926952555, 9.80540135242328]"
47,47,2019-01-04 23:59:24+00:00,"just bought office home bring family microsoft goodness. extremly frustrated see i t use own domain outlook, without to transfer to godaddy is rediculously expensive especially a domain i already registered .","[91.91559657485546, 52.567805451759234]"
48,48,2019-01-04 23:59:21+00:00,xbox microsoft why you guys t thoroughly check really at fault banning suspendeding gamers. some gamers get upset certain people like choose ignore toxic messages gamers do do? they want report you.,"[112.0753790556381, 50.52553865414044]"
49,49,2019-01-04 23:59:16+00:00,"check new microsoft surface laptop intel core gb ram, gb dag colors ebay","[60.586977094336945, 51.541402753007155]"
50,50,2019-01-04 23:59:01+00:00,"chupacaubrey i t believe literally asking people pause button added, you should add it. something simple you t it, this happens microsoft buys a game? notch designed pause button already, add dont be lazy.","[111.38552803206584, 105.92902579759553]"
51,51,2019-01-04 23:58:55+00:00,"microsoft, twitter pinterest ? accounts been hacked into. set cunts.","[18.765240483816477, 10.41452041254819]"
52,52,2019-01-04 23:58:39+00:00,"shawnblanc you might actually looking microsoft onenote. you drop images, links etc, use pen tool apple pencil, it infinite canvas, extend and across no limit i’ve found","[59.566949082333984, 67.04306873895074]"
53,53,2019-01-04 23:58:33+00:00,"rt ontologynetwork binance st blockchain week in singapore month ontology be microsoft, goldman sachs, pwc, more. rt followers with binanceblockchainweek we give away free discounted tickets o…","[14.057894109959765, 3.2490018691402778]"
54,54,2019-01-04 23:58:25+00:00,"the microsoft implementation cmg cdp sccm cost total for month november. that approx , laptop devices will managed regardless whether are prem not.","[48.23384247605119, 40.49692037583083]"
55,55,2019-01-05 23:59:56+00:00,"ai microsoft, google use artificial intelligence fight hackers","[20.860527721686392, 21.415167633984314]"
56,56,2020-09-03 18:26:48+00:00,"lenovo legion x playapex now your chance rise the rest. unmatched performance, purposeful engineering, modern design. gear with machine savage you are. stylish outside. savage inside.","[75.1630887480833, 54.2806501932506]"
57,57,2019-01-05 23:59:20+00:00,racheljwillie i fear spreadsheets. my concession professionalism year been make microsoft word document rather doing sums hand...,"[16.82157650210969, 18.191842146331386]"
58,58,2019-01-05 23:59:05+00:00,"kimdotcom pls, keep tweet alive. we been warned snowden, we still processing full extent brutal unconstitutional invasion our privacy, growing business our personal information run fb, google, amazon, microsoft, many smaller players.","[61.938174827595596, 72.07040799999953]"
59,59,2019-01-05 23:57:42+00:00,"jurassic world evolution microsoft xbox one, brand new and sealed game ebay ends h last price usd .","[51.88322537679296, 53.034271439797244]"
60,60,2019-01-05 23:57:40+00:00,"""instead spending hours cycling a list brain teasers ‘gotcha’ questions, microsoft essentially puts candidates work a single problem throughout day.""","[18.21960656885749, 61.436705497469504]"
61,61,2019-01-05 23:57:35+00:00,or you could win other great prizes microsoft xbox s gaming console bose soundsport wireless headphones pepsi branded football,"[85.11208534190304, 84.42170871147515]"
62,62,2019-01-05 23:56:41+00:00,titaniamcgrath microsoft it’s official.,"[9.10902772692251, 9.898469750966079]"
63,63,2019-01-05 23:56:40+00:00,new ebay microsoft xbox one s minecraft limited edition tb extra controller,"[60.07861568070031, 61.01814071752084]"
64,64,2019-01-05 23:56:27+00:00,"three ways brands benefit adopting voice technology aapl, amzn, googl, msft voice assistants like amazon alexa, google assistant, apple siri, microsoft cortana, pegged trigger widespread transformation across retail industry the years …","[76.72486354770014, 84.97795818953885]"
65,65,2019-01-05 23:56:16+00:00,nowthisnews could help with microsoft operating system?,"[20.97228234716895, 20.70506297271835]"
66,66,2019-01-06 23:59:57+00:00,watching microsoft “cupcake” commercial nflplayoffs reminds one the few bright spots following the redskins the past years — listening rak talk. what set pipes,"[38.30735508568083, 53.81745013341813]"
67,67,2020-11-23 15:22:11+00:00,"do self manage databases premises today? read vexpert blog azizaqeelvm understand rds vmware help set up, operate, scale databases improve productivity lower costs.","[102.41215412411215, 65.71314470116451]"
68,68,2019-01-06 23:59:52+00:00,"intriguing. and, ms track ppl on site? microsoft quietly testing project aims hand people complete control their online data","[77.72250831029373, 73.4398183566341]"
69,69,2019-01-06 23:58:41+00:00,"check this amazon deal microsoft surface pro intel core i, gb r... microsoft a best class laptop versatility a studio tablet more power — with the new th generation intel core processor","[87.75966469240824, 50.93204350554061]"
70,70,2019-01-06 23:58:00+00:00,paullaw microsoft probably because fat a depreciated file system a gb file size limit was obsolete nearly years ago? guessing windows / linux / playstation interop?,"[116.36866420994923, 60.923476645075674]"
71,71,2019-01-06 23:57:55+00:00,microsofthelps through microsoft store,"[27.39297582274295, 28.182417846786517]"
72,72,2019-01-06 23:57:46+00:00,microsoft reveals new surface lineup amazonwebservices,"[20.680599421997137, 20.453594332078875]"
73,73,2019-01-06 23:57:28+00:00,bissonhunter hello there. thanks bringing to attention. may first verify you purchasing via xbox store through microsoft store website? iris,"[66.27083255044975, 60.646798501388886]"
74,74,2019-01-06 23:57:21+00:00,"one curious abilities the surface laptop the ability run windows pro. while the marketing microsoft’s lightweight laptop focused mainstream personal use, pro powered surface laptop attractive enterprise customers.","[86.4196060382985, 108.04451735618301]"
75,75,2019-01-06 23:57:08+00:00,bbc future microsoft it’s pity the photos your otherwise fascinating piece obscured the text; two pics each page visible,"[54.064212670467505, 43.176099904561035]"
76,76,2019-01-06 23:56:32+00:00,microsoft next gen strategy leaks why sony quiet? – the primal podcast anaconda diskless halo infinite,"[22.31570901082498, 43.882001869632326]"
77,77,2019-01-07 23:59:59+00:00,"now hiring attorney investigator microsoft redmond, wa legaljobs lawjobs inhousecounsel","[8.881304301232742, 10.229247776178282]"
78,78,2020-10-02 15:59:10+00:00,learn an overhaul nj competitive energy market would force state ratepayers pay higher electric bills.,"[75.93762458446804, 55.318903464494745]"
79,79,2019-01-07 23:59:52+00:00,kroger microsoft partner connected store pilot,"[40.49435416055967, 41.30142283817195]"
80,80,2019-01-07 23:59:33+00:00,i liked youtube video permanently activate microsoft office pro plus without software &amp; product,"[27.792802999878962, 30.20403113311487]"
81,81,2019-01-07 23:59:33+00:00,microsoft announces unlimited private repos github free,"[20.836142060991495, 31.090024095624994]"
82,82,2019-01-07 23:59:25+00:00,sophielipstein microsoft well get em next time,"[7.968885251850641, 7.995174642172612]"
83,83,2019-01-07 23:59:08+00:00,i liked youtube video create bookkeeping spreadsheet using microsoft excel part,"[16.885129571694225, 17.558957087254345]"
84,84,2019-01-07 23:59:03+00:00,microsoft tweeting mino talent using ipad pro send stuff he surely make something great it 미노 위너 송민호 winner mino,"[28.420538400480527, 25.13710778319214]"
85,85,2019-01-07 23:58:33+00:00,foxnews the use microsoft is where finkd white plains ny use the facebook pages with the socialmediatraining erdal ozkaya heartbleed wormhole blamed the lizard squad. the use msft the ebay ocs amazon prime xbox who,"[64.44307306238568, 26.234519883140795]"
86,86,2019-01-07 23:58:33+00:00,is the future retail? we checked the new high tech grocery store microsoft kroger,"[36.51472173278481, 26.521196844461986]"
87,87,2019-01-07 23:58:28+00:00,aviatorchilly tdshuff twitch shame isn streaming microsoft flight sim x oh well,"[28.732337519385492, 20.246122790063072]"
88,88,2019-01-08 23:59:35+00:00,decafjedi microsoft took swing this but looks pleasurable tbh,"[28.559096862369007, 20.771676259012306]"
89,89,2020-11-23 15:22:11+00:00,"do self manage databases premises today? read vexpert blog azizaqeelvm understand rds vmware help set up, operate, scale databases improve productivity lower costs.","[102.41215412411215, 65.71314470116451]"
90,90,2019-01-08 23:59:17+00:00,"cve an information disclosure vulnerability exists the microsoft exchange powershell api grants calendar contributors view permissions intended, aka ""microsoft exchange information disclosu...","[97.55088828062364, 77.80979188410531]"
91,91,2019-01-08 23:59:12+00:00,"/bbcwbr] update amazon is the world most valuable public company amazon, formed years ago, eclipsed microsoft become world most valuable listed company. the online giant worth bn £bn the us stock market closed mo…","[108.3720164835738, 53.29265668178852]"
92,92,2019-01-08 23:59:00+00:00,former microsoft cio jim dubois sat with emergetbm talk his new book how companies need embrace risk more inclusive corporate cultures digital transformation to succeed.,"[70.4141785722823, 70.19178028825924]"
93,93,2019-01-08 23:58:36+00:00,new ebay microsoft xbox one s tb nba k console bundle white,"[39.38415620122414, 49.82894324315485]"
94,94,2019-01-08 23:58:32+00:00,"free webinar make switch skype business microsoft teams end user guidance january , , – pm ct designed skype business users. register today msftadvocate","[82.25877272771214, 114.06441804518032]"
95,95,2019-01-08 23:58:26+00:00,microsoft’s redmond campus modernization update demolition begins,"[30.845466498792657, 31.634908522836223]"
96,96,2019-01-08 23:58:13+00:00,"ayebarney hell man, microsoft paint come long way. one dream though","[14.046832086696543, 9.450335784231646]"
97,97,2019-01-08 23:58:07+00:00,time running did know support microsoft windows windows server ends january ?,"[14.880289089045608, 4.728154623314316]"
98,98,2019-01-08 23:58:01+00:00,"next week nrf new york city will showcasing microsoft dynamics retail operations, alongside capaxglobal booth . read latest blog further details . hitachisolutions microsoft","[58.73280080664289, 88.42966645240728]"
99,99,2019-01-09 23:59:49+00:00,chanezon microsoft azure azureadvocates sogrady wow thanks patrick. i t know to say. that uncommon kind. we just always believed developers matter should treated accordingly.,"[43.98823918673829, 38.40173044435712]"
100,100,2020-11-23 15:22:11+00:00,"do self manage databases premises today? read vexpert blog azizaqeelvm understand rds vmware help set up, operate, scale databases improve productivity lower costs.","[102.41215412411215, 65.71314470116451]"
101,101,2019-01-09 23:59:44+00:00,"razer microsoft consoles mainly bought used affordability, price tag ain’t gonna go well.","[26.854247497726465, 30.84543832047594]"
102,102,2019-01-09 23:59:41+00:00,"rt mscloud ""microsoft plans open first middle east data centers the uae, offering unprecedented opportunity digitaltransformation the region. learn ""","[49.00076179711065, 30.85652056648293]"
103,103,2019-01-09 23:59:07+00:00,microsoft teams getting added support firstline workers,"[40.76435843409802, 42.37099644462209]"
104,104,2019-01-09 23:59:05+00:00,jacqui murielwickenden madeleine maz sashaclarkson trebornaeth frederickone le bold ditterhansen ernnutt hrhtudor funny orchestra plays microsoft windows waltz via youtube,"[41.39183904086387, 40.8654933180624]"
105,105,2019-01-09 23:58:59+00:00,xbox game pass quests award microsoft rewards points,"[29.53267908636815, 41.24372665020908]"
106,106,2019-01-09 23:58:50+00:00,temporary microsoft employees get email adresses a dash the . people referred as dash trash internally.,"[44.9991065653554, 66.12649501165325]"
107,107,2019-01-09 23:58:14+00:00,"icoclast hey, shakti. we happy hear made switch which microsoft edge features your favorite far? microsoftedge","[42.96368785070066, 38.464281606381974]"
108,108,2019-01-09 23:58:08+00:00,call text jeff .six.four great condition ” imac macos sierra intel core .ghz quad core gb ram tb hdd amd radeon hd m facetime hd camera wifi &amp; bluetooth microsoft office audio amazing comes mouse &amp; keyboard,"[161.03224844358795, 128.90105765208514]"
109,109,2019-01-09 23:58:07+00:00,xbox boss talks partnership with amd future platforms microsoft’s head gaming phil spencer alluded future xbox platforms running amd tech a keynote address ces .,"[104.1348934877215, 76.64999717161702]"
110,110,2019-01-10 23:59:46+00:00,amazon developing new game streaming service compete microsoft google,"[29.527338921412753, 19.007736356873966]"
111,111,2020-11-25 17:06:25+00:00,learn the new cloud like way manage premise databases this depth article rds on vmware cloud solution architect blogger satyashr,"[64.00006532285462, 84.31429844722402]"
112,112,2019-01-10 23:59:41+00:00,silver badge earned microsoft sudoku share game progress your friends i got silver badge in the daily challenges microsoft sudoku earn enough coins you get one,"[98.19720228937028, 109.23678646024129]"
113,113,2019-01-10 23:59:30+00:00,"ronnochamilton bungie majornelson xboxp halos done, bungie ended with reach, microsoft other plans. look how halo ended, concluded story.","[41.277253767875166, 43.70595150179803]"
114,114,2019-01-10 23:58:52+00:00,"check our next event "" week digital transformation microsoft power bi"" eventbrite","[25.50505845929951, 35.47267194261715]"
115,115,2019-01-10 23:58:33+00:00,how microsoft lost web,"[4.396031075208751, 19.557262128841906]"
116,116,2019-01-10 23:58:22+00:00,rt satyanadella introducing new capabilities microsoft teams empower more billion firstline workers around world do best work via carainholland,"[51.30908457878461, 38.210222922856566]"
117,117,2019-01-10 23:58:14+00:00,"mooch mooch bungie returned home, would still released destiny playstation? will ponies accept if were back the first party lineup microsoft? i would like see other projects want do addition destiny","[33.77050294117799, 26.44142048853468]"
118,118,2019-01-10 23:58:09+00:00,"microsoft launches xbox game pass quests, giving players chance earn rewards for…","[29.67623181949428, 33.444178869277586]"
119,119,2019-01-10 23:58:04+00:00,amazon developing new game streaming service compete microsoft google,"[29.527338921412753, 19.007736356873966]"
120,120,2019-01-10 23:57:27+00:00,"microsoft xbox today a good day. goodbye s, hello x","[20.042717787076842, 17.528763601608464]"
121,121,2019-01-11 23:59:33+00:00,"mary ligialeea cher bad illegals come in thru canada &amp; on planes, don walkin the clothes their backs seeking asylum which is illegal. immigration the lowest history, immigrants pay more taxes than rump, google, amazon, microsoft, apple &amp; all big business who pay ""no taxes""","[55.924913444523035, 69.17593432228847]"
122,122,2020-10-07 16:05:12+00:00,sign petition tell nj officials oppose energy monopoly new jersey.,"[29.010091990074663, 29.406126872195944]"
123,123,2019-01-11 23:59:25+00:00,"exclusive microsoft, google, and apple to implement live device access within months alexjones closersangels closernation","[38.72294623524365, 38.96537006191256]"
124,124,2019-01-11 23:59:21+00:00,seattle home world most valuable companies amazon &amp; microsoft via /r/technology,"[40.765686852584984, 28.597425662458807]"
125,125,2019-01-11 23:58:44+00:00,"microsoft linkedin report card technology integration continues, at slow pace zdnet general physics laboratory gpl microsoft linkedin report card technology integration continues, at slow ...","[78.59943820166403, 70.08951552619547]"
126,126,2019-01-11 23:58:42+00:00,"starwars battlefront ii microsoft xbox one, , battlefront , mint ebay ends h last price usd .","[62.179953650384874, 45.55448015506169]"
127,127,2019-01-11 23:58:37+00:00,check medalofhonor risingsun xbox disc only original microsoft via ebay,"[56.47802265324841, 28.58016477806221]"
