,Unnamed: 0,Time,Text,Sentiment
2956,2956,2019-09-25 23:58:00+00:00,here’s google facebook microsoft addressing data center energy challenge – reaping benefits tpmurray edfbiz climateactionsummit,"[20.022285484680825, 39.22369203308967]"
2957,2957,2019-09-25 23:57:42+00:00,"payment methods uk microsoft points, xbox live codes, license transfer &amp; paypal skype volkylobbies","[63.77243937159714, 75.09564848089859]"
2958,2958,2019-09-25 23:57:40+00:00,mwes i typically half screen webinar i type notes microsoft word.,"[27.55823679149697, 29.815798221091224]"
2959,2959,2019-09-26 23:59:25+00:00,borderlands so. i saw today last day get preoder bonus bl. ive done survey everything i preorder game via microsoft store i havent gotten the cov weapon?,"[65.01928951205403, 68.09703295966531]"
2960,2960,2020-10-02 15:59:10+00:00,learn an overhaul nj competitive energy market would force state ratepayers pay higher electric bills.,"[75.93762458446804, 55.318903464494745]"
2961,2961,2019-09-26 23:59:18+00:00,"swiftonsecurity sbsdiva adminkirsty thurrott maryjofoley bdsams mehedih ruthm pcper malwarejake jobcacka etguenni askwoody microsoft most welcome, has so crazy last months....","[9.402928017645483, 19.165094731903796]"
2962,2962,2019-09-26 23:58:46+00:00,msftdynamics join us as jamesmphillips other experts demo latest innovations msdyn microsoft powerplatform. register free,"[41.56101925971263, 41.191623779026095]"
2963,2963,2019-09-26 23:58:09+00:00,"i love very handy ha device holding thing ma bobs they stick onto back small device, making so much easier hold to &amp; brilliant keeping your headphones/small cables wrapped around neatly microsoft assisitvetechnology","[42.69749492498811, 55.6132489548553]"
2964,2964,2019-09-26 23:58:05+00:00,“i’m feeling “ apple twitch twitter microsoft cashapp ea thesims beatsbydre youtube bethesda twitch streaming streamer stream girlgamer gamergirl sefies vlogger youtube newyork…,"[29.203318626300597, 21.716222007766977]"
2965,2965,2019-09-26 23:58:02+00:00,check out microsoft teams your future phone system. convince otherwise… via linkedin,"[49.25201281113477, 49.473482194142285]"
2966,2966,2019-09-26 23:57:55+00:00,"ratchetcooper darkfist flames it would hinge on sony say tbh. microsoft cool letting ip smash, sony seems to be far less friendly. i keep dream alive though.","[52.28758763604824, 73.58759392113613]"
2967,2967,2019-09-26 23:57:31+00:00,"lugiboat i not sure it in exactly, yes. rare made banjo&amp;kazooie bought microsoft made previous nintendo ips microsoft ips.","[48.38961578737967, 40.708085092448414]"
2968,2968,2019-09-26 23:57:23+00:00,"microsoft, mastercard, hewlett foundation fund the cyberpeace institute defend public organizations, activists, others","[31.080621674002703, 31.879999197199407]"
2969,2969,2019-09-26 23:57:08+00:00,"xbox microsoft what up voice commands via mic removed?? i t want use digital assistance smart phone ""control"" xbox i want my features left alone stopremovingmyfeatures","[71.24442699186952, 49.1288092874069]"
2970,2970,2019-09-27 23:59:25+00:00,"microsoft dear microsoft mod ; program "" payment due date "" very dangerous.... the "" date yy;mm;dd must be start day year ... if didnt change day year ... payment due date... calculted since year ... best regards, nurhendratmoko ponorogo","[76.10465981732783, 54.502995819782065]"
2971,2971,2020-11-23 15:22:11+00:00,"do self manage databases premises today? read vexpert blog azizaqeelvm understand rds vmware help set up, operate, scale databases improve productivity lower costs.","[102.41215412411215, 65.71314470116451]"
2972,2972,2019-09-27 23:59:22+00:00,puzzled the many pieces microsoft excel? curious new hidden features? let create customized training plan your team dawn thesoftwarepro.com certifiedexcelexpert exceltips,"[70.86346119344154, 58.24695555857081]"
2973,2973,2019-09-27 23:58:38+00:00,where f &amp;k the battery bar my laptop go ️ windows help microsoft,"[14.943308823160752, 8.515440496066068]"
2974,2974,2019-09-27 23:58:26+00:00,i used make own pokemon microsoft paint... graphic design been passion,"[50.826197200015436, 44.719851502784735]"
2975,2975,2019-09-27 23:58:25+00:00,tech moves dave asprey steps as bulletproof ceo; microsoft names chief u.s. digital officer; accolade adds former microsoft cfo board,"[120.59693920453545, 120.45843193627343]"
2976,2976,2019-09-27 23:58:10+00:00,"random thought i wonder microsoft would allow koei tecmo/team ninja port the original ninja gaiden xbox switch. the sigma games i think recreations get around exclusivity deal be sony systems, were considered inferior iirc.","[102.21181058442214, 106.32660372324492]"
2977,2977,2019-09-27 23:58:09+00:00,"the company worse microsoft estimating times completion would hands be apple seriously, progress indicators rooted any kind reality &amp; should stick a spinning dingle hopper doesn t give false hope ‍️","[81.03746899390585, 38.00681961041676]"
2978,2978,2019-09-27 23:57:49+00:00,microsoft many retweets you send two aa batteries my xbox controller it’s working,"[39.6510891519396, 39.73283904731098]"
2979,2979,2019-09-27 23:56:20+00:00,fuck microsoft office my homies use libreoffice,"[19.14591254599183, 10.158347469112504]"
2980,2980,2019-09-27 23:55:46+00:00,im a master microsoft excel also i hate,"[6.2579365699576615, 22.84083804505969]"
2981,2981,2019-09-28 23:59:18+00:00,"upgrading office ? planning meeting conference? bring technology speaker &amp; microsoft certified trainer your next meeting, onsite training workshop, webinar add valuable software skills. message here at dawn thesoftwarepro.com","[99.78690341623825, 113.76821100212535]"
2982,2982,2020-11-23 15:22:11+00:00,"do self manage databases premises today? read vexpert blog azizaqeelvm understand rds vmware help set up, operate, scale databases improve productivity lower costs.","[102.41215412411215, 65.71314470116451]"
2983,2983,2019-09-28 23:59:11+00:00,halo guardians limitededition microsoft xbox one new sealed metal case ebay ends h last price usd .,"[51.72799548055419, 43.78958205001633]"
2984,2984,2019-09-28 23:59:05+00:00,"abki microsoft this allow people earn at top their profession, a non management capacity. only company i know that but i’m sure are more.","[24.96652730339888, 36.27509969794638]"
2985,2985,2019-09-28 23:58:45+00:00,richard stallman addresses speculation rumor about his appearance microsoft,"[17.41457660107096, 20.765000576560208]"
2986,2986,2019-09-28 23:58:35+00:00,microsoft reveals new attributes coming .net eweek,"[19.8202427085528, 19.387720720889043]"
2987,2987,2019-09-28 23:57:04+00:00,halo guardians limitededition microsoft xbox one new sealed metal case ebay ends h last price usd .,"[51.72799548055419, 43.78958205001633]"
2988,2988,2019-09-28 23:57:04+00:00,"stubeey thatmumbojumbo it video will uploaded sometime tomorrow i believe pm uk time? the minecraft channel. the pannels recorded a couple days advance, probably that mojang/microsoft media team could edit it.","[49.77351504991932, 63.05974669174956]"
2989,2989,2019-09-28 23:56:58+00:00,microsoft i need help i can’t get it. dm,"[6.636833379314521, 18.00844087871128]"
2990,2990,2019-09-28 23:56:53+00:00,"this windows update nightmare i t ask for... i mean, literally, laptop turned on started updating a few hours ago me there. it still at . i stuff i needed do today besides watch technology rebel thanks, microsoft.","[75.35158209808206, 30.074702561147266]"
2991,2991,2019-09-28 23:55:33+00:00,"phillipsj vcsjones it ok be fired up. at same time should acknowledge reality the .net ecosystem today. it easy paint microsoft a monolithic hive mind. i t believe is, the voices opinions inside organization diverse as the ones outside it.","[65.85278915509575, 59.739769856567314]"
2992,2992,2019-09-29 23:59:49+00:00,"luisvase despite geographically closer microsoft campus mile so, is probably a wash min i be walking to the subway stop my current commute.","[54.33174383457128, 50.87503260825688]"
2993,2993,2020-10-02 15:59:10+00:00,learn an overhaul nj competitive energy market would force state ratepayers pay higher electric bills.,"[75.93762458446804, 55.318903464494745]"
2994,2994,2019-09-29 23:59:25+00:00,"are upgrading microsoft office ? how you more productive office? bring productivity speaker &amp; microsoft certified trainer your next meeting, onsite training workshop, webinar. dm here at dawn thesoftwarepro.com office mct","[79.64496174686685, 79.42379821628049]"
2995,2995,2019-09-29 23:59:10+00:00,niteriem funfox mikauditore notsocombo bottomteccst thecjbrine bringbackbanjok plus i banjo fan thanks smash maybe within a few months.. i hope rare or microsoft decides let nintendo rare games maybe even cross play like minecraft for example sea thieves and such,"[60.230056014606355, 65.7805664968441]"
2996,2996,2019-09-29 23:58:15+00:00,windows problems ruining microsoft’s reputation – the damage can’t underestimated,"[20.247758126293757, 13.021869960726553]"
2997,2997,2019-09-29 23:58:07+00:00,meet year old microsoft specialist damilare akano,"[7.335265834207662, 8.257630526630903]"
2998,2998,2019-09-29 23:58:04+00:00,microsoft switches hardware bitlocker software encryption default ssds,"[41.86553649777, 42.65497852181357]"
2999,2999,2019-09-29 23:57:58+00:00,"cvpayne delisting chinese stocks would be disaster. it’s drop the bucket. apple, amazon, microsoft almost worth amount themselves.","[30.261450611191965, 27.76374066939808]"
3000,3000,2019-09-29 23:56:34+00:00,masterbismuth shouldn sony microsoft get sued keeping game as well?,"[21.328834182537502, 30.436077723900585]"
3001,3001,2019-09-29 23:56:32+00:00,"knownews tech microsoft, cisco talos discover malware campaign that turns pcs into “zombie proxies” a newly","[42.83324353673378, 44.99595119888633]"
3002,3002,2019-09-29 23:56:25+00:00,rosegoldnairad i’m calling microsoft,"[18.15810789244751, 9.58290173417614]"
3003,3003,2019-09-30 23:59:38+00:00,"kharlokong you forgot enchanted arms, has one the first openly gay/genderqueer party characters i remember a videogame lost odyssey, was microsoft studios sendup final fantasy one the best turn based rpgs i ever played.","[32.65935454253559, 39.62924090172118]"
3004,3004,2020-11-23 15:22:11+00:00,"do self manage databases premises today? read vexpert blog azizaqeelvm understand rds vmware help set up, operate, scale databases improve productivity lower costs.","[102.41215412411215, 65.71314470116451]"
3005,3005,2019-09-30 23:59:28+00:00,puzzled the many pieces microsoft excel? curious new hidden features? let create customized training plan your team dawn thesoftwarepro.com certifiedexcelexpert exceltips,"[70.86346119344154, 58.24695555857081]"
3006,3006,2019-09-30 23:59:19+00:00,"microsoft onedrive personal vault rolls worldwide, launches expandable storage","[32.88872676999451, 43.753590810481676]"
3007,3007,2019-09-30 23:58:33+00:00,surface everything know microsoft’s new,"[-2.296242443155566, -2.215002868894624]"
3008,3008,2019-09-30 23:58:33+00:00,surface everything know microsoft’s new,"[-2.296242443155566, -2.215002868894624]"
3009,3009,2019-09-30 23:58:33+00:00,surface everything know microsoft’s new computing news,"[8.214868729215326, 9.294564210056704]"
3010,3010,2019-09-30 23:58:09+00:00,microsoft surface could packing snapdragon chip cnet,"[29.73705969481976, 22.14456108616069]"
3011,3011,2019-09-30 23:58:06+00:00,jamiemoranuk shawn said... f &amp;k i’m microsoft making many next gen moves me keep up.,"[29.27609602529731, 33.669034267251405]"
3012,3012,2019-09-30 23:58:00+00:00,elon musk plan replicate human brain ai received bn microsoft,"[40.69178774126319, 32.151834890129244]"
3013,3013,2019-09-30 23:57:54+00:00,halo infinite microsoft used this very cute dog named gyoza to make sounds gamingnews,"[9.231155792591142, 25.224241484866337]"
3014,3014,2019-10-01 23:59:48+00:00,microsoft xbox one s battlefield military green specialedition bundle tb ebay limitededition ends h last price usd .,"[60.92021684303194, 62.65212487464217]"
3015,3015,2020-11-23 15:22:11+00:00,"do self manage databases premises today? read vexpert blog azizaqeelvm understand rds vmware help set up, operate, scale databases improve productivity lower costs.","[102.41215412411215, 65.71314470116451]"
3016,3016,2019-10-01 23:59:37+00:00,"nerdpyle has cringed you refer the microsoft ""campus""? i still struggling that looking a support group.","[18.393221750011744, 10.420071707501739]"
3017,3017,2019-10-01 23:59:25+00:00,microsoft barrage new surface products come into focus,"[28.491813195343124, 9.239480835508664]"
3018,3018,2019-10-01 23:59:17+00:00,puzzled the many pieces microsoft powerpoint? curious new features? let create customized training plan your team deliver better presentations dawn thesoftwarepro.com,"[83.12227184524644, 68.11644775562614]"
3019,3019,2019-10-01 23:59:14+00:00,"the convenience bellevue location truly unmatched seattle, redmond, kirkland all easy reach wa , major employers like microsoft the bellevue technology center less a mile away. discover our area","[93.42214393721638, 75.32303874307303]"
3020,3020,2019-10-01 23:59:10+00:00,xcloudtimdog let boil for pea brain months game pass games playstation it bucks with games see different think it gamepasses trash like microsoft trash everything microsoft trash sony dominate next gen,"[80.85004214170026, 90.15740102333771]"
3021,3021,2019-10-01 23:59:05+00:00,i achievements microsoft jigsaw win points trueachievements,"[9.6711298845679, 19.020148792665275]"
3022,3022,2019-10-01 23:59:04+00:00,i the strive perfection achievement microsoft solitaire collection uwp points trueachievements,"[23.78027474950886, 54.65874089719774]"
3023,3023,2019-10-01 23:59:02+00:00,microsoft considering bringing chromium based edge linux,"[39.97802127350051, 32.13121560292651]"
3024,3024,2019-10-01 23:59:00+00:00,ghostgaming trpped microsoft innocents aydan assauit zzdmo ghost bizzle ghostsaf seanpcc kayuun where ya looking buddy trpped,"[41.812128067889155, 40.01319733246016]"
3025,3025,2019-10-02 23:59:55+00:00,"yes, microsoft phone really happening introducing surface duo","[29.535836787292567, 21.76843966569659]"
3026,3026,2020-11-25 17:06:25+00:00,learn the new cloud like way manage premise databases this depth article rds on vmware cloud solution architect blogger satyashr,"[64.00006532285462, 84.31429844722402]"
3027,3027,2019-10-02 23:59:45+00:00,mixer co founder james boehm departs microsoft with a vision to empower and engage communities and creators | mkau gaming mixer jamesboehm microsoft,"[84.96082243769192, 67.98424306395222]"
3028,3028,2019-10-02 23:59:28+00:00,"planning meeting conference? bring technology speaker &amp; microsoft certified trainer mct your next meeting, onsite training workshop, webinar add valuable software skills. message here at dawn thesoftwarepro.com conferencespeaker techspeaker","[100.55868095389114, 113.82771743401075]"
3029,3029,2019-10-02 23:59:22+00:00,one my favorite features microsoft office outlook emailclient report phishing email.,"[53.21116233434642, 32.72829058042486]"
3030,3030,2019-10-02 23:59:15+00:00,microsoft surface phone dual screen android,"[28.156976163010764, 9.877681680120466]"
3031,3031,2019-10-02 23:59:13+00:00,whoa behold new microsoft surface pro vr headset,"[20.00256426534676, 19.387720720889046]"
3032,3032,2019-10-02 23:59:10+00:00,"in great debate ipadpro v surfacepro professionals rely microsoft office suite multi tasking, surface wins a country mile. from apple fan, credit it’s due don’t regret switching surface uk surfacepro windows","[64.68076202119906, 53.477054925096844]"
3033,3033,2019-10-02 23:58:58+00:00,"ima real, i’m excited microsoft’s new form factor lineup next year. i might buy of them, that nintendo ds style phone exactly i’ve waiting since smartphones took off. it looks like great concept. i hope takes off.","[47.29726857717656, 54.34486941615214]"
3034,3034,2019-10-02 23:58:53+00:00,"we knew trash s we ever needed know, sony was their well microsoft did a poor job microsoft decided start gamepass ps wasn relevant enough compete, should seen coming sony to beg azure","[24.84167954494409, 66.57972722129435]"
3035,3035,2019-10-02 23:58:51+00:00,did see the new microsoft devices announced? here a great rundown mkbhd microsoft surface family impressions,"[41.712849067740905, 37.215212300082555]"
3036,3036,2019-10-03 23:59:58+00:00,"top story microsoft shows surface duo, android phone, two screen neo pc , see","[37.44635760423569, 15.645679070818735]"
3037,3037,2020-11-25 17:06:25+00:00,learn the new cloud like way manage premise databases this depth article rds on vmware cloud solution architect blogger satyashr,"[64.00006532285462, 84.31429844722402]"
3038,3038,2019-10-03 23:59:57+00:00,"natwest bank uses artificialintelligence predict future. working microsoft &amp; dreamquark simulate future behavior mortgages &amp; sme loans, natwest be able better identify potential risks/opportunities fintech ai industry","[66.67950381690953, 73.8572659641392]"
3039,3039,2019-10-03 23:59:22+00:00,"top story the key a data driven culture timely insights | blog | microsoft azure , see","[40.07637176086195, 52.47720414745677]"
3040,3040,2019-10-03 23:59:19+00:00,yesterday microsoft announced surface duo mi drop offa mi chair work,"[64.33737685539138, 56.96367336706892]"
3041,3041,2019-10-03 23:59:10+00:00,microsoft unveils new smartphone surface duo technology,"[32.562892931578354, 22.278092478785208]"
3042,3042,2019-10-03 23:58:51+00:00,djmnts iamwill microsoft soft years you rep with microsoft xbox gamertag... genius,"[30.145097002365876, 47.96758929695245]"
3043,3043,2019-10-03 23:58:42+00:00,drop ur favorite video games all time. videogame xbox gamecube nintendo microsoft,"[42.25698021621332, 37.477770975304814]"
3044,3044,2019-10-03 23:58:35+00:00,"day , using microsoft teams communicate students provide links the websites use often sf edtechguy thejaydubs educwhiting","[60.71720835978633, 70.91149995082097]"
3045,3045,2019-10-03 23:58:16+00:00,"novartis, microsoft partner use artificial intelligence drug research","[21.366898995102996, 31.28618708971586]"
3046,3046,2019-10-03 23:57:32+00:00,gokustomps microsoft yeah go the ghost reacon trailer they’re holding ps controllers,"[37.61743152515184, 36.59350540533439]"
3047,3047,2019-10-04 23:59:37+00:00,"microsoft ""the accounts one the us election headquarters, us government officials, american media employees, prominent iranians living other countries been subjected the cyber attack involving hackers subordinate iranian authorities.""","[103.64000172412919, 89.29768553146147]"
3048,3048,2020-11-23 15:22:11+00:00,"do self manage databases premises today? read vexpert blog azizaqeelvm understand rds vmware help set up, operate, scale databases improve productivity lower costs.","[102.41215412411215, 65.71314470116451]"
3049,3049,2019-10-04 23:59:35+00:00,"all "" microsoft surface laptops models intel processors? i really getting amd flavoured surface laptop, i don like "" form factor rip","[63.289751258981575, 37.449734475941376]"
3050,3050,2019-10-04 23:59:31+00:00,puzzled the many pieces microsoft outlook? curious new hidden features? let create customized training plan your team dawn thesoftwarepro.com certifiedoutlookexpert outlooktips,"[70.86346119344154, 58.24695555857081]"
3051,3051,2019-10-04 23:59:25+00:00,microsoft iran linked hacking group tried compromise us presidential candidate. breakingnewsnow breaking news breakingnews breakingnewz breakingnow breaking uspresidentialcandidate uspresidentialcandidate compromised compromise compromised compromise,"[49.87139127787193, 44.35058954978239]"
3052,3052,2019-10-04 23:59:23+00:00,microsoft iran linked hacking group tried compromise us presidential candidate. breakingnewsnow breaking news breakingnews breakingnewz breakingnow breaking uspresidentialcandidate uspresidentialcandidate compromised compromise compromised,"[49.87139127787193, 44.35058954978239]"
3053,3053,2019-10-04 23:59:21+00:00,microsoft iran linked hacking group tried compromise us presidential candidate. breakingnewsnow breaking news breakingnews breakingnewz breakingnow breaking iranhackinggroup hacking hackers hacker hacked hack hackinggroup iranian iranians compromise,"[82.29939598174737, 57.761615816576175]"
3054,3054,2019-10-04 23:59:20+00:00,microsoft iran linked hacking group tried compromise us presidential candidate. breakingnewsnow breaking news breakingnews breakingnewz breakingnow breaking uspresidentialcandidate uspresidentialcandidate presidentialcandidate msft microsoft iran,"[60.14424687501904, 54.623445146929505]"
3055,3055,2019-10-04 23:59:18+00:00,microsoft iran linked hacking group tried compromise us presidential candidate. breakingnewsnow breaking news breakingnews breakingnewz breakingnow breaking uspresidentialcandidate uspresidentialcandidate presidentialcandidate presidentialcandidate ms,"[59.55646021011693, 44.67101029971246]"
3056,3056,2019-10-04 23:59:16+00:00,microsoft iran linked hacking group tried compromise us presidential candidate. breakingnewsnow breaking news breakingnews breakingnewz breakingnow breaking uspresidentialcandidate uspresidentialcandidate presidentialcandidate presidentialcandidate,"[49.87139127787193, 44.35058954978239]"
3057,3057,2019-10-04 23:59:03+00:00,attachment extensions carrying malware banned on microsoft outlook,"[42.24137773594634, 33.047809464523674]"
3058,3058,2019-10-05 23:59:28+00:00,"upgrading new program? planning meeting conference? hire a microsoft certified trainer bring valuable software tips &amp; techniques your next meeting, onsite training workshop webinar. message here at dawn thesoftwarepro.com productivity mct","[87.57158054425783, 90.42346600753332]"
3059,3059,2020-11-23 15:22:11+00:00,"do self manage databases premises today? read vexpert blog azizaqeelvm understand rds vmware help set up, operate, scale databases improve productivity lower costs.","[102.41215412411215, 65.71314470116451]"
3060,3060,2019-10-05 23:59:11+00:00,"i becoming quite proficient a self taught way e.g. google analytics, skype, viber,some microsoft stuff,but kept changing things &amp; i couldn keep with it. uninstall,reinstall,download new &amp; that,re set passwords,this ap needs ap technologynews","[57.981230270966286, 65.7523965028964]"
3061,3061,2019-10-05 23:58:45+00:00,"in multi part ""tutorial"", build single server sharepoint server farm inside subnet microsoft azure virtual network. the purpose this server be development testing as a basis demonstrating s... ke","[112.24139002817869, 53.12836812008744]"
3062,3062,2019-10-05 23:58:44+00:00,"in multi part ""tutorial"", build single server sharepoint server farm inside subnet microsoft azure virtual network. the purpose this server be development testing as a basis demonstrating s... ke","[112.24139002817869, 53.12836812008744]"
3063,3063,2019-10-05 23:58:44+00:00,"in multi part ""tutorial"", build single server sharepoint server farm inside subnet microsoft azure virtual network. the purpose this server be development testing as a basis demonstrating s... ke","[112.24139002817869, 53.12836812008744]"
3064,3064,2019-10-05 23:57:30+00:00,"python beginners, demo using numbers python, video microsoft developers youtube page. microsoftdeveloper pythonforbeginners learntocode postdays python","[71.74528231783565, 73.68621659125346]"
3065,3065,2019-10-05 23:57:25+00:00,microsoft xbox one white xbox one s controller w/ mm headphone jack ebay ends h last price usd .,"[59.10143824799277, 61.32435587935057]"
3066,3066,2019-10-05 23:57:14+00:00,"microsoft onedrive personal vault rolls worldwide, launches expandable storage","[32.88872676999451, 43.753590810481676]"
3067,3067,2019-10-05 23:56:59+00:00,just earned intro microsoft teams the microsoft educator center preview you check free pd courses too. microsoft microsoft microsoftng via microsoftedu,"[91.18598165999795, 109.82827419051054]"
3068,3068,2019-10-05 23:56:33+00:00,"microsoft unveils airpods rival, surface earbuds","[9.10902772692251, 9.898469750966079]"
3069,3069,2019-10-06 23:59:48+00:00,artbaesel is microsoft pod? lol,"[8.543960384185453, 8.355843416501669]"
3070,3070,2020-11-25 17:06:25+00:00,learn the new cloud like way manage premise databases this depth article rds on vmware cloud solution architect blogger satyashr,"[64.00006532285462, 84.31429844722402]"
3071,3071,2019-10-06 23:59:46+00:00,microsoft chief brad smith says rise killer robots unstoppable do you know him? via telegraphtech,"[73.72663253566252, 84.95348662731143]"
3072,3072,2019-10-06 23:59:32+00:00,puzzled the many pieces microsoft powerpoint? curious new features? let create customized training plan your team deliver better presentations dawn thesoftwarepro.com,"[83.12227184524644, 68.11644775562614]"
3073,3073,2019-10-06 23:59:25+00:00,warnings issued for millions of microsoft windows users,"[29.795616356065754, 29.77554168502891]"
3074,3074,2019-10-06 23:59:21+00:00,"commodoreblog stay strong, despise stinking microsoft.","[-2.595634829251365, -1.7885661516390858]"
3075,3075,2019-10-06 23:58:52+00:00,dret microsoft microsoftteams i impressed you surprised,"[10.054931292425415, 10.182091814730567]"
3076,3076,2019-10-06 23:58:33+00:00,microsoft massive risks and radical rewards behind new surface duo,"[19.051959060154164, 11.952630024338346]"
3077,3077,2019-10-06 23:58:18+00:00,alex pedroza doesn’t know to use microsoft when i asked what writes school papers she said pages,"[35.39486650684184, 39.13617029175392]"
3078,3078,2019-10-06 23:58:03+00:00,"join people right at ""new microsoft patent shows a floor mat your virtual reality experiences | techradar"" cheers technology tech mobile experiences techradar microsoft reality virtual patent floor shows news","[127.83709401912593, 106.92821166416164]"
