,Time,Text
0,2018-12-31 23:59:56+00:00,"our latest podcast out. our tech predictions the impromptu video microsoft apple, sony, more. will facebook get hit massive gdpr fine? and a deep dissection how facebook moderates platform. podcast technology"
1,2020-10-02 15:59:10+00:00,learn an overhaul nj competitive energy market would force state ratepayers pay higher electric bills.
2,2018-12-31 23:59:04+00:00,new ebay microsoft xbox one s gb white console
3,2018-12-31 23:58:46+00:00,jrno microsoft xbox bethesdastudios fallout xboxsupport the point anyways that charge backs get account banned. so a warning.
4,2018-12-31 23:58:35+00:00,windowscentral why make articles device specific? why just say windows tablet laptop doesn have ethernet port??? you receive cheque microsoft time mention devices what?
5,2018-12-31 23:58:00+00:00,"see signal alliance, microsoft, cisco teaming to help enterprises nigeria improve profitability azure stack"
6,2018-12-31 23:57:57+00:00,avalanchetwitch dawgg got microsoft powerpoint webcam
7,2018-12-31 23:57:55+00:00,"need wake call , i sick microsoft shit , have gotten away pissing off screwing over far long , time something done soon satisfy someone someone please , i be successful something t get my way"
8,2018-12-31 23:57:48+00:00,"join microsoft graph security hackathon use microsoft graph security api solve challenges integrating different solutions, tools, intelligence. , cash prize pool for grabs. graphsecurityhackathon"
9,2018-12-31 23:57:44+00:00,"davekawula sifusun microsoft veeam mvpdays thank for support i hope had happy christmas will a fantastic new year, happy holidays"
10,2018-12-31 23:57:10+00:00,devops overview microsoft azure
11,2019-01-01 23:59:44+00:00,new job business sales specialist jobs bc vancouver sale company microsoft location bur
12,2020-09-03 18:26:48+00:00,"lenovo legion x playapex now your chance rise the rest. unmatched performance, purposeful engineering, modern design. gear with machine savage you are. stylish outside. savage inside."
13,2019-01-01 23:59:42+00:00,"microsoft xboxsupport xbox i’d like know i would need buy prepaid card renew membership middle december i already paid renew the rd, shown on this heavily censored card statement. i wouldn’t, bc i didn’t.. wtf?"
14,2019-01-01 23:59:41+00:00,help get first ever montage views would mean world mixerstreamersunite lionsdenmixer ignore tags xbox microsoft…
15,2019-01-01 23:59:05+00:00,"tln’s creator saying studio “massive business, legal &amp; funding issues” sounds lot like “microsoft pulled plug i publicly hate women”."
16,2019-01-01 23:58:34+00:00,"""there nothing amusing aboutmit’s psychotic bot norman microsoft’s fascist tay.technologists falling the trap considering ai systems make decisions analogous children, playing dolls marveling their dolly speaking"""
17,2019-01-01 23:58:28+00:00,"reuters terrapower llc, nuclear energy venture chaired microsoft corp co founder bill gates, seeking new partner early stage trials its technology new u.s. rules forced to abandon agreement china, company officials told wsj"
18,2019-01-01 23:58:12+00:00,anikakokatayy babysnitchery ......most people i know smart ass programmers microsoft are indian this girl just??? ?? ?????????????
19,2019-01-01 23:57:51+00:00,"passcod eevee case point, microsoft offered automatically translate from romanian. it failed, it already english."
20,2019-01-01 23:57:49+00:00,"“for intents purposes, we’re years year process moving analog digital,” said tim bajarin, a longtime tech consultant companies including apple, ibm microsoft. digitaldisruption futureofwork"
21,2019-01-01 23:57:22+00:00,", year nuetral youtube gamers talk how microsoft changing brand."
22,2019-01-02 23:59:51+00:00,simonj neo “microsoft included separate software the office software [on desktop computers] regularly sends telemetry data its servers the united states.”
23,2020-09-03 18:26:48+00:00,"lenovo legion x playapex now your chance rise the rest. unmatched performance, purposeful engineering, modern design. gear with machine savage you are. stylish outside. savage inside."
24,2019-01-02 23:59:13+00:00,maburgosjr xbox microsoft should’ve looked the reviews youtube buddy fuckedyourself finessed
25,2019-01-02 23:58:00+00:00,rt pzerger join insider program the coming chrome powered microsoft edge windows browser
26,2019-01-02 23:57:45+00:00,visionary fatkittyrun dayz well test patches the system obviously it easier implement pc don have jump microsoft sony hoops kind common knowledge days consoles have very strict restrictions updates
27,2019-01-02 23:57:39+00:00,the grand tour game pre order ./£. via microsoft store
28,2019-01-02 23:57:24+00:00,windows finally surpasses windows the popular operating system from tomcnamara microsoft microsoft windows
29,2019-01-02 23:57:18+00:00,"simonj neo if company uses microsoft office even a desktop , are sharing contents the data documents. of course part used improving spell checking etc. one to remember that there not real privacy office suite."
30,2019-01-02 23:57:15+00:00,dirty tech microsoft board member caught funding dems&amp; ; anti roy moore operation
31,2019-01-02 23:57:06+00:00,"edzitron the photos app do that. yup, makes sense. you also find old windows movie maker windows essentials suite, microsoft really t want to know existed."
32,2019-01-02 23:56:55+00:00,chrome adapt the theme the windows interface. microsoft browser not this
33,2019-01-03 23:59:47+00:00,"the trump train leslieforlife from opensecrets university california , soros , lawyers , &amp; microsoft some the democrat party top donors"
34,2020-11-25 17:06:25+00:00,learn the new cloud like way manage premise databases this depth article rds on vmware cloud solution architect blogger satyashr
35,2019-01-03 23:59:36+00:00,"stickyatmosfear microsoft yeah come across a lot, thieving companies the worst it comes customer service"
36,2019-01-03 23:59:34+00:00,"microsoft releasing new feature powerpoint skype , allow individuals hearingloss more easily follow presentations audio calls microsoft adding real time captions powerpoint skype"
37,2019-01-03 23:59:02+00:00,"microsoft research testing “bali,” way users manage “all data collected them” onmsft data privacy a quite big topic last year the grpd eu law coming effect, various facebook related scandals, more. just last month, m"
38,2019-01-03 23:58:58+00:00,"microsoft research testing “bali,” way users manage “all data collected them” onmsft data privacy a quite big topic last year the grpd eu law coming effect, various facebook related scandals, more. just last month, m"
39,2019-01-03 23:58:50+00:00,tensoftinc want implement microsoft dynamics business central? choose implementation plan best suited your business needs. learn here. msdynbc msdyn
40,2019-01-03 23:58:47+00:00,"pc, microsoft, sony still t figured how make system brings people together like nintendo does."
41,2019-01-03 23:58:40+00:00,microsoft and amazon add ontology ont to its cloud computing marketplaces data center
42,2019-01-03 23:58:21+00:00,"microsoft privately testing bali, way to give users control data collected about them"
43,2019-01-03 23:58:16+00:00,maureenjohnson microsoft t translate but say s dutch. hope helps.
44,2019-01-04 23:59:57+00:00,tegomass derpyeon ...microsoft translate saying
45,2020-11-23 15:22:11+00:00,"do self manage databases premises today? read vexpert blog azizaqeelvm understand rds vmware help set up, operate, scale databases improve productivity lower costs."
46,2019-01-04 23:59:49+00:00,really envy people knows to use microsoft excel
47,2019-01-04 23:59:24+00:00,"just bought office home bring family microsoft goodness. extremly frustrated see i t use own domain outlook, without to transfer to godaddy is rediculously expensive especially a domain i already registered ."
48,2019-01-04 23:59:21+00:00,xbox microsoft why you guys t thoroughly check really at fault banning suspendeding gamers. some gamers get upset certain people like choose ignore toxic messages gamers do do? they want report you.
49,2019-01-04 23:59:16+00:00,"check new microsoft surface laptop intel core gb ram, gb dag colors ebay"
50,2019-01-04 23:59:01+00:00,"chupacaubrey i t believe literally asking people pause button added, you should add it. something simple you t it, this happens microsoft buys a game? notch designed pause button already, add dont be lazy."
51,2019-01-04 23:58:55+00:00,"microsoft, twitter pinterest ? accounts been hacked into. set cunts."
52,2019-01-04 23:58:39+00:00,"shawnblanc you might actually looking microsoft onenote. you drop images, links etc, use pen tool apple pencil, it infinite canvas, extend and across no limit i’ve found"
53,2019-01-04 23:58:33+00:00,"rt ontologynetwork binance st blockchain week in singapore month ontology be microsoft, goldman sachs, pwc, more. rt followers with binanceblockchainweek we give away free discounted tickets o…"
54,2019-01-04 23:58:25+00:00,"the microsoft implementation cmg cdp sccm cost total for month november. that approx , laptop devices will managed regardless whether are prem not."
55,2019-01-05 23:59:56+00:00,"ai microsoft, google use artificial intelligence fight hackers"
56,2020-09-03 18:26:48+00:00,"lenovo legion x playapex now your chance rise the rest. unmatched performance, purposeful engineering, modern design. gear with machine savage you are. stylish outside. savage inside."
57,2019-01-05 23:59:20+00:00,racheljwillie i fear spreadsheets. my concession professionalism year been make microsoft word document rather doing sums hand...
58,2019-01-05 23:59:05+00:00,"kimdotcom pls, keep tweet alive. we been warned snowden, we still processing full extent brutal unconstitutional invasion our privacy, growing business our personal information run fb, google, amazon, microsoft, many smaller players."
59,2019-01-05 23:57:42+00:00,"jurassic world evolution microsoft xbox one, brand new and sealed game ebay ends h last price usd ."
60,2019-01-05 23:57:40+00:00,"""instead spending hours cycling a list brain teasers ‘gotcha’ questions, microsoft essentially puts candidates work a single problem throughout day."""
61,2019-01-05 23:57:35+00:00,or you could win other great prizes microsoft xbox s gaming console bose soundsport wireless headphones pepsi branded football
62,2019-01-05 23:56:41+00:00,titaniamcgrath microsoft it’s official.
63,2019-01-05 23:56:40+00:00,new ebay microsoft xbox one s minecraft limited edition tb extra controller
64,2019-01-05 23:56:27+00:00,"three ways brands benefit adopting voice technology aapl, amzn, googl, msft voice assistants like amazon alexa, google assistant, apple siri, microsoft cortana, pegged trigger widespread transformation across retail industry the years …"
65,2019-01-05 23:56:16+00:00,nowthisnews could help with microsoft operating system?
66,2019-01-06 23:59:57+00:00,watching microsoft “cupcake” commercial nflplayoffs reminds one the few bright spots following the redskins the past years — listening rak talk. what set pipes
67,2020-11-23 15:22:11+00:00,"do self manage databases premises today? read vexpert blog azizaqeelvm understand rds vmware help set up, operate, scale databases improve productivity lower costs."
68,2019-01-06 23:59:52+00:00,"intriguing. and, ms track ppl on site? microsoft quietly testing project aims hand people complete control their online data"
69,2019-01-06 23:58:41+00:00,"check this amazon deal microsoft surface pro intel core i, gb r... microsoft a best class laptop versatility a studio tablet more power — with the new th generation intel core processor"
70,2019-01-06 23:58:00+00:00,paullaw microsoft probably because fat a depreciated file system a gb file size limit was obsolete nearly years ago? guessing windows / linux / playstation interop?
71,2019-01-06 23:57:55+00:00,microsofthelps through microsoft store
72,2019-01-06 23:57:46+00:00,microsoft reveals new surface lineup amazonwebservices
73,2019-01-06 23:57:28+00:00,bissonhunter hello there. thanks bringing to attention. may first verify you purchasing via xbox store through microsoft store website? iris
74,2019-01-06 23:57:21+00:00,"one curious abilities the surface laptop the ability run windows pro. while the marketing microsoft’s lightweight laptop focused mainstream personal use, pro powered surface laptop attractive enterprise customers."
75,2019-01-06 23:57:08+00:00,bbc future microsoft it’s pity the photos your otherwise fascinating piece obscured the text; two pics each page visible
76,2019-01-06 23:56:32+00:00,microsoft next gen strategy leaks why sony quiet? – the primal podcast anaconda diskless halo infinite
77,2019-01-07 23:59:59+00:00,"now hiring attorney investigator microsoft redmond, wa legaljobs lawjobs inhousecounsel"
78,2020-10-02 15:59:10+00:00,learn an overhaul nj competitive energy market would force state ratepayers pay higher electric bills.
79,2019-01-07 23:59:52+00:00,kroger microsoft partner connected store pilot
80,2019-01-07 23:59:33+00:00,i liked youtube video permanently activate microsoft office pro plus without software &amp; product
81,2019-01-07 23:59:33+00:00,microsoft announces unlimited private repos github free
82,2019-01-07 23:59:25+00:00,sophielipstein microsoft well get em next time
83,2019-01-07 23:59:08+00:00,i liked youtube video create bookkeeping spreadsheet using microsoft excel part
84,2019-01-07 23:59:03+00:00,microsoft tweeting mino talent using ipad pro send stuff he surely make something great it 미노 위너 송민호 winner mino
85,2019-01-07 23:58:33+00:00,foxnews the use microsoft is where finkd white plains ny use the facebook pages with the socialmediatraining erdal ozkaya heartbleed wormhole blamed the lizard squad. the use msft the ebay ocs amazon prime xbox who
86,2019-01-07 23:58:33+00:00,is the future retail? we checked the new high tech grocery store microsoft kroger
87,2019-01-07 23:58:28+00:00,aviatorchilly tdshuff twitch shame isn streaming microsoft flight sim x oh well
88,2019-01-08 23:59:35+00:00,decafjedi microsoft took swing this but looks pleasurable tbh
89,2020-11-23 15:22:11+00:00,"do self manage databases premises today? read vexpert blog azizaqeelvm understand rds vmware help set up, operate, scale databases improve productivity lower costs."
90,2019-01-08 23:59:17+00:00,"cve an information disclosure vulnerability exists the microsoft exchange powershell api grants calendar contributors view permissions intended, aka ""microsoft exchange information disclosu..."
91,2019-01-08 23:59:12+00:00,"/bbcwbr] update amazon is the world most valuable public company amazon, formed years ago, eclipsed microsoft become world most valuable listed company. the online giant worth bn £bn the us stock market closed mo…"
92,2019-01-08 23:59:00+00:00,former microsoft cio jim dubois sat with emergetbm talk his new book how companies need embrace risk more inclusive corporate cultures digital transformation to succeed.
93,2019-01-08 23:58:36+00:00,new ebay microsoft xbox one s tb nba k console bundle white
94,2019-01-08 23:58:32+00:00,"free webinar make switch skype business microsoft teams end user guidance january , , – pm ct designed skype business users. register today msftadvocate"
95,2019-01-08 23:58:26+00:00,microsoft’s redmond campus modernization update demolition begins
96,2019-01-08 23:58:13+00:00,"ayebarney hell man, microsoft paint come long way. one dream though"
97,2019-01-08 23:58:07+00:00,time running did know support microsoft windows windows server ends january ?
98,2019-01-08 23:58:01+00:00,"next week nrf new york city will showcasing microsoft dynamics retail operations, alongside capaxglobal booth . read latest blog further details . hitachisolutions microsoft"
99,2019-01-09 23:59:49+00:00,chanezon microsoft azure azureadvocates sogrady wow thanks patrick. i t know to say. that uncommon kind. we just always believed developers matter should treated accordingly.
100,2020-11-23 15:22:11+00:00,"do self manage databases premises today? read vexpert blog azizaqeelvm understand rds vmware help set up, operate, scale databases improve productivity lower costs."
101,2019-01-09 23:59:44+00:00,"razer microsoft consoles mainly bought used affordability, price tag ain’t gonna go well."
102,2019-01-09 23:59:41+00:00,"rt mscloud ""microsoft plans open first middle east data centers the uae, offering unprecedented opportunity digitaltransformation the region. learn """
103,2019-01-09 23:59:07+00:00,microsoft teams getting added support firstline workers
104,2019-01-09 23:59:05+00:00,jacqui murielwickenden madeleine maz sashaclarkson trebornaeth frederickone le bold ditterhansen ernnutt hrhtudor funny orchestra plays microsoft windows waltz via youtube
105,2019-01-09 23:58:59+00:00,xbox game pass quests award microsoft rewards points
106,2019-01-09 23:58:50+00:00,temporary microsoft employees get email adresses a dash the . people referred as dash trash internally.
107,2019-01-09 23:58:14+00:00,"icoclast hey, shakti. we happy hear made switch which microsoft edge features your favorite far? microsoftedge"
108,2019-01-09 23:58:08+00:00,call text jeff .six.four great condition ” imac macos sierra intel core .ghz quad core gb ram tb hdd amd radeon hd m facetime hd camera wifi &amp; bluetooth microsoft office audio amazing comes mouse &amp; keyboard
109,2019-01-09 23:58:07+00:00,xbox boss talks partnership with amd future platforms microsoft’s head gaming phil spencer alluded future xbox platforms running amd tech a keynote address ces .
110,2019-01-10 23:59:46+00:00,amazon developing new game streaming service compete microsoft google
111,2020-11-25 17:06:25+00:00,learn the new cloud like way manage premise databases this depth article rds on vmware cloud solution architect blogger satyashr
112,2019-01-10 23:59:41+00:00,silver badge earned microsoft sudoku share game progress your friends i got silver badge in the daily challenges microsoft sudoku earn enough coins you get one
113,2019-01-10 23:59:30+00:00,"ronnochamilton bungie majornelson xboxp halos done, bungie ended with reach, microsoft other plans. look how halo ended, concluded story."
114,2019-01-10 23:58:52+00:00,"check our next event "" week digital transformation microsoft power bi"" eventbrite"
115,2019-01-10 23:58:33+00:00,how microsoft lost web
116,2019-01-10 23:58:22+00:00,rt satyanadella introducing new capabilities microsoft teams empower more billion firstline workers around world do best work via carainholland
117,2019-01-10 23:58:14+00:00,"mooch mooch bungie returned home, would still released destiny playstation? will ponies accept if were back the first party lineup microsoft? i would like see other projects want do addition destiny"
118,2019-01-10 23:58:09+00:00,"microsoft launches xbox game pass quests, giving players chance earn rewards for…"
119,2019-01-10 23:58:04+00:00,amazon developing new game streaming service compete microsoft google
120,2019-01-10 23:57:27+00:00,"microsoft xbox today a good day. goodbye s, hello x"
121,2019-01-11 23:59:33+00:00,"mary ligialeea cher bad illegals come in thru canada &amp; on planes, don walkin the clothes their backs seeking asylum which is illegal. immigration the lowest history, immigrants pay more taxes than rump, google, amazon, microsoft, apple &amp; all big business who pay ""no taxes"""
122,2020-10-07 16:05:12+00:00,sign petition tell nj officials oppose energy monopoly new jersey.
123,2019-01-11 23:59:25+00:00,"exclusive microsoft, google, and apple to implement live device access within months alexjones closersangels closernation"
124,2019-01-11 23:59:21+00:00,seattle home world most valuable companies amazon &amp; microsoft via /r/technology
125,2019-01-11 23:58:44+00:00,"microsoft linkedin report card technology integration continues, at slow pace zdnet general physics laboratory gpl microsoft linkedin report card technology integration continues, at slow ..."
126,2019-01-11 23:58:42+00:00,"starwars battlefront ii microsoft xbox one, , battlefront , mint ebay ends h last price usd ."
127,2019-01-11 23:58:37+00:00,check medalofhonor risingsun xbox disc only original microsoft via ebay
128,2019-01-11 23:58:33+00:00,got couple gifts myself my st birthday. thought i would treat myself. microsoft xboxonex projectscorpion xbox microsoft dragonballz primitiveskate foreverflyskate thanks…
129,2019-01-11 23:58:04+00:00,"microsoft patchday other updates january ,"
130,2019-01-11 23:58:00+00:00,rt pzerger microsoft business gets self service password reset writeback infosec
131,2019-01-11 23:57:07+00:00,my new favorite tech accessory my microsoft surface pro &amp; surface book. ever wish could carry external battery laptop? with batpower proe you recharge your surface to x depending model &amp; version worksgreat powergo
132,2019-01-12 23:59:33+00:00,"and clarify the first one. i sketched it, scanned and proceeded run through microsoft paint. and i was mouse."
133,2020-10-02 15:59:10+00:00,learn an overhaul nj competitive energy market would force state ratepayers pay higher electric bills.
134,2019-01-12 23:59:01+00:00,improvements education vital the future – interview microsoft leader via global female
135,2019-01-12 23:58:50+00:00,gnu/linux spyware scandals may back it’s about canonical amazon linspire microsoft ; microsoft meanwhile exposing innocent kids pedophiles it refuses explain defend
136,2019-01-12 23:58:24+00:00,"tyrannicon ninja gaiden black, digital xbox one. . straight the microsoft store."
137,2019-01-12 23:57:53+00:00,richplaysstuff microsoft u
138,2019-01-12 23:57:32+00:00,check the new post life cycle services join us a workshop data privacy compliance microsoft technology centers the us microsoft gdpr dynamics
139,2019-01-12 23:57:11+00:00,new video twenty five | microsoft sam reads funny windows errors sep
140,2019-01-12 23:57:06+00:00,"kntimofeev just microsoft word, using highlight tool. super easy"
141,2019-01-12 23:56:56+00:00,"and well good, even though trump sitting the wh pretty much directly traceable dnc/dccc sitting room alone deciding was someone s turn getting phished like a flounder emails. hello, microsoft. you having e mail troubles, da? /"
142,2019-01-12 23:56:12+00:00,reason attend spcna connect microsoft product teams &amp; tons other industry experts get real answers your sharepoint questions use discount code maio get your conference registration see there...
143,2019-01-13 23:59:54+00:00,"microsoft finds way reduce hololens part count, cost amazonwebservices"
144,2020-11-25 17:06:25+00:00,learn the new cloud like way manage premise databases this depth article rds on vmware cloud solution architect blogger satyashr
145,2019-01-13 23:59:05+00:00,"abeg morrie johnnywboxing tcatalfo finally inside microsoft, cant complain my seats. u cant beat free."
146,2019-01-13 23:58:23+00:00,"was hoping be scheduled work laker game instead, i scheduled work boxing match microsoft theater.... didn’t feel like going work anymore lol of course have working stage ring all the action happening lol"
147,2019-01-13 23:58:13+00:00,"racismdog for reason, microsoft translated tweet malay."
148,2019-01-13 23:58:03+00:00,tyler casper buy microsoft apple stock place huge bet the jets super bowl
149,2019-01-13 23:57:43+00:00,i liked youtube video microsoft issues big warning to xbox one owners this is bad for all consoles
150,2019-01-13 23:56:51+00:00,yuihskyrim microsoft translate sucks
151,2019-01-13 23:56:03+00:00,[poc] com xsl transformation bypassing microsoft application control solutions cve
152,2019-01-13 23:56:01+00:00,long live microsoft word paper clip need very own? we got all supplyme
153,2019-01-13 23:55:44+00:00,"clippy may gone microsoft office, the endearing, albeit distracting, virtual assistant certainly forgotten.⁣ ⁣⁣ for many people, tossing paperclip a single use…"
154,2019-01-14 23:59:59+00:00,i the gate crasher achievement microsoft wordament mobile trueachievement points
155,2020-10-02 15:59:10+00:00,learn an overhaul nj competitive energy market would force state ratepayers pay higher electric bills.
156,2019-01-14 23:59:44+00:00,"i must admit among microsoft pathetic software offerings, windows a decent operating system."
157,2019-01-14 23:59:37+00:00,the president microsoft says top leaders the world’s biggest tech companies meet regularly talk the major issues facing silicon valley the world msft
158,2019-01-14 23:59:37+00:00,the president microsoft says top leaders the world’s biggest tech companies meet regularly talk the major issues facing silicon valley the world msft
159,2019-01-14 23:59:21+00:00,forzahorizon xboxshare microsoft weareplayground please fix custom route
160,2019-01-14 23:58:38+00:00,elliskem scas bett show excel? sponsored microsoft?
161,2019-01-14 23:58:37+00:00,microsoft windows iso download tool walkthrough
162,2019-01-14 23:58:37+00:00,the best windows &gt;&gt; goodbye old friend microsoft end support windows one year
163,2019-01-14 23:58:06+00:00,"microsoft’s security business should be investors’ radar, analyst says."
164,2019-01-14 23:57:33+00:00,microsoft upgrades teams mobile app woo frontline workers computerworld
165,2019-01-15 23:59:59+00:00,i achievements microsoft wordament mobile points trueachievements
166,2020-11-23 15:22:11+00:00,"do self manage databases premises today? read vexpert blog azizaqeelvm understand rds vmware help set up, operate, scale databases improve productivity lower costs."
167,2019-01-15 23:59:47+00:00,we followers away two microsoft gift cards playing fortnitegame tonight the first time ever should get interesting lol. stop and apart the herd retweetmixer watchmixer mixerstreamer fortnite
168,2019-01-15 23:59:46+00:00,walgreens microsoft join forces healthcare delivery alliance
