,Time,Text
3002,2019-09-29 23:56:25+00:00,rosegoldnairad i’m calling microsoft
3003,2019-09-30 23:59:38+00:00,"kharlokong you forgot enchanted arms, has one the first openly gay/genderqueer party characters i remember a videogame lost odyssey, was microsoft studios sendup final fantasy one the best turn based rpgs i ever played."
3004,2020-11-23 15:22:11+00:00,"do self manage databases premises today? read vexpert blog azizaqeelvm understand rds vmware help set up, operate, scale databases improve productivity lower costs."
3005,2019-09-30 23:59:28+00:00,puzzled the many pieces microsoft excel? curious new hidden features? let create customized training plan your team dawn thesoftwarepro.com certifiedexcelexpert exceltips
3006,2019-09-30 23:59:19+00:00,"microsoft onedrive personal vault rolls worldwide, launches expandable storage"
3007,2019-09-30 23:58:33+00:00,surface everything know microsoft’s new
3008,2019-09-30 23:58:33+00:00,surface everything know microsoft’s new
3009,2019-09-30 23:58:33+00:00,surface everything know microsoft’s new computing news
3010,2019-09-30 23:58:09+00:00,microsoft surface could packing snapdragon chip cnet
3011,2019-09-30 23:58:06+00:00,jamiemoranuk shawn said... f &amp;k i’m microsoft making many next gen moves me keep up.
3012,2019-09-30 23:58:00+00:00,elon musk plan replicate human brain ai received bn microsoft
3013,2019-09-30 23:57:54+00:00,halo infinite microsoft used this very cute dog named gyoza to make sounds gamingnews
3014,2019-10-01 23:59:48+00:00,microsoft xbox one s battlefield military green specialedition bundle tb ebay limitededition ends h last price usd .
3015,2020-11-23 15:22:11+00:00,"do self manage databases premises today? read vexpert blog azizaqeelvm understand rds vmware help set up, operate, scale databases improve productivity lower costs."
3016,2019-10-01 23:59:37+00:00,"nerdpyle has cringed you refer the microsoft ""campus""? i still struggling that looking a support group."
3017,2019-10-01 23:59:25+00:00,microsoft barrage new surface products come into focus
3018,2019-10-01 23:59:17+00:00,puzzled the many pieces microsoft powerpoint? curious new features? let create customized training plan your team deliver better presentations dawn thesoftwarepro.com
3019,2019-10-01 23:59:14+00:00,"the convenience bellevue location truly unmatched seattle, redmond, kirkland all easy reach wa , major employers like microsoft the bellevue technology center less a mile away. discover our area"
3020,2019-10-01 23:59:10+00:00,xcloudtimdog let boil for pea brain months game pass games playstation it bucks with games see different think it gamepasses trash like microsoft trash everything microsoft trash sony dominate next gen
3021,2019-10-01 23:59:05+00:00,i achievements microsoft jigsaw win points trueachievements
3022,2019-10-01 23:59:04+00:00,i the strive perfection achievement microsoft solitaire collection uwp points trueachievements
3023,2019-10-01 23:59:02+00:00,microsoft considering bringing chromium based edge linux
3024,2019-10-01 23:59:00+00:00,ghostgaming trpped microsoft innocents aydan assauit zzdmo ghost bizzle ghostsaf seanpcc kayuun where ya looking buddy trpped
3025,2019-10-02 23:59:55+00:00,"yes, microsoft phone really happening introducing surface duo"
3026,2020-11-25 17:06:25+00:00,learn the new cloud like way manage premise databases this depth article rds on vmware cloud solution architect blogger satyashr
3027,2019-10-02 23:59:45+00:00,mixer co founder james boehm departs microsoft with a vision to empower and engage communities and creators | mkau gaming mixer jamesboehm microsoft
3028,2019-10-02 23:59:28+00:00,"planning meeting conference? bring technology speaker &amp; microsoft certified trainer mct your next meeting, onsite training workshop, webinar add valuable software skills. message here at dawn thesoftwarepro.com conferencespeaker techspeaker"
3029,2019-10-02 23:59:22+00:00,one my favorite features microsoft office outlook emailclient report phishing email.
3030,2019-10-02 23:59:15+00:00,microsoft surface phone dual screen android
3031,2019-10-02 23:59:13+00:00,whoa behold new microsoft surface pro vr headset
3032,2019-10-02 23:59:10+00:00,"in great debate ipadpro v surfacepro professionals rely microsoft office suite multi tasking, surface wins a country mile. from apple fan, credit it’s due don’t regret switching surface uk surfacepro windows"
3033,2019-10-02 23:58:58+00:00,"ima real, i’m excited microsoft’s new form factor lineup next year. i might buy of them, that nintendo ds style phone exactly i’ve waiting since smartphones took off. it looks like great concept. i hope takes off."
3034,2019-10-02 23:58:53+00:00,"we knew trash s we ever needed know, sony was their well microsoft did a poor job microsoft decided start gamepass ps wasn relevant enough compete, should seen coming sony to beg azure"
3035,2019-10-02 23:58:51+00:00,did see the new microsoft devices announced? here a great rundown mkbhd microsoft surface family impressions
3036,2019-10-03 23:59:58+00:00,"top story microsoft shows surface duo, android phone, two screen neo pc , see"
3037,2020-11-25 17:06:25+00:00,learn the new cloud like way manage premise databases this depth article rds on vmware cloud solution architect blogger satyashr
3038,2019-10-03 23:59:57+00:00,"natwest bank uses artificialintelligence predict future. working microsoft &amp; dreamquark simulate future behavior mortgages &amp; sme loans, natwest be able better identify potential risks/opportunities fintech ai industry"
3039,2019-10-03 23:59:22+00:00,"top story the key a data driven culture timely insights | blog | microsoft azure , see"
3040,2019-10-03 23:59:19+00:00,yesterday microsoft announced surface duo mi drop offa mi chair work
3041,2019-10-03 23:59:10+00:00,microsoft unveils new smartphone surface duo technology
3042,2019-10-03 23:58:51+00:00,djmnts iamwill microsoft soft years you rep with microsoft xbox gamertag... genius
3043,2019-10-03 23:58:42+00:00,drop ur favorite video games all time. videogame xbox gamecube nintendo microsoft
3044,2019-10-03 23:58:35+00:00,"day , using microsoft teams communicate students provide links the websites use often sf edtechguy thejaydubs educwhiting"
3045,2019-10-03 23:58:16+00:00,"novartis, microsoft partner use artificial intelligence drug research"
3046,2019-10-03 23:57:32+00:00,gokustomps microsoft yeah go the ghost reacon trailer they’re holding ps controllers
3047,2019-10-04 23:59:37+00:00,"microsoft ""the accounts one the us election headquarters, us government officials, american media employees, prominent iranians living other countries been subjected the cyber attack involving hackers subordinate iranian authorities."""
3048,2020-11-23 15:22:11+00:00,"do self manage databases premises today? read vexpert blog azizaqeelvm understand rds vmware help set up, operate, scale databases improve productivity lower costs."
3049,2019-10-04 23:59:35+00:00,"all "" microsoft surface laptops models intel processors? i really getting amd flavoured surface laptop, i don like "" form factor rip"
3050,2019-10-04 23:59:31+00:00,puzzled the many pieces microsoft outlook? curious new hidden features? let create customized training plan your team dawn thesoftwarepro.com certifiedoutlookexpert outlooktips
3051,2019-10-04 23:59:25+00:00,microsoft iran linked hacking group tried compromise us presidential candidate. breakingnewsnow breaking news breakingnews breakingnewz breakingnow breaking uspresidentialcandidate uspresidentialcandidate compromised compromise compromised compromise
3052,2019-10-04 23:59:23+00:00,microsoft iran linked hacking group tried compromise us presidential candidate. breakingnewsnow breaking news breakingnews breakingnewz breakingnow breaking uspresidentialcandidate uspresidentialcandidate compromised compromise compromised
3053,2019-10-04 23:59:21+00:00,microsoft iran linked hacking group tried compromise us presidential candidate. breakingnewsnow breaking news breakingnews breakingnewz breakingnow breaking iranhackinggroup hacking hackers hacker hacked hack hackinggroup iranian iranians compromise
3054,2019-10-04 23:59:20+00:00,microsoft iran linked hacking group tried compromise us presidential candidate. breakingnewsnow breaking news breakingnews breakingnewz breakingnow breaking uspresidentialcandidate uspresidentialcandidate presidentialcandidate msft microsoft iran
3055,2019-10-04 23:59:18+00:00,microsoft iran linked hacking group tried compromise us presidential candidate. breakingnewsnow breaking news breakingnews breakingnewz breakingnow breaking uspresidentialcandidate uspresidentialcandidate presidentialcandidate presidentialcandidate ms
3056,2019-10-04 23:59:16+00:00,microsoft iran linked hacking group tried compromise us presidential candidate. breakingnewsnow breaking news breakingnews breakingnewz breakingnow breaking uspresidentialcandidate uspresidentialcandidate presidentialcandidate presidentialcandidate
3057,2019-10-04 23:59:03+00:00,attachment extensions carrying malware banned on microsoft outlook
3058,2019-10-05 23:59:28+00:00,"upgrading new program? planning meeting conference? hire a microsoft certified trainer bring valuable software tips &amp; techniques your next meeting, onsite training workshop webinar. message here at dawn thesoftwarepro.com productivity mct"
3059,2020-11-23 15:22:11+00:00,"do self manage databases premises today? read vexpert blog azizaqeelvm understand rds vmware help set up, operate, scale databases improve productivity lower costs."
3060,2019-10-05 23:59:11+00:00,"i becoming quite proficient a self taught way e.g. google analytics, skype, viber,some microsoft stuff,but kept changing things &amp; i couldn keep with it. uninstall,reinstall,download new &amp; that,re set passwords,this ap needs ap technologynews"
3061,2019-10-05 23:58:45+00:00,"in multi part ""tutorial"", build single server sharepoint server farm inside subnet microsoft azure virtual network. the purpose this server be development testing as a basis demonstrating s... ke"
3062,2019-10-05 23:58:44+00:00,"in multi part ""tutorial"", build single server sharepoint server farm inside subnet microsoft azure virtual network. the purpose this server be development testing as a basis demonstrating s... ke"
3063,2019-10-05 23:58:44+00:00,"in multi part ""tutorial"", build single server sharepoint server farm inside subnet microsoft azure virtual network. the purpose this server be development testing as a basis demonstrating s... ke"
3064,2019-10-05 23:57:30+00:00,"python beginners, demo using numbers python, video microsoft developers youtube page. microsoftdeveloper pythonforbeginners learntocode postdays python"
3065,2019-10-05 23:57:25+00:00,microsoft xbox one white xbox one s controller w/ mm headphone jack ebay ends h last price usd .
3066,2019-10-05 23:57:14+00:00,"microsoft onedrive personal vault rolls worldwide, launches expandable storage"
3067,2019-10-05 23:56:59+00:00,just earned intro microsoft teams the microsoft educator center preview you check free pd courses too. microsoft microsoft microsoftng via microsoftedu
3068,2019-10-05 23:56:33+00:00,"microsoft unveils airpods rival, surface earbuds"
3069,2019-10-06 23:59:48+00:00,artbaesel is microsoft pod? lol
3070,2020-11-25 17:06:25+00:00,learn the new cloud like way manage premise databases this depth article rds on vmware cloud solution architect blogger satyashr
3071,2019-10-06 23:59:46+00:00,microsoft chief brad smith says rise killer robots unstoppable do you know him? via telegraphtech
3072,2019-10-06 23:59:32+00:00,puzzled the many pieces microsoft powerpoint? curious new features? let create customized training plan your team deliver better presentations dawn thesoftwarepro.com
3073,2019-10-06 23:59:25+00:00,warnings issued for millions of microsoft windows users
3074,2019-10-06 23:59:21+00:00,"commodoreblog stay strong, despise stinking microsoft."
3075,2019-10-06 23:58:52+00:00,dret microsoft microsoftteams i impressed you surprised
3076,2019-10-06 23:58:33+00:00,microsoft massive risks and radical rewards behind new surface duo
3077,2019-10-06 23:58:18+00:00,alex pedroza doesn’t know to use microsoft when i asked what writes school papers she said pages
3078,2019-10-06 23:58:03+00:00,"join people right at ""new microsoft patent shows a floor mat your virtual reality experiences | techradar"" cheers technology tech mobile experiences techradar microsoft reality virtual patent floor shows news"
3079,2019-10-06 23:57:56+00:00,microsoft embrace google android software bigger its new phone via cnet
3080,2019-10-07 23:59:59+00:00,we excited launch azure illuminate new program allows establish meaningful presence your sql server environment microsoft azure without needing to perform full cloud migration. learn migration azure
3081,2020-11-23 15:22:11+00:00,"do self manage databases premises today? read vexpert blog azizaqeelvm understand rds vmware help set up, operate, scale databases improve productivity lower costs."
3082,2019-10-07 23:59:39+00:00,bobevansit jiri kram salesforce oracle amazon microsoft work the best deal the party cutting oxygen wants fill your market niche?not much. benioff
3083,2019-10-07 23:59:29+00:00,planning meeting conference? add valuable software skills education your next meeting a microsoft certified trainer add training is immediately useful your attendees. message here at dawn thesoftwarepro.com conferencespeaker techspeaker
3084,2019-10-07 23:59:08+00:00,"microsoft, amazon, samsung sony take apple airpods quartz airpods apples apple tech"
3085,2019-10-07 23:59:00+00:00,"enterprise ethereum alliance’s reward token system backed microsoft, intel thomaspower stevewal jonnyfry ursbolt"
3086,2019-10-07 23:58:52+00:00,"join insightent microsoft santa clara the iotinactionms event /, learn you build deploy iot solutions. insightsocial insightpartners"
3087,2019-10-07 23:58:51+00:00,just earned points the microsoft educator center preview you check free pd courses too. via microsoftedu
3088,2019-10-07 23:57:43+00:00,microsoft microsoft errors and i thought windows buggy. oops. that product description in beta.
3089,2019-10-07 23:57:36+00:00,"enterprise ethereum alliances reward token system backed microsoft, intel"
3090,2019-10-07 23:57:13+00:00,coindesk ianallison intel microsoft use cardano. it better.
3091,2019-10-08 23:59:50+00:00,"i dont understand ps reveal hype. we had very clear idea what microsoft sony planning awhile now. now nintendo came with new hardware specs, i would very much intrigued."
3092,2020-11-25 17:06:25+00:00,learn the new cloud like way manage premise databases this depth article rds on vmware cloud solution architect blogger satyashr
3093,2019-10-08 23:59:33+00:00,republican senators call huawei ‘real urgent’ threat new letter microsoft exec seattle
3094,2019-10-08 23:59:33+00:00,"john kavanagh it good take. whenever response ""but was a manager microsoft"" know you a point mid level managers microsoft t the ""billionaire"" pay bracket."
3095,2019-10-08 23:59:31+00:00,"metaverse &gt; vr virtualreality &gt; rvr &gt; microsoft files ‘virtual reality floor mat’ patent, possibly aimed an xbox vr headset &gt; ... a microsoft patent application ‘virtual reality floor mat’ describes special mat defines a virtual pla…"
3096,2019-10-08 23:59:00+00:00,vgfgamers no .never buy console year one unless necessary and . wait see microsoft’s console depending your tastes budge power upcoming exclusives
3097,2019-10-08 23:58:49+00:00,you know deal october . pwned a spreadsheet. patch microsoft stuff • the register infosec advisory
3098,2019-10-08 23:58:49+00:00,"so, microsoft embracing open source, apple filling trash heaps earphones literally cannot serviced. things changed mightily since i started the it game."
3099,2019-10-08 23:58:45+00:00,"vr virtualreality microsoft files ‘virtual reality floor mat’ patent, possibly aimed an xbox vr headset"
3100,2019-10-08 23:58:43+00:00,"atom keemstar that’s horribly wrong it’s really mind blowing... microsoft been putting and money xbox years move forward. also the next halo million dollars sunk it, let sink"
3101,2019-10-08 23:58:22+00:00,"it’s exciting connect microsoft innovative educator experts arizona sylvia quigley, heba muellar &amp; jeff proctor tucsonunified mieexpert iamncce ncce edtech sinmuellertech"
3102,2019-10-09 23:59:55+00:00,"mike ybarra, corporate vice president microsoft gaming division across xbox pc, announced departure the company almost years, according eurogamer. gaming"
3103,2020-11-25 17:06:25+00:00,learn the new cloud like way manage premise databases this depth article rds on vmware cloud solution architect blogger satyashr
3104,2019-10-09 23:59:45+00:00,resume katherine held proficient microsoft excel word communicative team oriented . uber rating
3105,2019-10-09 23:59:43+00:00,microsoft your fucking os shouldn t function like malware you piece of shit
3106,2019-10-09 23:59:42+00:00,guys setlist aint fake looks like of shitty ass setlists written microsoft word sth look heres old ones vs todays
3107,2019-10-09 23:59:27+00:00,computer keeps crashing i sorry i test later see i or cannot figure out. very frustrating. bungie microsoft need figure broccoli is a driver issue.
3108,2019-10-09 23:59:25+00:00,microsoft unboxed sounds microsoft ep.
3109,2019-10-09 23:59:24+00:00,"upgrading new program? planning meeting conference? hire a microsoft certified trainer bring valuable software tips &amp; techniques your next meeting, onsite training workshop webinar. message here at dawn thesoftwarepro.com productivity mct"
3110,2019-10-09 23:59:15+00:00,getting started microsoft lync server ==&gt; python javascript angular reactjs vuejs perl ruby csharp java linux programming network security golang coding ionic android ios datascience development artificialintelligence
3111,2019-10-09 23:58:59+00:00,azure sphere . release adds new use cases enterprise customers microsoft azure
3112,2019-10-09 23:58:48+00:00,"swhat shesaid kardonice sh mck williampietri evan greer fightfortheftr github microsoft yeah, see you use it."
3113,2019-10-10 23:59:51+00:00,"bqofnh scoutstandup i my pc screenshot using [print scr], paste crop microsoft paint."
3114,2020-11-25 17:06:25+00:00,learn the new cloud like way manage premise databases this depth article rds on vmware cloud solution architect blogger satyashr
3115,2019-10-10 23:59:48+00:00,gearboxofficial microsoft letting yall know borderlands crashes has either restarting console shutting completely xbox one x figured id let yall know my friends also come across issue. doesnt happen other games.
3116,2019-10-10 23:59:37+00:00,puzzled the many pieces microsoft outlook? curious new hidden features? let create customized training plan your team dawn thesoftwarepro.com certifiedoutlookexpert outlooktips
3117,2019-10-10 23:59:37+00:00,apple starts selling microsoft product because it needs to via bgdftw
3118,2019-10-10 23:59:22+00:00,"would been way fucking better proposal implimentation chrome only. was actual beautiful, easy use, durable polymorphic. then it became microsoft product."
3119,2019-10-10 23:58:56+00:00,"xbox slim gb internal hd oem microsoft hard drive, new case been discounted estore"
3120,2019-10-10 23:58:35+00:00,"shisnoelite rustolla colteastwood ruffian would best choice, they’ve doing lot support work microsoft several games. they founded ex realtime worlds members, a great job crackdown considering the extremely short development time they were given"
3121,2019-10-10 23:58:26+00:00,"talend cloud now available microsoft azure collect, transform, cleanse move data virtually data source azure a single suite cloud apps dataintegration dataintegrity."
3122,2019-10-10 23:58:22+00:00,live blog pytorch ptdc pytorch research pytorch production tesla microsoft caltech stanford nlp
3123,2019-10-10 23:57:35+00:00,"california week, massachusetts next week taking microsoft powerbi coast coast join us next wednesday"
3124,2019-10-11 23:59:30+00:00,puzzled the many pieces microsoft powerpoint? curious new features? let create customized training plan your team deliver better presentations dawn thesoftwarepro.com
3125,2020-11-25 17:06:25+00:00,learn the new cloud like way manage premise databases this depth article rds on vmware cloud solution architect blogger satyashr
3126,2019-10-11 23:59:10+00:00,"from davrospendragon regarding ageofempires remake xbox/microsoft an accessibility cert has be met game be released the importance moving forward “fail progression” you’re developing, an accessibility ui screen prompt"
3127,2019-10-11 23:59:03+00:00,random friday thoughts there office microsoft uses microsoft office write send an email an office microsoft microsoft office.
3128,2019-10-11 23:58:59+00:00,"browofjustice havochaos wintermute wait, know microsoft account password? in case, should able either disconnect account his microsoft account make new local administrator user"
3129,2019-10-11 23:58:59+00:00,i achievements microsoft treasure hunt win points trueachievements
3130,2019-10-11 23:58:58+00:00,i the go the silver achievement microsoft solitaire collection uwp points trueachievements
3131,2019-10-11 23:58:58+00:00,i achievements microsoft treasure hunt win points trueachievements
3132,2019-10-11 23:58:56+00:00,i achievements microsoft treasure hunt win points trueachievements
3133,2019-10-11 23:58:09+00:00,"october , sunday pm est tyson’s corner center microsoft store apex legends lan tournament prizing worth least"
3134,2019-10-11 23:57:14+00:00,"reneritchie apple microsoft equal market cap today, .t crazy money"
3135,2019-10-12 23:59:54+00:00,"if i buy game the microsoft store, feel like i be able play on xbox. sometimes i want be lazy play minecraft my couch..."
3136,2020-11-25 17:06:25+00:00,learn the new cloud like way manage premise databases this depth article rds on vmware cloud solution architect blogger satyashr
3137,2019-10-12 23:59:54+00:00,. monoscopic microsoft loops &amp;
3138,2019-10-12 23:59:32+00:00,"topherjaims i see point, the problem no one talks with consoles getting networked esports matches staying cipa compliant. microsoft sony make really difficult."
3139,2019-10-12 23:59:28+00:00,don forget buy microsoft ...
3140,2019-10-12 23:59:26+00:00,"upgrading office ? planning meeting conference? bring technology speaker &amp; microsoft certified trainer your next meeting, onsite training workshop, webinar add valuable software skills. message here at dawn thesoftwarepro.com"
3141,2019-10-12 23:58:57+00:00,i achievements microsoft treasure hunt win points trueachievements
3142,2019-10-12 23:58:56+00:00,i the flipping out achievement microsoft solitaire collection uwp points trueachievements
3143,2019-10-12 23:58:13+00:00,someunknownguy jessenoller which microsoft....
3144,2019-10-12 23:58:06+00:00,microsoft president brad smith’s book tech no love letter
3145,2019-10-12 23:57:46+00:00,i had same xbox account years now i magically locked one help after spending hours talking microsoft support that i had to make a new account to reach and two weeks submitting ac requests? fuck all. good thing i a playstation.
3146,2019-10-13 23:59:27+00:00,worktogame xbox googlestadia do think microsoft would put on xbox one wait the next generation since s coming the end next year
3147,2020-11-25 17:06:25+00:00,learn the new cloud like way manage premise databases this depth article rds on vmware cloud solution architect blogger satyashr
3148,2019-10-13 23:59:11+00:00,"blockchain not for cryptocurrency, for enterprises the future bitcoin microsoft azurefamily"
3149,2019-10-13 23:58:56+00:00,i achievements microsoft treasure hunt win points trueachievements
3150,2019-10-13 23:58:55+00:00,i achievements microsoft ultimate word games win points trueachievements
3151,2019-10-13 23:58:55+00:00,if use microsoft launcher bevy microsoft applications the galaxy note you get a taste what expect the surface duo.
3152,2019-10-13 23:57:44+00:00,"fresh the usb drive, here’s snippet the first code i ever wrote html microsoft word, naturally i no idea i doing."
3153,2019-10-13 23:57:43+00:00,angelight the word porting pc scares honestly. love care a necessity this. i hate exclusivity especially microsoft ps coming around being open pc stuff. bridge caps it’s important.
3154,2019-10-13 23:57:34+00:00,gta v new en ebay grand theft auto v gta microsoft xbox one xb brand new factory sealed
3155,2019-10-13 23:57:18+00:00,microsoft rewards supersonic quiz
3156,2019-10-13 23:57:12+00:00,tweetboom fortnitegame song windows startup feat. microsoft
3157,2019-10-14 23:59:53+00:00,microsoft releases ‘tamper protection’ all windows users stop malware turning antivirus – cso
3158,2020-11-25 17:06:25+00:00,learn the new cloud like way manage premise databases this depth article rds on vmware cloud solution architect blogger satyashr
3159,2019-10-14 23:59:35+00:00,"rxc this works get around ""update"" screen, core services still down. this happens than acceptable. microsoft either trying do much has incompetent techs. no core backup dumb."
3160,2019-10-14 23:59:28+00:00,change can be hard ... let make it easier upgrading microsoft office ? does team need be productive a new program? let create engaging &amp; valuable training experience. message here at dawn thesoftwarepro.com mct change
3161,2019-10-14 23:59:27+00:00,"top story azure sql database continuous innovation limitless scale an unbeatable price | blog | microsoft azure , see"
3162,2019-10-14 23:59:18+00:00,"having trouble signing xbl? delete fortnite it’ll work, even kidding . fortnites fucking up. xboxone microsoft"
3163,2019-10-14 23:59:09+00:00,city phoenix partners cisco microsoft icount
