,Time,Text
1017,2019-04-02 23:59:34+00:00,"microsoft stops selling ebooks, will refund customers for previous purchases"
1018,2019-04-02 23:59:33+00:00,experiencing alerting failure issue azure portal many data types – / – investigating microsoft
1019,2019-04-02 23:59:32+00:00,bwm use microsoft iiot cloud open manufacturing
1020,2019-04-02 23:59:28+00:00,"new ebay tom clancy the division standard edition microsoft xbox one,"
1021,2019-04-02 23:59:26+00:00,"whenever i type microsoft word, i always stop mid sentence word, thinking it gonna automatically pop for to click enter"
1022,2019-04-02 23:59:10+00:00,"new post windows central news, forums, reviews, help windows all things microsoft. ""rage really feature cheat codes """
1023,2019-04-03 23:59:58+00:00,thank labfour training after hours in class &amp; as many home make brochure. i may drop now &amp; get an hour job upsstore fedexoffice ? to microsoft office spec.
1024,2020-11-25 17:06:25+00:00,learn the new cloud like way manage premise databases this depth article rds on vmware cloud solution architect blogger satyashr
1025,2019-04-03 23:59:49+00:00,samsykesswears so pleased know i an actual gamer. although i hit level microsoft solitaire. that helps waiting raid pulls.
1026,2019-04-03 23:59:37+00:00,microsoft excel a powerful often ignored tool. entmagazine some ideas improving time management excel spreadsheets. sharpbusinesssystems businesstips officeequipment
1027,2019-04-03 23:59:27+00:00,microsoft researchers discovered fault the shenzhen based company’s software described as achilles’ heel could abused attackers seize control users’ machines.
1028,2019-04-03 23:59:23+00:00,puzzled the many pieces microsoft word? curious new hidden features? let create customized training plan your team dawn thesoftwarepro.com certifiedwordexpert wordtips
1029,2019-04-03 23:59:12+00:00,"milkdromida multysmoke meinos kaen ghawblin hyperu isaacevans trioxide borderlands microsoft it not bad, ya."
1030,2019-04-03 23:58:54+00:00,new repository created microsoft docs mslearn distribute load traffic manager github opensource
1031,2019-04-03 23:58:00+00:00,"why berkeley meng? because the unique combination technical expertise leadership devleopment, told honghao qiu, meng ‘ ieor , product manager, microsoft"
1032,2019-04-03 23:57:39+00:00,akamai edge delivery integrates w/ microsoft azure media services &amp; blob storage expressroute streaming mspartner ai cloud
1033,2019-04-03 23:57:34+00:00,adobe microsoft team up challenge salesforce themotleyfool stocks msft adbe crm
1034,2019-04-04 23:59:57+00:00,"we argue the editorial the platform surveillance special issue surveillance &amp; society payment the emerging platform battleground after microsoft partnered mastercard, apple partnering goldmansachs"
1035,2020-11-25 17:06:25+00:00,learn the new cloud like way manage premise databases this depth article rds on vmware cloud solution architect blogger satyashr
1036,2019-04-04 23:59:56+00:00,visualstudio visual studio come microsoft azure education?
1037,2019-04-04 23:59:52+00:00,microsoft intel. they t even.
1038,2019-04-04 23:59:29+00:00,"billgates microsoft they did, sir, did. and better of the time."
1039,2019-04-04 23:59:26+00:00,microsoft turns years old today
1040,2019-04-04 23:59:23+00:00,"xamarin.ios . release notes xamarin | microsoft docs april , xamarin.ios ... this release based xamarin.ios . and xcode . final release."
1041,2019-04-04 23:59:22+00:00,xamarin.ios . release notes xamarin | microsoft docs
1042,2019-04-04 23:59:19+00:00,puzzled the many pieces microsoft excel? curious new hidden features? let create customized training plan your team dawn thesoftwarepro.com certifiedexcelexpert exceltips
1043,2019-04-04 23:59:17+00:00,leaked microsoft email chain reportedly describes hellish workplace women – gizmodo
1044,2019-04-04 23:59:15+00:00,new titan fall xbox one ebay uk titanfall microsoft xbox one games very good condition
1045,2019-04-05 23:59:11+00:00,"right on, microsoft \m/"
1046,2020-09-03 18:26:48+00:00,"lenovo legion x playapex now your chance rise the rest. unmatched performance, purposeful engineering, modern design. gear with machine savage you are. stylish outside. savage inside."
1047,2019-04-05 23:58:44+00:00,new repository created microsoft tiny calc github opensource
1048,2019-04-05 23:58:36+00:00,"masoodmustang kakar harsha sharad goil we working . solar technology n e completely doped solar technology . digital payment system almost executed india successful . hyper loop system . all it/cs giants there manufacturing firm are still progress like microsoft ,apple. /n"
1049,2019-04-05 23:58:34+00:00,"well is pretty disgusting. microsoft some serious exorcising their organization do, swiftly."
1050,2019-04-05 23:58:28+00:00,microsoft microsoft updating... not shut down.
1051,2019-04-05 23:57:55+00:00,formation microsoft azure site recovery
1052,2019-04-05 23:57:26+00:00,"soundsmythprod josh snares i think s actually paintbrush, photoshop. otherwise s the bloody eraser tool in microsoft paint my god"
1053,2019-04-05 23:57:19+00:00,formation microsoft azure site recovery
1054,2019-04-05 23:57:02+00:00,"dozens female microsoft employees claim deal shocking behavior work requests sit coworker lap, called a b tch"
1055,2019-04-05 23:56:23+00:00,has anyone microsoft actually used something than hyper v? what shitshow.
1056,2019-04-06 23:59:35+00:00,"get billions trillions later . and s legal. if want do heist, introduce law make legal. top ""donors"" presidential elections goldman sachs, jp morgan chase, citigroup, morgan stanley. microsoft, google, time warner, harvard"
1057,2020-11-23 15:22:11+00:00,"do self manage databases premises today? read vexpert blog azizaqeelvm understand rds vmware help set up, operate, scale databases improve productivity lower costs."
1058,2019-04-06 23:59:33+00:00,microsoft shutting its healthvault patient record service
1059,2019-04-06 23:59:33+00:00,"uk investigating microsoft, sony, nintendo over subscription plans"
1060,2019-04-06 23:59:33+00:00,"uk investigating microsoft, sony, nintendo over subscription plans"
1061,2019-04-06 23:58:54+00:00,"how preorder microsoft new surface pro , surface.... microsoft gogadgets tablet"
1062,2019-04-06 23:58:39+00:00,"jaydubcity sonyoflastation given sony’s business practices market reality forced microsoft focus consumer friendly policies services, i’d say xbox good position disrupt market again. will beat sony in sales? probably not. does make xbox a bad platform? nope."
1063,2019-04-06 23:57:21+00:00,cnbc how army plans use microsoft high tech hololens goggles the battlefield. via googlenews
1064,2019-04-06 23:57:18+00:00,"markjacobsohn microsoft azure best luck, jake. looking forward working you this new role"
1065,2019-04-06 23:57:04+00:00,"uk investigates microsoft, nintendo, sony game service practices engadget via googlenews"
1066,2019-04-06 23:56:02+00:00,microsoft shutting its healthvault patient record service
1067,2019-04-07 23:59:49+00:00,microsoft drops safe removal usb drives as default in windows
1068,2020-11-25 17:06:25+00:00,learn the new cloud like way manage premise databases this depth article rds on vmware cloud solution architect blogger satyashr
1069,2019-04-07 23:59:30+00:00,more like e since nintendo microsoft to carry sony left.
1070,2019-04-07 23:59:29+00:00,it’s okay to pull out now microsoft drops ‘safe removal’ usb drives as default in windows …
1071,2019-04-07 23:59:25+00:00,"planning meeting conference? bring technology speaker &amp; microsoft certified trainer mct your next meeting, onsite training workshop, webinar add valuable software skills. message here at dawn thesoftwarepro.com conferencespeaker techspeaker"
1072,2019-04-07 23:59:01+00:00,"microsoft, cloud solution providers, third party isvs like nimble working closely together deliver right sized, roi positive solutions marketing organizations’ overarching business challenges. mspartner digitaltransformation"
1073,2019-04-07 23:58:24+00:00,gladstein arthurb emostaque microsoft csuwildcat nopara don’t get wrong bitcoin inspiring. but technological foundation a next generation financial system it’s practically a nonstarter
1074,2019-04-07 23:57:03+00:00,maaimyuu you tried competitive microsoft excel c?
1075,2019-04-07 23:57:01+00:00,microsoft ceo nadella meets top execs every week review ai projects blockchain bigdata travel
1076,2019-04-07 23:56:55+00:00,dutch isn’t microsoft paint?
1077,2019-04-07 23:56:44+00:00,simple safe way communicate business information. microsoft kaizala microsoftteams.
1078,2019-04-08 23:59:50+00:00,“microsoft edge preview builds the next step our oss journey | windows experience blog” users
1079,2020-11-25 17:06:25+00:00,learn the new cloud like way manage premise databases this depth article rds on vmware cloud solution architect blogger satyashr
1080,2019-04-08 23:59:48+00:00,fixed unreadable symbols notification email veeam backup microsoft office veeam mvphour office
1081,2019-04-08 23:59:47+00:00,microsoft releases google chrome like edge browser testing
1082,2019-04-08 23:59:37+00:00,puzzled the many pieces microsoft outlook? curious new hidden features? let create customized training plan your team dawn thesoftwarepro.com certifiedoutlookexpert outlooktips
1083,2019-04-08 23:59:35+00:00,the combination feelings knowledge microsoft
1084,2019-04-08 23:59:34+00:00,microsoft ceo ‘tech shifts easier deal than business model shifts’
1085,2019-04-08 23:59:30+00:00,happening tomorrow women startup &amp; entrepreneur night microsoft
1086,2019-04-08 23:59:30+00:00,"new ebay tom clancy the division standard edition microsoft xbox one,"
1087,2019-04-08 23:58:59+00:00,microsoft edge preview builds the next step our oss journey
1088,2019-04-08 23:58:54+00:00,xarcrius microsoft already stated the public blog posts h coming would share details how they will distro update the near future.
1089,2019-04-09 23:59:59+00:00,two hrds leading technology firms paloitsingapore microsoft share insights how hr remain relevant disruptive times.
1090,2020-10-02 15:59:10+00:00,learn an overhaul nj competitive energy market would force state ratepayers pay higher electric bills.
1091,2019-04-09 23:59:45+00:00,"fridaythgame xbox microsoft i get accidentally made savini jason free store then fixed it, can force make on store agian free a month, people didn have the chance to get need another chance, your choice mine, please think it"
1092,2019-04-09 23:59:37+00:00,microsoft life treehouse meeting space looks like wonderful working area
1093,2019-04-09 23:59:28+00:00,"tonight, library visitors learned case western reserve university using holograms. everyone invited slip the microsoft hololens interact holograms the human anatomy, architecture, our solar system. we agreed, technology amazing oureuclid"
1094,2019-04-09 23:59:26+00:00,griffin gaming did microsoft notice outrage sony upped costs playstation plus while back? or this case monkey see monkey do? they really make full pc gaming look and appealing time goes by.
1095,2019-04-09 23:59:23+00:00,withdrawing the microsoft mvp program
1096,2019-04-09 23:58:53+00:00,darkambience yes i trying log w/ microsoft acct idk it like
1097,2019-04-09 23:58:44+00:00,new repository created microsoft azure azure functions dotnet extensions github opensource
1098,2019-04-09 23:58:37+00:00,microsoft backed project announces new crypto library web security blockchain
1099,2019-04-09 23:58:33+00:00,"mark calendars on april , microsoft azure chief technical officer mark russinovich join us ""microsoft azure microsoft research advancing cloud computing,"" part our series berkeley distinguished lectures datascience"
1100,2019-04-10 23:59:48+00:00,wolfysbane now can finally eradicate of console plebs the casuals no i think around they’ll die popularity wise more devs will release either pc or pc microsoft store. they shifting more pc every year
1101,2020-11-23 15:22:11+00:00,"do self manage databases premises today? read vexpert blog azizaqeelvm understand rds vmware help set up, operate, scale databases improve productivity lower costs."
1102,2019-04-10 23:59:30+00:00,microsoft worked with chinese military university ai
1103,2019-04-10 23:59:16+00:00,"passantino lovestats i wonder microsoft recorded people using kinects. if so, might heard cussing endlessly mine it’s a pos"
1104,2019-04-10 23:59:15+00:00,"google docs let natively edit microsoft word, excel, powerpoint files soon via verge shukesandgiff edtechteam"
1105,2019-04-10 23:59:02+00:00,test microsoft chrome like edge browser windows cnet
1106,2019-04-10 23:58:43+00:00,and there two amazon web services microsoft named finalists the pentagon’s b jedi cloud contract via geekwire
1107,2019-04-10 23:58:41+00:00,my microsoft word changed french swiss precise i copied something it wont change back english. any advice would be très bon. je suis going smash my laptop x
1108,2019-04-10 23:58:41+00:00,new repository created microsoft azure azureml github opensource
1109,2019-04-10 23:58:40+00:00,"ann johnson, microsoft vp cybersecurity, recommends getting rid passwords. sounds great me."
1110,2019-04-10 23:58:37+00:00,"after than years, microsoft sticks fork windows xp one final time"
1111,2019-04-11 23:59:52+00:00,joshdeveson very unlikely definitely happen according a legit ea/bioware leaker a mass effect remaster trilogy will not happen the mass effect thing microsoft leak will coming an xbox one x enhanced k update the mass effect trilogy fall /
1112,2020-11-25 17:06:25+00:00,learn the new cloud like way manage premise databases this depth article rds on vmware cloud solution architect blogger satyashr
1113,2019-04-11 23:59:29+00:00,fun times exploring new exciting tech microsoft mggs myset
1114,2019-04-11 23:59:01+00:00,introducing windows security configuration framework | microsoft docs
1115,2019-04-11 23:58:52+00:00,xboxamboracle your a dire xboxsupport microsoft i submit but i doubt it’ll get unbanned dude instantly banned threatened fry router says has ip i’m basically helpless and i don’t think xbox cares all
1116,2019-04-11 23:58:50+00:00,hello i creating comparative list migrate proprietary software packages free open source software. can recommend good options replace microsoft office? opensource
1117,2019-04-11 23:58:39+00:00,new repository created microsoft mtc github azuredevops github opensource
1118,2019-04-11 23:58:11+00:00,"check ""autism and transition services "" eventbrite date tue, apr , pm location microsoft store northpark center"
1119,2019-04-11 23:58:10+00:00,"dhhs executives relying microsoft azure dynamics fuel array new initiatives, including program address family violence victoria, most densely populated state australia more million residents. health"
1120,2019-04-11 23:58:03+00:00,"loudobbs fredfleitz microsoft big, huge dnc contributor, congress do nothing. plus waste their time chasing trump, instead watching for american interests."
1121,2019-04-11 23:58:02+00:00,xboxamboracle your a dire xboxsupport microsoft hey thanks responding i said “that’s you don’t kill whore ll” is cod term just killing instead playing smart i’m assuming term kill whore got banned that’s term has negative connotation behind so i’m confused
1122,2019-04-12 23:59:32+00:00,looks like dropbox going way evernote the max devices. that introduced zoho notebook is evernote used to be. guess i use unlimited device competitors like box googledrive onedrive microsoft. deuces.
1123,2020-11-23 15:22:11+00:00,"do self manage databases premises today? read vexpert blog azizaqeelvm understand rds vmware help set up, operate, scale databases improve productivity lower costs."
1124,2019-04-12 23:59:25+00:00,"upgrading office ? planning meeting conference? bring technology speaker &amp; microsoft certified trainer your next meeting, onsite training workshop, webinar add valuable software skills. message here at dawn thesoftwarepro.com"
1125,2019-04-12 23:59:03+00:00,"microsoft xbox one x, tb hard drive k hd gaming console, black xboxone xbox game"
1126,2019-04-12 23:58:40+00:00,"pub realization microsoft really missed trick cortana, basing assistant a previous ahead its time interactive intelligent agent companion."
1127,2019-04-12 23:58:38+00:00,"store value energy ️ data ? ️ not long ago, oil &amp; gas companies valuable companies the world today data companies like microsoft google facebook dominates top ten will the same trend apply cryptocurrency the future?"
1128,2019-04-12 23:58:34+00:00,new repository created microsoft helium github opensource
1129,2019-04-12 23:58:27+00:00,microsoft openclassrooms train students fill high demand ai jobs
1130,2019-04-12 23:58:02+00:00,minecraft microsoft xbox new sealed minecraft playing game
1131,2019-04-12 23:57:37+00:00,microsoft store spring sales many xbox one video games
1132,2019-04-12 23:57:24+00:00,"deanpierce xdade erratarob lets say i store md hash, hopefully are collisions the bytes else microsoft windows issues i store bytes every value how much storage space required?"
1133,2019-04-13 23:59:23+00:00,puzzled the many pieces microsoft outlook? curious new hidden features? let create customized training plan your team dawn thesoftwarepro.com certifiedoutlookexpert outlooktips
1134,2020-10-02 15:59:10+00:00,learn an overhaul nj competitive energy market would force state ratepayers pay higher electric bills.
1135,2019-04-13 23:59:07+00:00,"the world largest aircraft, developed aerospace venture stratolaunch, completed first flight test saturday, bringing life dream held the late microsoft co founder paul g. allen."
1136,2019-04-13 23:58:16+00:00,view verified achievement microsoft acclaim.
1137,2019-04-13 23:58:08+00:00,microsoft email services have been hacked exposing details some its users
1138,2019-04-13 23:58:05+00:00,microsoft email services have been hacked exposing details some its users
1139,2019-04-13 23:58:04+00:00,microsoft email services have been hacked exposing details some its users
1140,2019-04-13 23:58:02+00:00,microsoft email services have been hacked exposing details some its users
1141,2019-04-13 23:58:00+00:00,microsoft email services have been hacked exposing details some its users
1142,2019-04-13 23:57:49+00:00,microsoft reveals hackers accessed accounts months
1143,2019-04-13 23:57:32+00:00,microsoft discloses security breach impacted outlook accounts
1144,2019-04-14 23:59:45+00:00,"hammer toe any old pc game isn’t microsoft game doesn’t work it’s installed windows . i searched geeky sites. they say microsoft added security settings for old games work i to uninstall update kb, i don’t this update"
1145,2020-11-25 17:06:25+00:00,learn the new cloud like way manage premise databases this depth article rds on vmware cloud solution architect blogger satyashr
1146,2019-04-14 23:59:29+00:00,puzzled the many pieces microsoft word? curious new hidden features? let create customized training plan your team dawn thesoftwarepro.com certifiedwordexpert wordtips
1147,2019-04-14 23:59:14+00:00,"cmathen stephaniecarvin cselley aaronwherry being broad would challenged, appealed overruled every day borderline would to managed real time powerful mgmt govt electronic oversight real time. the big companies facebook google amazon microsoft have the &amp; ai engines"
1148,2019-04-14 23:59:06+00:00,microsoft dynamics gp how eliminate multiple w forms when there are more than two local taxes withheld
1149,2019-04-14 23:58:56+00:00,microsoft reveals hackers accessed accounts months cybersecurity
1150,2019-04-14 23:58:37+00:00,"ddmilburn microsoft windows microsoftstore how it going? we able create realm minecraft? did get touch devs help? please let us know there anything else you need. by the way, we’d love hear your experience through link . thanks ian"
1151,2019-04-14 23:58:34+00:00,josephfcox any indication also got other microsoft webmail/owa?
1152,2019-04-14 23:58:33+00:00,udemy free discount aws certified developer associate udemycoupon &gt; awscertification amazon aws ccna microsoftazure comptiasecurity microsoft comptia salesforce itnetworking cissp oracle itil cisco daysofcode
1153,2019-04-14 23:58:29+00:00,"twitter, ideas get outlook stop putting red notification my mac? its really distracting. i tried looking notification settings, besides closing outlook, i lost. seems pretty straight forward thing microsoft to fix?"
1154,2019-04-14 23:58:21+00:00,microsoft thanks updating windows once make deaf apple you going make hearing aids after airpods killed hearing?
1155,2019-04-15 23:59:59+00:00,avdi did end following many microsoft people purpose was just accident? jw
1156,2020-10-02 15:59:10+00:00,learn an overhaul nj competitive energy market would force state ratepayers pay higher electric bills.
1157,2019-04-15 23:59:35+00:00,"the startup beat google, microsoft &amp; apple combined raleigh techcrunch atlanta zloadr money london bonus deals newzealand jackma seattle lasvegas saintpaul cryptocurrency avcj itos icotracker crowdfunding privateequity miami tezos"
1158,2019-04-15 23:59:23+00:00,"planning meeting conference? bring technology speaker &amp; microsoft certified trainer mct your next meeting, onsite training workshop, webinar add valuable software skills. message here at dawn thesoftwarepro.com conferencespeaker techspeaker"
1159,2019-04-15 23:59:22+00:00,"samsung foldable phone, a microsoft email hack, and more news via wired tech"
1160,2019-04-15 23:59:08+00:00,"samsung foldable phone, a microsoft email hack, and more news tech"
1161,2019-04-15 23:58:39+00:00,"samsung foldable phone, a microsoft email hack, and more news"
1162,2019-04-15 23:58:38+00:00,new repositories created microsoft docs azure devops extensions officedocs support github opensource
1163,2019-04-15 23:58:35+00:00,"i about try booting commodore pc ii this redundantly named amstrad ""microsoft msdos operating system"" boot disk. could anything good come this?"
1164,2019-04-15 23:58:31+00:00,ivan you know microsoft making own pair air buds?
1165,2019-04-15 23:58:20+00:00,microsoft’s disc less xbox one leaked may launch
1166,2019-04-16 23:59:57+00:00,microsoft announced gamepass ultimate check out
1167,2020-10-02 15:59:10+00:00,learn an overhaul nj competitive energy market would force state ratepayers pay higher electric bills.
1168,2019-04-16 23:59:53+00:00,"shinon xbox i know right? hell microsoft released article awhile back, study had, said americas internet actually good as the fcc data showed. ie, was bad. then go release a system you only get games by downloading?.. genius"
1169,2019-04-16 23:59:44+00:00,firlows they also want make own wireless earbuds microsoft please stop no one wants of
1170,2019-04-16 23:59:43+00:00,"microsoft is jumping onto wireless earbud bandwagon, says report"
1171,2019-04-16 23:59:34+00:00,microsoft turned facial recognition sales human rights concerns | news
1172,2019-04-16 23:59:29+00:00,planning meeting conference? add valuable software skills education your next meeting a microsoft certified trainer add training is immediately useful your attendees. message here at dawn thesoftwarepro.com conferencespeaker techspeaker
1173,2019-04-16 23:59:21+00:00,"duebrocessnges playstation if sony that, microsoft would dealt pretty heavy low"
1174,2019-04-16 23:59:21+00:00,prythin that’s dumb fo microsoft. why would do this? rip
1175,2019-04-16 23:58:48+00:00,"new . release administrative template files admx/adml office customization tool microsoft office proplus, office , office outlook, access &amp; office changes including removals afaics"
1176,2019-04-16 23:58:37+00:00,microsoft windows luafv postluafvpostreadwrite section object pointers race condition
1177,2019-04-17 23:59:33+00:00,microsoft turned down facial recognition sales on human rights concerns
1178,2020-11-23 15:22:11+00:00,"do self manage databases premises today? read vexpert blog azizaqeelvm understand rds vmware help set up, operate, scale databases improve productivity lower costs."
1179,2019-04-17 23:59:25+00:00,puzzled the many pieces microsoft outlook? curious new hidden features? let create customized training plan your team dawn thesoftwarepro.com certifiedoutlookexpert outlooktips
1180,2019-04-17 23:59:20+00:00,just customized own renault r.s. car chance score a vip tour renault f team hq microsoft renaultfteam. think can beat time? prove it? itson techmeetstrack sweepstakes
1181,2019-04-17 23:59:18+00:00,"""repression today a horses police security dogs demonstrations the corruption the ecuador lenin moreno government, the inainvestment measures fmi the case julianassange aniunderechomenos mashirafael"" microsoft translation"
1182,2019-04-17 23:59:08+00:00,microsoft xbox one x tb black console excellent condition xboxone xbox game
1183,2019-04-17 23:59:07+00:00,microsoft turned facial recognition sales human rights concerns security isgroupsrl
1184,2019-04-17 23:59:00+00:00,aintgonnagrowup schilling spree wtf microsoft word power user? is like a super typist?
1185,2019-04-17 23:58:58+00:00,microsoft refused sell facial recognition tech law enforcement
1186,2019-04-17 23:58:43+00:00,researcher hijacks microsoft service using loophole azure cloud platform
1187,2019-04-17 23:58:42+00:00,"funnelmasters to my fav house conf microsoft besides insightful esthetically curated content, speakers animated &amp; engaging. is bcuz interact w/ customers data all time? can take as hypothesis measure/dashboard it?"
1188,2019-04-18 23:59:33+00:00,microsoft making vr better those vision problems
1189,2020-11-23 15:22:11+00:00,"do self manage databases premises today? read vexpert blog azizaqeelvm understand rds vmware help set up, operate, scale databases improve productivity lower costs."
1190,2019-04-18 23:59:32+00:00,"cybericua , microsoft product security manager, stage to discuss security response open source software oss image his slide of puerto rico not hawai’i"
