,Time,Text
2005,2019-07-01 23:59:37+00:00,another software upgrade? switching microsoft office ? does team need be productive office office ? stop wasting time get to speed what need message here at dawn thesoftwarepro.com mct officeexpert
2006,2019-07-01 23:59:36+00:00,nickbaratto brandonhandwerk akuefler kraftzacncheese wild since fenton took has basically a microsoft release party.
2007,2019-07-01 23:59:17+00:00,blaqueword challenged me. broke ass trying lol i miss microsoft word public wifi
2008,2019-07-01 23:59:05+00:00,microsoft issues warning for m windows users
2009,2019-07-01 23:58:15+00:00,microsoft intune integration apple volume purchase program vpp macos
2010,2019-07-01 23:57:56+00:00,danypunkz skype microsoft teams
2011,2019-07-01 23:57:53+00:00,finally got notified my e book refunds microsoft. it quite unfortunate they shut down i could buy final book the hisdarkmaterials trilogy.
2012,2019-07-01 23:57:33+00:00,story how internal microsoft hackathon project turned the governance service now know azure resource graph
2013,2019-07-02 23:59:47+00:00,diy free coupon howto power pivot microsoft excel udemy . free startups discount sale freebie learn course gratis onlineclasses onlinecourses udemy udemydiscount udemyfree
2014,2020-11-24 18:59:40+00:00,"""doordash provides much flexibility."" meet d shea. whyidash deliveringgood"
2015,2019-07-02 23:59:41+00:00,"thisguygetslit hermit thrush can recommend buying ibm compatible pc microsoft windows operating system perhaps linux distribution, one feels the call."
2016,2019-07-02 23:59:36+00:00,now i know offices likes use windows instead mac. microsoft excel windows much better easier shortcuts compared mac.
2017,2019-07-02 23:59:33+00:00,we’re a licensed microsoft accessories partner
2018,2019-07-02 23:59:32+00:00,so grateful the support some amazing women microsoft australia &amp; microsoft corp we launch this. i determined it t get missed i away travelling &amp; i a tribe supporters are excited this i am. womenitpros womenintech
2019,2019-07-02 23:59:26+00:00,puzzled the many pieces microsoft powerpoint? curious new features? let create customized training plan your team deliver better presentations dawn thesoftwarepro.com
2020,2019-07-02 23:59:23+00:00,"with excel, chart, even flight simulator, theres telling microsoft the power windows take this summer."
2021,2019-07-02 23:59:15+00:00,"with excel, chart, even flight simulator, theres telling microsoft the power windows take this summer."
2022,2019-07-02 23:59:09+00:00,create pie chart microsoft access
2023,2019-07-02 23:59:06+00:00,"with excel, chart, even flight simulator, theres telling microsoft the power windows take this summer."
2024,2019-07-03 23:59:27+00:00,"amazon, microsoft, google plot pull product manufacturing of china, deepening cold war engulfing tech"
2025,2020-09-03 18:26:48+00:00,"lenovo legion x playapex now your chance rise the rest. unmatched performance, purposeful engineering, modern design. gear with machine savage you are. stylish outside. savage inside."
2026,2019-07-03 23:59:24+00:00,"this week techrepublic zdnet news stories include brand battle apple microsoft, word documents containing malicious links, the future on premises databases. via infosechotspot"
2027,2019-07-03 23:59:15+00:00,microsoft classic intellimouse logicool m
2028,2019-07-03 23:58:47+00:00,"the startup beat google, microsoft &amp; apple combined | russia korea oakland southaustralia avcjsingapore paris miv initialcoinofferings italy mexico alibaba austin netherlands technews iot funding bitcoin icotracker money omaha uae"
2029,2019-07-03 23:58:24+00:00,elegoo official add dm i your robot working ar microsoft datastreamer
2030,2019-07-03 23:58:24+00:00,"facebook, cloudflare, microsoft, twitter suffer outages suffer outages twitter"
2031,2019-07-03 23:58:17+00:00,an ongoing iranian government backed hacking campaign now trying exploit microsoft outlook flaw . the us cyber command issued alert hackers been actively going cve . the flaw a sandbox escape bug ...
2032,2019-07-03 23:57:44+00:00,"youngest building first pc on os selection ""what mean have pay windows? that stupid ubuntu free"" microsoft ubuntu so very true son"
2033,2019-07-03 23:57:34+00:00,"facebook, cloudflare, microsoft, twitter suffer outages"
2034,2019-07-03 23:57:15+00:00,"microsoft’s threat &amp; vulnerability management helps thousands customers discover, prioritize, remediate vulnerabilities real time"
2035,2019-07-04 23:59:33+00:00,i the expert seeker achievement microsoft wordament mobile points trueachievements
2036,2020-11-25 17:06:25+00:00,learn the new cloud like way manage premise databases this depth article rds on vmware cloud solution architect blogger satyashr
2037,2019-07-04 23:59:29+00:00,puzzled the many pieces microsoft outlook? curious new hidden features? let create customized training plan your team dawn thesoftwarepro.com certifiedoutlookexpert outlooktips
2038,2019-07-04 23:59:19+00:00,why microsoft feel like needed hire kpmg?
2039,2019-07-04 23:58:12+00:00,clicked translate button translated dutch microsoft could translate tweet would english need translated ??
2040,2019-07-04 23:56:27+00:00,mikesherov this way bet has since the moment microsoft bought github. it probably the only reason investor interested.
2041,2019-07-04 23:56:12+00:00,my blog portal options microsoft dynamics formerly crm
2042,2019-07-04 23:55:29+00:00,"makominogue very nice i remember really impressed how solid multitasking felt, i guess utilized hardware pre empting multitasking decade microsoft provided to normal customers windows ."
2043,2019-07-04 23:54:57+00:00,cpunrd true would microsoft give a name owned a competitor? just strange. cosmos == dynamo maybe i drinking enough data jungle juuce.
2044,2019-07-04 23:54:07+00:00,"reasther cornell i tend agree your sentiments, especially the ""microsoft publishers"", elsevier... yes, s damning it sounds no, microsoft t slipped well deserved tarnished reputation"
2045,2019-07-04 23:54:00+00:00,neowin microsoft creates hub all its insider programs
2046,2019-07-05 23:59:41+00:00,"rtenews begrudgery a national pass time ireland. people point fingers artists like bono choose move a country lower tax rates, however, they cheer companies like microsoft move ireland the corp. tax rate lower the usa."
2047,2020-11-23 15:22:11+00:00,"do self manage databases premises today? read vexpert blog azizaqeelvm understand rds vmware help set up, operate, scale databases improve productivity lower costs."
2048,2019-07-05 23:59:37+00:00,i achievements microsoft wordament mobile points trueachievements
2049,2019-07-05 23:59:37+00:00,i the good be king achievement microsoft solitaire collection uwp points trueachievements
2050,2019-07-05 23:59:36+00:00,i the snowfall success achievement microsoft solitaire collection uwp points trueachievements
2051,2019-07-05 23:59:09+00:00,microsoft sony may reduce production china due tariffs | digital trends
2052,2019-07-05 23:57:27+00:00,"techbiznerd benedictevans you missing point. the world moved past whatever ibm microsoft doing they dominant world also move past whatever current big doing. competition t make ibm/microsoft irrelevant, the pace history and was w/ big"
2053,2019-07-05 23:56:37+00:00,new repositories created microsoft azure azure sdk native azure functions rabbitmq extension azure functions eventhubs extenstion github opensource azure
2054,2019-07-05 23:56:35+00:00,new repositories created microsoft docs learn certs loc test.cs cz learn certs loc test.de de github opensource microsoftdocs
2055,2019-07-05 23:55:46+00:00,"tommy sergerynazarov said are ""working"" them are partners microsoft bletchley integrate chainlink, that s everyone speculating that they will make announcement soon. fingerscrossed"
2056,2019-07-05 23:54:40+00:00,microsoft discloses security breach impacted outlook accounts
2057,2019-07-06 23:59:54+00:00,"guide nosql azure cosmos db e book | microsoft azure , see"
2058,2020-09-03 18:26:48+00:00,"lenovo legion x playapex now your chance rise the rest. unmatched performance, purposeful engineering, modern design. gear with machine savage you are. stylish outside. savage inside."
2059,2019-07-06 23:59:37+00:00,i the force of habit achievement microsoft mahjong win points trueachievements
2060,2019-07-06 23:59:33+00:00,i the peak jumper achievement microsoft solitaire collection uwp points trueachievements
2061,2019-07-06 23:59:27+00:00,another software upgrade? switching microsoft office ? does team need be productive office office ? stop wasting time get to speed what need message here at dawn thesoftwarepro.com mct officeexpert
2062,2019-07-06 23:59:25+00:00,"chloecondon docsmsft vaness diaz microsoft azure microsoftwomen microsoftsv linuxfoundation omg bashmouth. that single great, too, ""i t get enough you, ruby"""
2063,2019-07-06 23:58:56+00:00,this to the stupidest decision microsoft made.
2064,2019-07-06 23:58:51+00:00,potholedsea marc irl it a chimera microsoft haters salty pvpers
2065,2019-07-06 23:58:21+00:00,berniesanders they take financial risk get that position.amazon started garage employs k. microsoft the and now employs k. warren buffet businesses employs k. their risk pays a boatload taxes.
2066,2019-07-06 23:57:16+00:00,chloecondon docsmsft vaness diaz microsoft azure microsoftwomen microsoftsv linuxfoundation sounds like win me
2067,2019-07-06 23:56:44+00:00,i love idea one paper bible given all microsoft employees around christmas billgates
2068,2019-07-07 23:59:56+00:00,"amandaksilver code microsoft johnmont fully agree, what and team done code remote development features make best both worlds. browsers limiting still. i curious see how/if webassembly play role bridging gap permissions access filesystem etc."
2069,2020-11-23 15:22:11+00:00,"do self manage databases premises today? read vexpert blog azizaqeelvm understand rds vmware help set up, operate, scale databases improve productivity lower costs."
2070,2019-07-07 23:59:54+00:00,"the startup beat google, microsoft &amp; apple combined | top funding fintech stratis portland denver bitcoin btc wavesplatform icos tokenmarket ico saltlakecity ethereum funds spain boise bitcoinrussia startup kualalumpur abraaj"
2071,2019-07-07 23:58:54+00:00,windows security in question microsoft issues warning for m windows users
2072,2019-07-07 23:58:46+00:00,karenselfkare mcjuggernuggets or actually s tesla gps. is microsoft cortana...i think
2073,2019-07-07 23:58:07+00:00,"it high time. i believe schools learn, fuck devices. as work, everything twisted technology need promote product everywhere, unless course you are not the owner apple microsoft corporation."
2074,2019-07-07 23:58:03+00:00,"theap gearsofwar i mean halo still getting pumped , you any better ideas games let us microsoft know"
2075,2019-07-07 23:56:43+00:00,"eisokant code microsoft johnmont the ergonomics remote development bring ton benefits dev box setup no longer pain, deeper analysis your inner loop, collab be much easier. it be a combination remote local. a browser based editor isn’t preferred all scenarios."
2076,2019-07-07 23:56:19+00:00,"hopefully microsoft introduces “windows fuck off edition” tomorrow. an os doesn’t auto load services startup force spyware, updates, “cloud” bs etc... oh, doesn’t completely fuck everything audio every update..."
2077,2019-07-07 23:56:07+00:00,"gates gets it right about steve jobs, microsoft premium"
2078,2019-07-07 23:55:22+00:00,"remembered can get microsoft office free you a student, i guess college t a total waste"
2079,2019-07-08 23:59:53+00:00,nyxtheshield this reminds of microsoft word back
2080,2019-07-08 23:59:38+00:00,"upgrading new program? planning meeting conference? hire a microsoft certified trainer bring valuable software tips &amp; techniques your next meeting, onsite training workshop webinar. message here at dawn thesoftwarepro.com productivity mct"
2081,2019-07-08 23:59:35+00:00,"grantwtrent it almost none existent the fps world, microsoft tried in halo the pc interface suprior the console . rts practically non exestant console. it s technically possible, the input interface hardware variations make uncompetitive"
2082,2019-07-08 23:59:25+00:00,dismantling fileless campaign microsoft defender atp next gen protection exposes astaroth attack microsoft security
2083,2019-07-08 23:59:20+00:00,"rt microsoft ""we throwing back to celebrate ""neverending"" potential stem stranger things. learn strangerthings"""
2084,2019-07-08 23:59:13+00:00,microsoft discovers fileless astaroth trojan campaign
2085,2019-07-08 23:59:12+00:00,microsoft windows . app celebrates stranger things season
2086,2020-11-23 15:14:07+00:00,pursuing career the trades? the dewalt trades scholarship could help pay degree a two year college vocational technical school. apply and start building your future.
2087,2019-07-08 23:59:09+00:00,"microsoft stranger things well done, post looks great, checkout instacryptonews work great too."
2088,2019-07-08 23:59:07+00:00,angelurena jaketapper is any information who wrote or said before was written microsoft word screen shot?
2089,2019-07-08 23:58:24+00:00,microsoft releases windows . throwback app a stranger things tie – ars technica
2090,2019-07-09 23:59:37+00:00,i achievements microsoft solitaire collection uwp points trueachievements
2091,2020-11-23 15:22:11+00:00,"do self manage databases premises today? read vexpert blog azizaqeelvm understand rds vmware help set up, operate, scale databases improve productivity lower costs."
2092,2019-07-09 23:59:29+00:00,puzzled the many pieces microsoft excel? curious new hidden features? let create customized training plan your team dawn thesoftwarepro.com certifiedexcelexpert exceltips
2093,2019-07-09 23:59:22+00:00,saracarterdc microsoft that would be my first question i would enjoy to have that opportunity to make figures
2094,2019-07-09 23:59:21+00:00,check our azure event boise microsoft august th. info sign here
2095,2019-07-09 23:59:18+00:00,"get your flow community ""user group member"" badge microsoft"
2096,2019-07-09 23:59:12+00:00,that easy... cayde bungie destinythegame destiny destiny destinyforsaken titan hunter warlock ironlords blackarmory xboxone videogames gaming pvp pve raid clan new nine share microsoft content deej bng cozmo a dmg bungie destinythegame
2097,2019-07-09 23:59:05+00:00,"this call center company relies a workforce incarcerated women help companies like microsoft, sap, dell power sales marketing"
2098,2019-07-09 23:59:04+00:00,amazon microsoft battle bn war cloud contract pentagon
2099,2019-07-09 23:58:33+00:00,"imagine telling that you say ""man think trust microsoft to build government artificial intelligence secret data cache"""
2100,2019-07-09 23:58:17+00:00,real elliebrown saracarterdc microsoft happens over. it getting harder harder us natives get tech job.
2101,2019-07-10 23:59:37+00:00,i achievements microsoft wordament mobile points trueachievements
2102,2020-11-23 15:22:11+00:00,"do self manage databases premises today? read vexpert blog azizaqeelvm understand rds vmware help set up, operate, scale databases improve productivity lower costs."
2103,2019-07-10 23:59:34+00:00,i achievements microsoft mahjong win points trueachievements
2104,2019-07-10 23:59:34+00:00,i achievements microsoft wordament mobile points trueachievements
2105,2019-07-10 23:59:33+00:00,"she realizes drove the wrong store. then starts insisting microsoft still makes brand new wireless xbox controllers. i said don make new wireless ones, wired ones; she wants wireless controller, only preowned."
2106,2019-07-10 23:59:22+00:00,"bradsmi if microsoft supports legislation, wants equal treatment green card applicants all countries, did company give , political donations of house members voted it today?"
2107,2019-07-10 23:59:08+00:00,&gt; idc marketscape microsoft leader iiot platforms manufacturing energy
2108,2019-07-10 23:59:07+00:00,&gt; c .net reunified microsoft’s plans .net
2109,2019-07-10 23:59:07+00:00,latest zdnet microsoft adds new passwordless sign option latest windows h test build
2110,2019-07-10 23:59:06+00:00,"microsoft xbox one s tb minecraft bundle, white, fast gaming, blu ray capable minecraft playing game"
2111,2019-07-10 23:59:04+00:00,"jhong voxdotcom no ""microsoft might crush slack"""
2112,2019-07-11 23:59:38+00:00,"zcichy yeah, i wouldn’t expect anything else year. i hope see even colours the future. it’d nice nintendo was microsoft doing custom xbox one controllers"
2113,2020-11-25 17:06:25+00:00,learn the new cloud like way manage premise databases this depth article rds on vmware cloud solution architect blogger satyashr
2114,2019-07-11 23:59:37+00:00,i the all star achievement microsoft wordament mobile points trueachievements
2115,2019-07-11 23:59:36+00:00,microsoft’s azure kinect ai camera now shipping the us china
2116,2019-07-11 23:59:30+00:00,change can be hard ... let make it easier upgrading microsoft office ? does team need be productive a new program? let create engaging &amp; valuable training experience. message here at dawn thesoftwarepro.com mct change
2117,2019-07-11 23:59:01+00:00,three free training opportunities learn about artificial intelligence ai | microsoft latinx
2118,2019-07-11 23:58:59+00:00,"onedrive microsoft i configured pc sync onedrive is working expected. however am setting onedrive another laptop, reverse sync desktop document folders working. how i fix it?"
2119,2019-07-11 23:58:57+00:00,american giants here how these companies stack up against world via howmuch net world business apple amazon microsoft
2120,2019-07-11 23:58:49+00:00,"microsoft teams million daily active users, beating slack"
2121,2019-07-11 23:58:28+00:00,excited share jdasoftware been named us retail partner the year &amp; finalist global partner the year microsoft learn jdaproud mspartner
2122,2019-07-11 23:58:18+00:00,"rt microsoft "" mixedreality becoming reality frontline workers via nytimes"""
2123,2019-07-12 23:59:55+00:00,newsatw microsoft closing its internet games windows – cnet the team decided “heavy hearts” shut hearts.
2124,2020-11-23 15:22:11+00:00,"do self manage databases premises today? read vexpert blog azizaqeelvm understand rds vmware help set up, operate, scale databases improve productivity lower costs."
2125,2019-07-12 23:59:51+00:00,xboxsupport so looks like xbox one x shit bed. it the original run scorpio editions. am i reading correctly it for microsoft repair it...?
2126,2019-07-12 23:59:46+00:00,amandassterner deltanr hopefully it no longer free send urgent messages microsoft starts charging people limit usage.
2127,2019-07-12 23:59:38+00:00,i the exceptional seeker achievement microsoft wordament mobile points trueachievements
2128,2019-07-12 23:59:38+00:00,i the savior the world achievement microsoft minesweeper win points trueachievements
2129,2019-07-12 23:59:35+00:00,i the mining gold achievement microsoft solitaire collection uwp points trueachievements
2130,2019-07-12 23:59:33+00:00,"office microsoft teams, excel, planner comes as close third."
2131,2019-07-12 23:59:25+00:00,"upgrading office ? planning meeting conference? bring technology speaker &amp; microsoft certified trainer your next meeting, onsite training workshop, webinar add valuable software skills. message here at dawn thesoftwarepro.com"
2132,2019-07-12 23:59:03+00:00,"rt com everyone violating privacy users including microsoft, google, yahoo, bing, samsung, huawei apple iphone android, sony, hp, dell, intel"
2133,2019-07-12 23:58:52+00:00,notcarro lol translated japanese microsoft he just that u /&gt; | l / mi xno / | / no │| / i singing. | | i singing. \two
2134,2019-07-13 23:59:48+00:00,"jo thecat time bust candles make pentagram of salt, s the only way contact microsoft support."
2135,2020-11-25 17:06:25+00:00,learn the new cloud like way manage premise databases this depth article rds on vmware cloud solution architect blogger satyashr
2136,2019-07-13 23:59:34+00:00,i the first one free achievement microsoft solitaire collection uwp points trueachievements
2137,2019-07-13 23:59:26+00:00,planning meeting conference? add valuable software skills education your next meeting a microsoft certified trainer add training is immediately useful your attendees. message here at dawn thesoftwarepro.com conferencespeaker techspeaker
2138,2019-07-13 23:58:14+00:00,"check this amazon bestseller microsoft lumia uk sim free smart phone, black £."
2139,2019-07-13 23:56:09+00:00,my blog tips getting most microsoft consulting services mcs
2140,2019-07-13 23:56:08+00:00,come get some going live mixer mixer microsoft xbox xboxlive twitter instagram snapchat multiplayer apexlegendsseason otwtonii streamlabs steamerslife losangeles california octane …
2141,2019-07-13 23:55:52+00:00,microsoft word hits billion installs android
2142,2019-07-13 23:55:15+00:00,meet george his th microsoft partner conference true veteran msinspire
2143,2019-07-13 23:55:03+00:00,rt calsoftsystems it’s great see microsoft enhancing ms dynamics be in tune market trends microsoftdynamics calsoft
2144,2019-07-13 23:55:01+00:00,microsoft’s azure data share aims make big data sharing easier safer
2145,2019-07-14 23:59:47+00:00,"love the inclusive tech lab microsoft. thank you, brycej, the tour"
2146,2020-11-25 17:06:25+00:00,learn the new cloud like way manage premise databases this depth article rds on vmware cloud solution architect blogger satyashr
2147,2019-07-14 23:59:37+00:00,"planning meeting conference? bring technology speaker &amp; microsoft certified trainer mct your next meeting, onsite training workshop, webinar add valuable software skills. message here at dawn thesoftwarepro.com conferencespeaker techspeaker"
2148,2019-07-14 23:59:36+00:00,i the become star achievement microsoft solitaire collection uwp points trueachievements
2149,2019-07-14 23:59:34+00:00,i achievements microsoft wordament mobile points trueachievements
2150,2019-07-14 23:59:34+00:00,how set microsoft cloud app security
2151,2019-07-14 23:59:05+00:00,setup visual studio development vm microsoft azure cloud windows
2152,2019-07-14 23:58:21+00:00,"halo microsoft xbox, ebay ends h last price usd ."
2153,2019-07-14 23:57:40+00:00,"microsoft introduces passwordless feature its windows devices, replaces with windows hello face"
2154,2019-07-14 23:57:15+00:00,bendagaming happened alot a updates ago microsoft. could well messed something in update possibly could a game. though believe i looked that issue no way fix far as the pc user.
2155,2019-07-14 23:56:50+00:00,microsoft is my xboxsupport account gets communication ban every single time i send reply a message?? it’s fucking off never got shit askplaystation
2156,2019-07-15 23:59:52+00:00,"many extremely important partnerships microsoft, amazon, swift not announced yet other cryptocurrencies would frothing mouth given chance merely work these companies. the google announcement alone doubled the price"
2157,2020-10-02 15:59:10+00:00,learn an overhaul nj competitive energy market would force state ratepayers pay higher electric bills.
2158,2019-07-15 23:59:27+00:00,"new post iot platform market swot analysis key growth methodologies | ibm, microsoft, amazon web services,"
2159,2019-07-15 23:59:13+00:00,spanky teamyoutube probably microsoft side. seems like ve having constant problems lately.
2160,2019-07-15 23:59:10+00:00,"steven guggenheimer microsoft, talks why need data ai. stevenguggs microsoft knightrm furrier infa thecube data ai microsoftinspire datamodel"
2161,2019-07-15 23:59:00+00:00,google microsoft ceos both asians are working bring more asian workers both companies refused work the u.s. government have agreed work the communist chinese government. and are suppose believe diversity a strength.
2162,2019-07-15 23:58:30+00:00,okay s good microsoft word? i t get something move some reason.... help — feeling drained
2163,2019-07-15 23:58:30+00:00,"bitcoins frappuccino will starbucks’ crypto endeavours pave way mainstream adoption? blockchain, starbucks, adoption, usa, microsoft, bakkt"
2164,2019-07-15 23:58:29+00:00,"clfrnkxn i say go what heart desires. i seen generalists specialists, succeeding. the industry large enough there room everyone. i never worked microsoft i t answer"
2165,2019-07-15 23:58:06+00:00,. microsoft human computer interaction expert vidsrinivasan faced challenges excelling tech head while children. now s helping women the same. iamstem
2166,2019-07-15 23:58:00+00:00,"surface i microsoft surface book i need replace battery does charge, please help"
2167,2019-07-16 23:59:51+00:00,iamlastoracle streamlabs i having similar issues i updated windows . i used product key i originally purchased the laptop went microsoft’s website updated computer windows free
2168,2020-10-02 16:11:07+00:00,nj considering massive overhaul state competitive energy market would create monopoly higher electricity rates. sign the petition let nj officials know can afford pay for electricity.
2169,2019-07-16 23:59:32+00:00,hey microsoft hell would make “asap” the first watermark the list instead draft???
2170,2019-07-16 23:59:29+00:00,another software upgrade? switching microsoft office ? does team need be productive office office ? stop wasting time get to speed what need message here at dawn thesoftwarepro.com mct officeexpert
2171,2019-07-16 23:59:27+00:00,feds microsoft worker stole millions digital currency
2172,2019-07-16 23:59:25+00:00,new post feds microsoft worker stole millions digital currency been published daily world news
2173,2019-07-16 23:59:06+00:00,dell microsoft pour millions a.i. start ups are reshaping workforce cnbc artificialintelligence ai technology
2174,2019-07-16 23:58:52+00:00,we excited announce preview lenovo digital distribution center ddc solution iot solution developed collaboration nvidia microsoft. dicker data nz wearelenovo
