,date,tweet,topic,sentiment
289,2019-01-28,"yes, are tasty, like fresh apple",214.0,"[0.9075072483946551, 1.0079542815266862, -0.1876655406390073]"
290,2019-01-29,"apple, amgen, amd more vixc latestcomments",223.0,"[0.8237452777118932, 0.6080792256560347, -0.27291600973424146]"
291,2019-01-29,"alisonnnn thank reaching us. we know is important be able track workouts. we be happy to look this you. can tell us apple watch version software re using? dm us, we get started.",223.0,"[0.8237452777118932, 0.6080792256560347, -0.27291600973424146]"
292,2019-01-29,"responsible bug/flaw/vulnerability disclosure t mean publicly reveal straight away. you work the reporter the issue, develop patch, deploy disclose...this cnn report a bit harsh apple...",223.0,"[0.8237452777118932, 0.6080792256560347, -0.27291600973424146]"
293,2019-01-29,apple just shut down facetime group calls due a huge security flaw,223.0,"[0.8237452777118932, 0.6080792256560347, -0.27291600973424146]"
294,2019-01-29,mcdonalds apple pie my jaan,223.0,"[0.8237452777118932, 0.6080792256560347, -0.27291600973424146]"
295,2019-01-29,apple shut facetime... endofprivacyasweknowit,223.0,"[0.8237452777118932, 0.6080792256560347, -0.27291600973424146]"
296,2019-01-29,detroitborg apple clearance...? news me.,223.0,"[0.8237452777118932, 0.6080792256560347, -0.27291600973424146]"
297,2019-01-29,"""our customers holding to older iphones bit longer in past."" here what tim cook said apple disappointing iphone sales",223.0,"[0.8237452777118932, 0.6080792256560347, -0.27291600973424146]"
298,2019-01-29,macrumors julipuli high upfront costs guys see cdn . headphone jack/dongle mess. antenna issues. no “killer feature” like say google’s night vision camera . increasing stability android os. all reasons upgrade adoption down. don’t think is news anyone apple,223.0,"[0.8237452777118932, 0.6080792256560347, -0.27291600973424146]"
299,2019-01-29,"roland bessa utube apple valley, california",223.0,"[0.8237452777118932, 0.6080792256560347, -0.27291600973424146]"
300,2019-01-30,apple trailed samsung holiday quarter with estimated .m iphones shipped,236.0,"[1.1035255742163987, 0.7915808277815628, -0.25093105140751304]"
301,2019-01-30,juansfit apple jacks time favorite,236.0,"[1.1035255742163987, 0.7915808277815628, -0.25093105140751304]"
302,2019-01-30,reset dns cache os x apple support webdev php js,236.0,"[1.1035255742163987, 0.7915808277815628, -0.25093105140751304]"
303,2019-01-30,apple million hbcu scholarship program includes week summer internship,236.0,"[1.1035255742163987, 0.7915808277815628, -0.25093105140751304]"
304,2019-01-30,"sthensnow become professional helicopter pilot, ignore idiot parents, buy apple stocks they kick jobs out, buy the bitcoin can soon it available.",236.0,"[1.1035255742163987, 0.7915808277815628, -0.25093105140751304]"
305,2019-01-30,verge could care less... i really need for apple let us stream k movies my imacpro via itunes,236.0,"[1.1035255742163987, 0.7915808277815628, -0.25093105140751304]"
306,2019-01-30,nuelweinchard apple congrats chief hv grt day,236.0,"[1.1035255742163987, 0.7915808277815628, -0.25093105140751304]"
307,2019-01-30,apple bans facebook tech tools tracking teen browsing habits,236.0,"[1.1035255742163987, 0.7915808277815628, -0.25093105140751304]"
308,2019-01-30,apple planning d cameras next year iphones; three rear cameras setup for this year phone; dark mode ios report,236.0,"[1.1035255742163987, 0.7915808277815628, -0.25093105140751304]"
309,2019-01-30,apple escalates war facebook its privacy practices,236.0,"[1.1035255742163987, 0.7915808277815628, -0.25093105140751304]"
310,2019-01-31,golett oh ive definitely use apples havent able to farm event really bc midterms atm,241.0,"[0.7364718858366046, 0.5861643978025661, -0.21812412874323633]"
311,2019-01-31,my apple watch dead whole week. still rocking,251.0,"[0.044414447219375756, 0.024319931573144153, -0.036069423586664894]"
312,2019-01-31,dumbest take the day the apple facebook thing daring fireball,241.0,"[0.7364718858366046, 0.5861643978025661, -0.21812412874323633]"
313,2019-01-31,this shiesty nigga jay z finally put music apple music,241.0,"[0.7364718858366046, 0.5861643978025661, -0.21812412874323633]"
314,2019-01-31,"wikileaks damn, can hardly spew lie without choking her adam apple.",241.0,"[0.7364718858366046, 0.5861643978025661, -0.21812412874323633]"
315,2019-01-31,librariangrumpy arcaniisurvival telephonenut auntfluffy davidhogg let drop hypothetical. there way we track weapons real time they leave manufacturer keep with owns them? im envisioning something akin how apple made phones like paper weights those arent original owner,241.0,"[0.7364718858366046, 0.5861643978025661, -0.21812412874323633]"
316,2019-01-31,do oranges bruise like apples? say a toddler threw one across kitchen? askingforafriend rubyisabelle,241.0,"[0.7364718858366046, 0.5861643978025661, -0.21812412874323633]"
317,2019-01-31,apple reactivates facebook’s employee apps punishment research spying,241.0,"[0.7364718858366046, 0.5861643978025661, -0.21812412874323633]"
318,2019-01-31,"my fucking phone tripping , apple gotta see",241.0,"[0.7364718858366046, 0.5861643978025661, -0.21812412874323633]"
319,2019-01-31,in part the continuing apple facebook saga apple revokes facebook’s enterprise license taking internal fb apps ios offline varneyco foxbusiness inews en,241.0,"[0.7364718858366046, 0.5861643978025661, -0.21812412874323633]"
