,date,tweet,topic,sentiment
268,2019-01-24,"at disney ice bella , i’m ready hear let go ignorant levels .",187.0,"[0.5158962506062257, 0.5437936863177909, -0.17465220568001963]"
269,2019-01-24,some dogs worth melting ️️ . . . ohmydarlingclementine goldador goldenretriever yellowlab labradorretriever dogsofinstagram puppiesofinstagram frozen olaf disney…,187.0,"[0.5158962506062257, 0.5437936863177909, -0.17465220568001963]"
270,2019-01-24,hanging a couple goofballs disneyonice worldsofenchantment schultzgirls disney sisters love keybank center,187.0,"[0.5158962506062257, 0.5437936863177909, -0.17465220568001963]"
271,2019-01-24,vettix thank for disney on ice tickets. vettix disneyonice,198.0,"[0.05453191105932556, 0.05039102955842665, -0.06955199801335114]"
272,2019-01-24,jeffmovieman i think could happen disney ever decides give a special limited release s within same stance how handled walt disney treasures dvd sets back the early s.,187.0,"[0.5158962506062257, 0.5437936863177909, -0.17465220568001963]"
273,2019-01-24,"i at amc disney springs dine theatres lake buena vista, fl",187.0,"[0.5158962506062257, 0.5437936863177909, -0.17465220568001963]"
274,2019-01-24,netflix grabbing all properties can disney launches,187.0,"[0.5158962506062257, 0.5437936863177909, -0.17465220568001963]"
275,2019-01-25,"variety it weird hard is the industry shun abusers. there victor salva, director powder the jeepers creepers trilogy, did prison time sexually abusing child actor set, went to work disney keep directing.",196.0,"[0.6366528385388432, 0.5912288459477586, -0.27680017665360446]"
276,2019-01-25,that’s raven the best disney show &amp; that’s period.,196.0,"[0.6366528385388432, 0.5912288459477586, -0.27680017665360446]"
277,2019-01-25,skywardwing was st world disney world?,196.0,"[0.6366528385388432, 0.5912288459477586, -0.27680017665360446]"
278,2019-01-25,what exactly disney when hidan appeared they airing shippuden? sharkbot,196.0,"[0.6366528385388432, 0.5912288459477586, -0.27680017665360446]"
279,2019-01-25,i decided go to disney today of course iamxavienhoward goes i missed him.,196.0,"[0.6366528385388432, 0.5912288459477586, -0.27680017665360446]"
280,2019-01-25,disney kids man...,196.0,"[0.6366528385388432, 0.5912288459477586, -0.27680017665360446]"
281,2019-01-25,"realronhoward as long disney t involved kid, cos ll kill everbody",196.0,"[0.6366528385388432, 0.5912288459477586, -0.27680017665360446]"
282,2019-01-25,disney lmfao you’re beastin,196.0,"[0.6366528385388432, 0.5912288459477586, -0.27680017665360446]"
283,2019-01-25,even mickeymouse to stop pet at pro bowl practice today.. irresistible aladdinnation disney espn probowl espn wide world sports,196.0,"[0.6366528385388432, 0.5912288459477586, -0.27680017665360446]"
284,2019-01-25,ana. elsa. vanellope. ralph. srokadisneyvacay ana elsa vanellope wreckitralph epcot walt disney world,196.0,"[0.6366528385388432, 0.5912288459477586, -0.27680017665360446]"
285,2019-01-25,"new nursery rhyme alert it ""hickory dickory dock "" | disney junior music nursery rhymes | disney junior via youtube",196.0,"[0.6366528385388432, 0.5912288459477586, -0.27680017665360446]"
286,2019-01-26,calling disney lovers you disney gift card paypal cash choice is up you it takes seconds enter to enter ️⃣ follow cmpatricio ️⃣…,204.0,"[0.9152757493777557, 0.8673984536695762, -0.3503664395105742]"
287,2019-01-26,kazza glennon vicky l l disney moth,204.0,"[0.9152757493777557, 0.8673984536695762, -0.3503664395105742]"
288,2019-01-26,"well...disney a long history hiring sketchy protecting pedophiles, no surprise abhorrent behavior coming those within vile camp.",204.0,"[0.9152757493777557, 0.8673984536695762, -0.3503664395105742]"
289,2019-01-26,check what i added my closet poshmark disney princess cinderella pink dress. via poshmarkapp shopmycloset,204.0,"[0.9152757493777557, 0.8673984536695762, -0.3503664395105742]"
290,2019-01-26,pocoyo disney pixar cars shaun the sheep mr bean perman ninja hattori and dibo the gift dragon friends,204.0,"[0.9152757493777557, 0.8673984536695762, -0.3503664395105742]"
291,2019-01-26,more disney toys,204.0,"[0.9152757493777557, 0.8673984536695762, -0.3503664395105742]"
292,2019-01-26,"all dreams come true, we the courage pursue walt disney",204.0,"[0.9152757493777557, 0.8673984536695762, -0.3503664395105742]"
293,2019-01-26,shanedawson i’m going save i my bus ride disney the drive for me hours,204.0,"[0.9152757493777557, 0.8673984536695762, -0.3503664395105742]"
294,2019-01-26,stitch one my favorite disney characters nice finally a cool figure him. i always regret i t get revotech one i the chance. this t come…,204.0,"[0.9152757493777557, 0.8673984536695762, -0.3503664395105742]"
295,2019-01-26,"einsteinmaga sherry savannahsmith stephenbakeplus yankeeyardbird snack jamesbo codysmom badeye karen erotoo rsnoeljr belcherjody phyrefligh kimberlymrsrr teedisme kernunited patriotpennsy ellej turning points us history boston tea party constitutional convt d day patriot media revolt in patriots save us protesting boycotting bankrupting all leftist, globalist &amp; anti american media disney/abc timewarner/cnn cbs nbc rt all",204.0,"[0.9152757493777557, 0.8673984536695762, -0.3503664395105742]"
296,2019-01-26,. disney no thank you. boycottdisney,204.0,"[0.9152757493777557, 0.8673984536695762, -0.3503664395105742]"
297,2019-01-27,top heroic sacrifices disney movies like us fb,207.0,"[0.663225948535269, 0.5445771813246989, -0.1139060224556157]"
298,2019-01-27,shawnemerriman jovaisg most families can’t scrape enough money go one regular season game let alone disney vaca.,207.0,"[0.663225948535269, 0.5445771813246989, -0.1139060224556157]"
299,2019-01-27,countrycaravan no joke? disney robin hood.,207.0,"[0.663225948535269, 0.5445771813246989, -0.1139060224556157]"
300,2019-01-27,i t explain bad i beat over . i and getting younger. what i need change? do i really need flake a disney style something?,207.0,"[0.663225948535269, 0.5445771813246989, -0.1139060224556157]"
301,2019-01-27,disney really pushing kim possible movie like really want,207.0,"[0.663225948535269, 0.5445771813246989, -0.1139060224556157]"
302,2019-01-27,what you looking forward seeing the new kingdomhearts game tuesday we start magical adventure sora the gang visiting our good friends other worlds kh khsharethemagic kingdomhearts disney kingdomheartsiii streaming videogame,207.0,"[0.663225948535269, 0.5445771813246989, -0.1139060224556157]"
303,2019-01-27,"love dresses ⁦ hottopic⁩ my favorite ones the blue dress, red dress, the brown dress. i also love meg’s dress hercules. all the dresses stylish cute. ⁦ hottopic⁩ hottopic dresses disney style cute",207.0,"[0.663225948535269, 0.5445771813246989, -0.1139060224556157]"
304,2019-01-27,i discovered on poshmark new neff x disney collab shirt . via poshmarkapp,207.0,"[0.663225948535269, 0.5445771813246989, -0.1139060224556157]"
305,2019-01-27,we live at come hang with us we talk theories whether not disney verse a video game other wreck it ralph theories,207.0,"[0.663225948535269, 0.5445771813246989, -0.1139060224556157]"
306,2019-01-27,channelling inner disney princess sealifepark,207.0,"[0.663225948535269, 0.5445771813246989, -0.1139060224556157]"
307,2019-01-27,"hardcorecarol dglitter disney one , s resell price...",207.0,"[0.663225948535269, 0.5445771813246989, -0.1139060224556157]"
308,2019-01-28,"djbelieve kn daredevil marvel disney he need armor melvin potter, naturally he to fight bullseye.",219.0,"[0.6338956367855402, 0.5765514012320218, -0.18726727757342412]"
309,2019-01-28,waltdisneyco disney announces black panther return the big screen for free honor black history month people still find something complain about/post something negative. really???,219.0,"[0.6338956367855402, 0.5765514012320218, -0.18726727757342412]"
310,2019-01-28,popcrave disney why she look like plastic rey,219.0,"[0.6338956367855402, 0.5765514012320218, -0.18726727757342412]"
311,2019-01-28,"i in mega hibernation mode this stupid snow, tonight i watching disney parks history vids worldbuilding our d&amp;d campaign. also, drinking copious amounts of tea",219.0,"[0.6338956367855402, 0.5765514012320218, -0.18726727757342412]"
312,2019-01-28,georgiagrundman disney chick eh,219.0,"[0.6338956367855402, 0.5765514012320218, -0.18726727757342412]"
313,2019-01-28,disney infinity . edition princess playthrough,219.0,"[0.6338956367855402, 0.5765514012320218, -0.18726727757342412]"
314,2019-01-28,"ayaa buypopcorn if ever watch ""in fabric"" imagine disney the shop. they run commercial a stylish tv they stand and wave the screen ""come us, come us"".",219.0,"[0.6338956367855402, 0.5765514012320218, -0.18726727757342412]"
315,2019-01-28,omg she looks just like rey from star wars. she’s my favorite jedi in the entire star wars saga. i love you disney.,219.0,"[0.6338956367855402, 0.5765514012320218, -0.18726727757342412]"
316,2019-01-28,"walked spouse chill room say something, instead the usual pop, broadway, disney, etc music heavy metal drums, like thrash black metal drums. i was impressed, happy, so it, i forgot i wanted say.",219.0,"[0.6338956367855402, 0.5765514012320218, -0.18726727757342412]"
317,2019-01-28,thealphajayshow wtf is disney trying bring back mlg?,219.0,"[0.6338956367855402, 0.5765514012320218, -0.18726727757342412]"
318,2019-01-28,"not families visit walt disney world or less people. so is best place stay larger families? happily, disney offers number options families or more.",219.0,"[0.6338956367855402, 0.5765514012320218, -0.18726727757342412]"
319,2019-01-29,"bhadbhabie you a big imagination, work disney.",227.0,"[0.3031046396994403, 0.2221865857016709, -0.287210939066043]"
320,2019-01-29,rodeothealbum he look like larry houdini turned boogie man disney’s ‘don’t look the bed’,227.0,"[0.3031046396994403, 0.2221865857016709, -0.287210939066043]"
321,2019-01-29,i liked youtube video disney goes bad ? collab with jaiplayssims,227.0,"[0.3031046396994403, 0.2221865857016709, -0.287210939066043]"
322,2019-01-29,i liked youtube video random food review walt disney world resort,227.0,"[0.3031046396994403, 0.2221865857016709, -0.287210939066043]"
323,2019-01-29,its finally time let get started kh twitch finally kingdomhearts mayyourheartbeyourguidingkey stream live disney finalfantasy,227.0,"[0.3031046396994403, 0.2221865857016709, -0.287210939066043]"
324,2019-01-29,"so, we some kind idea disney work.",227.0,"[0.3031046396994403, 0.2221865857016709, -0.287210939066043]"
325,2019-01-29,shotoniphone disney springs,227.0,"[0.3031046396994403, 0.2221865857016709, -0.287210939066043]"
326,2019-01-29,"it finally time. i been waiting long this game. come join us an adventure keyblades disney characters. kingdom hearts iii going love,",227.0,"[0.3031046396994403, 0.2221865857016709, -0.287210939066043]"
327,2019-01-29,"jahovaswitniss honestly you any type disney fan, i would play them. it fucking dope play simba shit example. the game mechanics story not super involved it easy get well.",227.0,"[0.3031046396994403, 0.2221865857016709, -0.287210939066043]"
328,2019-01-29,"here go ^,..,^ kingdomhearts finalfantasy squareenix squaresoft djalphaomega finalfantasy fullplaythrough disney gaming twitchaffiliate twitchpartner videogame videogames consolegaming epic weeb weebshit criticalmode specialedition newgame",227.0,"[0.3031046396994403, 0.2221865857016709, -0.287210939066043]"
329,2019-01-29,emilyyrose disney worlds florida resort,227.0,"[0.3031046396994403, 0.2221865857016709, -0.287210939066043]"
330,2019-01-30,marc ohara seanmcdonald andypingu gillybrigade then packed off a plane his paedo disney land,238.0,"[0.7599441916270162, 0.6627483904860644, -0.2757047257474529]"
331,2019-01-30,"we t stayed art animation a obviously, judging the preschoolers the photo , the larger life icons the disney value resorts so much fun i think ll need get back soon, only some great photos resorts disneyworld …",238.0,"[0.7599441916270162, 0.6627483904860644, -0.2757047257474529]"
332,2019-01-30,i know im day late kingdomhearts back lets talk disney movies beerteam theplayground,238.0,"[0.7599441916270162, 0.6627483904860644, -0.2757047257474529]"
333,2019-01-30,i liked youtube video abandoned disney haunted mansion look alike chateau lumiere,238.0,"[0.7599441916270162, 0.6627483904860644, -0.2757047257474529]"
334,2019-01-30,"stitchsnake kejovanirl disney characters playing smash, thats fish, connor isnt real",238.0,"[0.7599441916270162, 0.6627483904860644, -0.2757047257474529]"
335,2019-01-30,you know andrew adamson directed first three shrek movies also directed two disney narnia movies? you know,238.0,"[0.7599441916270162, 0.6627483904860644, -0.2757047257474529]"
336,2019-01-30,"swanyplaysgames in opinion, would make perfect battlefront game? game modes, heroes, legends material possibly added? seeing they included mobile games . go out pretend are limits set disney the license in better hands.",238.0,"[0.7599441916270162, 0.6627483904860644, -0.2757047257474529]"
337,2019-01-30,disney he’s wit,238.0,"[0.7599441916270162, 0.6627483904860644, -0.2757047257474529]"
338,2019-01-30,"steve some people think, it’s disney it’s amazing ‍️ it’s awful they need do major revamp it.",238.0,"[0.7599441916270162, 0.6627483904860644, -0.2757047257474529]"
339,2019-01-30,"this cold weather, i tell you, it’s bit like movie disney’s frozen.",238.0,"[0.7599441916270162, 0.6627483904860644, -0.2757047257474529]"
340,2019-01-30,cyaniablu i honestly think the disney world portions written better they been previous games tho,238.0,"[0.7599441916270162, 0.6627483904860644, -0.2757047257474529]"
341,2019-01-31,i love disney movies much️,250.0,"[0.032579855723369744, 0.03729143375481612, -0.03561554958959887]"
342,2019-01-31,who doesn’t love disney vacation?,239.0,"[0.6302662989716917, 0.5826728235745192, -0.2948653217178898]"
343,2019-01-31,anybody wanna come disney w today?,239.0,"[0.6302662989716917, 0.5826728235745192, -0.2948653217178898]"
344,2019-01-31,"thekatiewilson disney coming strong an impressive lineup my top avengers endgame, star wars ep. , captain marvel the lion king my time favorite animated movie i really excited the cgi version",239.0,"[0.6302662989716917, 0.5826728235745192, -0.2948653217178898]"
345,2019-01-31,not every disney film makes good video game level. i pulled some rough amongst diamonds,239.0,"[0.6302662989716917, 0.5826728235745192, -0.2948653217178898]"
346,2019-01-31,"live didn win super bowl, i still goin disney kingdomhearts ps",239.0,"[0.6302662989716917, 0.5826728235745192, -0.2948653217178898]"
347,2019-01-31,why emperor’s new groove the funniest disney movie,250.0,"[0.032579855723369744, 0.03729143375481612, -0.03561554958959887]"
348,2019-01-31,happy wonderland wednesday ️ don’t get caught painting roses red . . . . . . . . nicolerosecrafts mickeyears disneybound etsy supporthandmade disney disneyland disneyside…,239.0,"[0.6302662989716917, 0.5826728235745192, -0.2948653217178898]"
349,2019-01-31,disney really revoked pass bc according them i “sell merchandise a higher price” lmao,239.0,"[0.6302662989716917, 0.5826728235745192, -0.2948653217178898]"
350,2019-01-31,"this kingdomhearts another level. i remember playing original years ago ps now i watching son play on ps amazing detail, maybe many cut scenes...but disney fan me enjoying &amp; i dig utadahikaru &amp; skrillex song facemyfears kh",239.0,"[0.6302662989716917, 0.5826728235745192, -0.2948653217178898]"
351,2019-01-31,this man said fucking is like going disney world the first time,239.0,"[0.6302662989716917, 0.5826728235745192, -0.2948653217178898]"
