,date,tweet,topic,sentiment
136,2019-01-12,it’s circle life lionking disney animalkingdom cupcake delicious disney animal kingdom,93.0,"[0.8656920977717631, 0.705959948029745, -0.21787538347007473]"
137,2019-01-12,hopemy crumbleskookie bts twt love disney world,93.0,"[0.8656920977717631, 0.705959948029745, -0.21787538347007473]"
138,2019-01-12,sal hair to make disney no make kanan rebels cut hair sign petition via change roguewonjohnny made go’n it,93.0,"[0.8656920977717631, 0.705959948029745, -0.21787538347007473]"
139,2019-01-12,currently watching frozen enjoying kindergartener still asks elsa send snow way. thought i share a throwback time i spotted idinamenzel the red carpet hollywood. so happy that frozen come this year disney entertainment,93.0,"[0.8656920977717631, 0.705959948029745, -0.21787538347007473]"
140,2019-01-12,theocdfight ocds stopped being able listen music properly due triggers etc i listen disney my favourite band other that,93.0,"[0.8656920977717631, 0.705959948029745, -0.21787538347007473]"
141,2019-01-12,early donald duck walt disney production animation litho model sheet,93.0,"[0.8656920977717631, 0.705959948029745, -0.21787538347007473]"
142,2019-01-12,"ermac javlaviking qiaminer redherringdraws inflamedwood ermac dude, you’re level disconnect logic amazing you the one defending emperor kathleen kennedy the disney new order you claim are the dark side?",93.0,"[0.8656920977717631, 0.705959948029745, -0.21787538347007473]"
143,2019-01-13,imhighkeyjames i love the disney movies fav ones incredibles wreck it ralph &amp;,95.0,"[0.4064765213665335, 0.49682064905878076, -0.29549910484205505]"
144,2019-01-13,andrew joked me pregnant next year tori jenny like nooooo we need to go to disney world and drink in epcot next year i think taught a lot priorities,95.0,"[0.4064765213665335, 0.49682064905878076, -0.29549910484205505]"
145,2019-01-13,my boy and i might be going to disney next week and im so fucking pumpeddddd,95.0,"[0.4064765213665335, 0.49682064905878076, -0.29549910484205505]"
146,2019-01-13,disney bro i feel poverty i lost shit,95.0,"[0.4064765213665335, 0.49682064905878076, -0.29549910484205505]"
147,2019-01-13,im sick y’all flexing me your disney passes ig.,95.0,"[0.4064765213665335, 0.49682064905878076, -0.29549910484205505]"
148,2019-01-13,check walt disney theme park exclusive monorail play set red stripe nib ebay,95.0,"[0.4064765213665335, 0.49682064905878076, -0.29549910484205505]"
149,2019-01-13,writingcommmunity did ever a collection disney wonderful books reading i and guess s started love books,95.0,"[0.4064765213665335, 0.49682064905878076, -0.29549910484205505]"
150,2019-01-13,check funko pop disney golden age pocahontas disney store exclusive ebay funko funkopop funkofunkast funkowomenofpower disney disneyworld disneyland disneyparks disneycruise disneyparkslive disneymarathon mickey,95.0,"[0.4064765213665335, 0.49682064905878076, -0.29549910484205505]"
151,2019-01-13,"which why can’t cancelled forever please disney, bring back disney . surely it’s no brainier?",95.0,"[0.4064765213665335, 0.49682064905878076, -0.29549910484205505]"
152,2019-01-13,i’m itching race after seeing everyone the disney half full marathon weekend. congrats guys i hope was awesome finish.,95.0,"[0.4064765213665335, 0.49682064905878076, -0.29549910484205505]"
153,2019-01-13,"i liked youtube video ""meet the marvel masters"" stan lee tribute disney magic marvel day sea",95.0,"[0.4064765213665335, 0.49682064905878076, -0.29549910484205505]"
154,2019-01-14,i need channel tv plays disney originals day long,109.0,"[0.9613339828741023, 1.0113899168706482, -0.10177361466885747]"
155,2019-01-14,disney gone far time we need epix boycott image/ident/banner rally behind. something attach all disney posts&amp;videos now til dec &amp;beyond. something defines resistance &amp;anger common fan can used influence the public apathy,109.0,"[0.9613339828741023, 1.0113899168706482, -0.10177361466885747]"
156,2019-01-14,disney just launched a beauty &amp; the beast dishware line &amp; you want every piece,109.0,"[0.9613339828741023, 1.0113899168706482, -0.10177361466885747]"
157,2019-01-14,designationsix petsmart chewy allstate esurance ford lincolnmotorco disney nestle rubytuesday mcdonalds longjohnslvrs applebees starbucks duluthtradingco walmart cabelas somebody help understand the hell starbucks on here? hasn’t foxnews endorsed boycott them multiple times?,109.0,"[0.9613339828741023, 1.0113899168706482, -0.10177361466885747]"
158,2019-01-14,paramvir thandi sriver prequelmemesbot how i suppose know? i dunno much planets star wars. i still trying figure out myself. but disney making the canons now. i could wrong the legends i think i heard something like that. but whatever.,109.0,"[0.9613339828741023, 1.0113899168706482, -0.10177361466885747]"
159,2019-01-14,what bunch crap swtheory sorry happened. keep keepin brother maytheforcebewithyou starwars shameonyoudisney disneystudios disney,109.0,"[0.9613339828741023, 1.0113899168706482, -0.10177361466885747]"
160,2019-01-14,kristianharloff check star wars theory video explaining disney taken fan film monetized by ads. it feels like kick the nuts a fan is helping promote the brand of his own pocket almost nefarious the manner did,109.0,"[0.9613339828741023, 1.0113899168706482, -0.10177361466885747]"
161,2019-01-14,"disneytva i think make zootopia tv series called ""tailor fox &amp; angry rabbit cop"" disney channel disney streaming service for year ……..",109.0,"[0.9613339828741023, 1.0113899168706482, -0.10177361466885747]"
162,2019-01-14,i be done february without doubt . . music dan bressler . . thedisneylandproject sleepingbeautyscastle disneycastle castle disney disneyland etchasketch…,109.0,"[0.9613339828741023, 1.0113899168706482, -0.10177361466885747]"
163,2019-01-14,disney giving shows million dollar budgets ? streaming service gone cost much cable,109.0,"[0.9613339828741023, 1.0113899168706482, -0.10177361466885747]"
164,2019-01-14,cvpayne disney,109.0,"[0.9613339828741023, 1.0113899168706482, -0.10177361466885747]"
165,2019-01-15,". my favourite disney movie i younger cinderella, now the emperor s new groove. but comes the disney movie my favourite songs, it s the hunchback notre dame.",116.0,"[0.05731243017928383, 0.06039036647584442, -0.034358576814577456]"
166,2019-01-15,rosaisela rwishingiwas blurryvogue the thing cringe dog filter austin&amp;ally is one the best disney channel shows idc anyone says,125.0,"[0.20894814259376576, 0.16944265281873802, -0.09218460685967339]"
167,2019-01-15,something popped my tl i lost tweet it’s so valid hasnt chris voiced disney/pixar character yet????,125.0,"[0.20894814259376576, 0.16944265281873802, -0.09218460685967339]"
168,2019-01-15,whoever said “disney the happiest place earth” never to cracker barrel.,126.0,"[0.4568331386539335, 0.3940775496241004, -0.029029240621122734]"
169,2019-01-15,how today technology compare disney smart house s?,126.0,"[0.4568331386539335, 0.3940775496241004, -0.029029240621122734]"
170,2019-01-15,"if disney decided sell unauthorized clearly marked bootleg steven universe mercy? i would be okay that. i realize law power agnostic, i don’t think morality",126.0,"[0.4568331386539335, 0.3940775496241004, -0.029029240621122734]"
171,2019-01-15,"sailorsoapbox after disney rush doing direct tape sequels all franchise, i ignored sequels the classics. good hear this, though",126.0,"[0.4568331386539335, 0.3940775496241004, -0.029029240621122734]"
172,2019-01-15,i liked youtube video disney steals star wars fan film vader &amp; monetizes it,126.0,"[0.4568331386539335, 0.3940775496241004, -0.029029240621122734]"
173,2019-01-15,disney avengersendgame april t come soon enough,125.0,"[0.20894814259376576, 0.16944265281873802, -0.09218460685967339]"
174,2019-01-15,"i enjoy toybox line, i wish still infinity another project crossover relation disney games. kh iii coming though",122.0,"[0.9920696954132132, 0.876156817589079, -0.3224956251799714]"
175,2019-01-15,no disney this household.,125.0,"[0.20894814259376576, 0.16944265281873802, -0.09218460685967339]"
176,2019-01-16,jarlbystrom that prevent disney.,122.0,"[0.9920696954132132, 0.876156817589079, -0.3224956251799714]"
177,2019-01-16,hate disney taking away maya hart us im so annoying yr old maya would powerful happy birthday maya love adore miss,122.0,"[0.9920696954132132, 0.876156817589079, -0.3224956251799714]"
178,2019-01-16,butwhythopc kingdomhearts la ney sha it the first game sister ever interested playing me it disney characters it really helped us become close we today,122.0,"[0.9920696954132132, 0.876156817589079, -0.3224956251799714]"
179,2019-01-16,"lathel nope, i know boi, nightmare suicide mouse he from five nights at treasure island nightmare before disney end disney v",122.0,"[0.9920696954132132, 0.876156817589079, -0.3224956251799714]"
180,2019-01-16,pcgamer oh yeah let have little talk a guy called disney. your boss.,122.0,"[0.9920696954132132, 0.876156817589079, -0.3224956251799714]"
181,2019-01-16,check disney parks contemporary resort gingerbread wreath sven olaf lr pin ebay disney disneyworld⁠ ⁠ disneycruise⁠ ⁠ disneyland⁠ ⁠ disneyparkslive disneyparks⁠ ⁠ disneywonder mickey⁠ ⁠ mickeymouse⁠ ⁠,122.0,"[0.9920696954132132, 0.876156817589079, -0.3224956251799714]"
182,2019-01-16,ashparso aaron all meals picked before go disney world.,122.0,"[0.9920696954132132, 0.876156817589079, -0.3224956251799714]"
183,2019-01-16,now open ballast point brewing company the downtown disney district the disneyland resort,122.0,"[0.9920696954132132, 0.876156817589079, -0.3224956251799714]"
184,2019-01-16,i liked youtube video we won disney bends the knee &amp; releases claim on fan film vader,122.0,"[0.9920696954132132, 0.876156817589079, -0.3224956251799714]"
185,2019-01-16,check disney parks grand floridian resort gingerbread wreath mickey minnie lr pin ebay disney disneyworld⁠ ⁠ disneycruise⁠ ⁠ disneyland⁠ ⁠ disneyparkslive disneyparks⁠ ⁠ disneywonder mickey⁠ ⁠ mickeymouse⁠ ⁠,122.0,"[0.9920696954132132, 0.876156817589079, -0.3224956251799714]"
186,2019-01-16,omgitsalia claresiobhan kingdomhearts clare i would love see and ali i going alligator land right but i be disney world tomorrow i a huge fan ily,122.0,"[0.9920696954132132, 0.876156817589079, -0.3224956251799714]"
187,2019-01-17,rt thedis disney cruise line signs new agreement the port galveston,130.0,"[0.8251005998075936, 0.6025176141903329, -0.17889346611723592]"
188,2019-01-17,disney is gonna remake the movie ”the hunchback notre dame” and i’m so happy omg,130.0,"[0.8251005998075936, 0.6025176141903329, -0.17889346611723592]"
189,2019-01-17,club d seems little risque disney...,130.0,"[0.8251005998075936, 0.6025176141903329, -0.17889346611723592]"
190,2019-01-17,"graemerodgers captainaaron ctvottawa really. disney video. moving on. trudeau fed gov’t tried increase tax top . trudeau failed. fed gov’t collected billion less taxes. again specifically do propose get , of top , earners ont",130.0,"[0.8251005998075936, 0.6025176141903329, -0.17889346611723592]"
191,2019-01-17,and alexandria shipp really thinks disney t hand of their termination papers.....,130.0,"[0.8251005998075936, 0.6025176141903329, -0.17889346611723592]"
192,2019-01-17,disney now selling boozy push pops contain alcohol a glass wine,130.0,"[0.8251005998075936, 0.6025176141903329, -0.17889346611723592]"
193,2019-01-17,epstandleague leahremini mikerinder aenetworks disney you nothing a clown show. wheresshelly,130.0,"[0.8251005998075936, 0.6025176141903329, -0.17889346611723592]"
194,2019-01-17,"disney music night, speaker turned high whole family dancing guessing disney songs",130.0,"[0.8251005998075936, 0.6025176141903329, -0.17889346611723592]"
195,2019-01-17,ermac col mothertruckerg ct dragonageftw nbreckedit steven zawicki colmack ennieardi ethanvansciver ivanfilmfix lastjediawful thatstarwarsgrl archertyrell rianjohnson admirableandrea hellogreedo scoutthetrooper that not we talking were saying made movie the fans. why t disney,130.0,"[0.8251005998075936, 0.6025176141903329, -0.17889346611723592]"
196,2019-01-17,wdwnt you ever seen in disney world?,130.0,"[0.8251005998075936, 0.6025176141903329, -0.17889346611723592]"
197,2019-01-17,laughter timeless. imagination no age. and dreams forever. ― walt disney company quote,130.0,"[0.8251005998075936, 0.6025176141903329, -0.17889346611723592]"
198,2019-01-18,check tigger soft toy plush christopher robin movie disney store bnwt winnie pooh ebay,138.0,"[0.6633991299466203, 0.6820710920420953, -0.28837490657404047]"
199,2019-01-18,thehunchbackofnotredame gets disney live action treatment,138.0,"[0.6633991299466203, 0.6820710920420953, -0.28837490657404047]"
200,2019-01-18,deadass sounds like song sung a disney villain,138.0,"[0.6633991299466203, 0.6820710920420953, -0.28837490657404047]"
201,2019-01-18,really want get disney try many different food offerings possible... go every cart location try stuff,138.0,"[0.6633991299466203, 0.6820710920420953, -0.28837490657404047]"
202,2019-01-18,can donate help?? what are for people my hometown amazing i promise support when disney springs location opens. god bless you.,138.0,"[0.6633991299466203, 0.6820710920420953, -0.28837490657404047]"
203,2019-01-18,pop disney mickey th anniversary figure madewithmichaels via michaelsstores,138.0,"[0.6633991299466203, 0.6820710920420953, -0.28837490657404047]"
204,2019-01-18,woohoo it national winnie pooh day he my time favorite disney character. what yours? winniethepoohday,138.0,"[0.6633991299466203, 0.6820710920420953, -0.28837490657404047]"
205,2019-01-18,check disney store mickey mouse memories november plush uk purchase new th birthday ebay,138.0,"[0.6633991299466203, 0.6820710920420953, -0.28837490657404047]"
206,2019-01-18,it so close the first many trips as i this year my annual pass waltdisneyworld disney disneyworld disneyworldpassholder…,138.0,"[0.6633991299466203, 0.6820710920420953, -0.28837490657404047]"
207,2019-01-18,starbucks stores walt disney world.,138.0,"[0.6633991299466203, 0.6820710920420953, -0.28837490657404047]"
208,2019-01-18,never a bad mood i’m disney,138.0,"[0.6633991299466203, 0.6820710920420953, -0.28837490657404047]"
209,2019-01-19,"bradmiska mzema from i gathered, movie ""too scary"" what disney want have their family friendly platform, whereas hulu going be they put older skewing content. plus, they make x men disney shows, new mutants there could create brand confusion.",144.0,"[0.7144650347034638, 0.6728955141264631, -0.054810452912835664]"
210,2019-01-19,disney tsumtsum the future. it the future.,144.0,"[0.7144650347034638, 0.6728955141264631, -0.054810452912835664]"
211,2019-01-19,jennalynnmeowri i embarrassed say i t know much the sailor scouts i saw bunch girls dressed like at disney world i thought were donald duck fans...,144.0,"[0.7144650347034638, 0.6728955141264631, -0.054810452912835664]"
212,2019-01-19,wait disney x fox merger already happened???,155.0,"[0.029923655086804248, 0.022201883278818578, -0.031217244827547865]"
213,2019-01-19,"virginholidays i’ve booked stay one your orlando villas, i’ve also booked disney tickets too. i told the time booking magic bands included the booking i’ve told a local disney forum this incorrect. please you clarify?",144.0,"[0.7144650347034638, 0.6728955141264631, -0.054810452912835664]"
214,2019-01-19,funko pop disney toothless ” pop target exclusive preorder . end date sunday feb pst buy it now only . buy it now | add watch list,144.0,"[0.7144650347034638, 0.6728955141264631, -0.054810452912835664]"
215,2019-01-19,"ik i sound like spoilt brat i really hope re holding on world , least disney ones release. i believe will more kh exclusives we seen least",144.0,"[0.7144650347034638, 0.6728955141264631, -0.054810452912835664]"
216,2019-01-19,"the place where lost things go , demonstrates me disney thriving cynical cash grabs days gone, that is potential the present disney. like christopher robin , going back mean expansion, not necessarily stagnation.",144.0,"[0.7144650347034638, 0.6728955141264631, -0.054810452912835664]"
217,2019-01-19,edhottv i love watching tangled my daughters’. see light my favourite disney song ever,156.0,"[0.0932347337170651, 0.07318707172905896, -0.1099314470144057]"
218,2019-01-19,comicbookrumors nerdsncoolkidz thank god disney got reigns this fox put one good xmen movie that first class,156.0,"[0.0932347337170651, 0.07318707172905896, -0.1099314470144057]"
219,2019-01-19,disney’s doin good,156.0,"[0.0932347337170651, 0.07318707172905896, -0.1099314470144057]"
220,2019-01-20,had much fun slinky dog dash our disney vacation. we the early morning magic new year eve were able ride slinky dog times the park opened. it an awesome ride slinkydogdash wdw waltdisneyworld hollywoodstudio…,154.0,"[0.49854057640204913, 0.43484044075006145, -0.09042747223438972]"
221,2019-01-20,disney infinity . marvel super heroes starter pack new xbox one via ebay,163.0,"[0.40636820133698187, 0.4462965077056318, -0.07944476773194507]"
222,2019-01-20,where dreams come true disney disneyworld orlando florida usa statiuniti waltdisney waltdisneyworld parco parchiatema viaggio viaggiare divertimento,154.0,"[0.49854057640204913, 0.43484044075006145, -0.09042747223438972]"
223,2019-01-20,"i today years old i learned tron character’s name. shame upon and family, i’m a fake disney fan",162.0,"[0.14302468853368874, 0.12583897545996783, -0.001123172962338819]"
224,2019-01-20,karindailey a week ago i ran disney marathon. i’ll probably get steps tonight.,154.0,"[0.49854057640204913, 0.43484044075006145, -0.09042747223438972]"
225,2019-01-20,paveldarkovic hrtablaze disney the eternal paddy strikes again... iq irishquestion,154.0,"[0.49854057640204913, 0.43484044075006145, -0.09042747223438972]"
226,2019-01-20,check vintage disney mickey mouse wind see through walker gabriel–works great via ebay,154.0,"[0.49854057640204913, 0.43484044075006145, -0.09042747223438972]"
227,2019-01-20,tweetbrettmac disney omg why? disney used favorite. why everything to be ruined?,154.0,"[0.49854057640204913, 0.43484044075006145, -0.09042747223438972]"
228,2019-01-20,.a freshly scrubbed kitchen. .getting nap before am. .a mr price haul. .random girls have conversation you not she getting paid to. .looking at disney statues h.samuels window.,163.0,"[0.40636820133698187, 0.4462965077056318, -0.07944476773194507]"
229,2019-01-20,"it’s on, it’s on, it’s kate rockwell star upcoming adaption a disney original movie titled ‘camp rockwell’. the ‘mean girls’ star play mitchie originally played ddlovato all the jonas brothers.",163.0,"[0.40636820133698187, 0.4462965077056318, -0.07944476773194507]"
230,2019-01-20,i’m crying listening old disney channel theme songs old disney the shit guy,163.0,"[0.40636820133698187, 0.4462965077056318, -0.07944476773194507]"
231,2019-01-21,every centerpiece this wedding was inspired a different disney movie,161.0,"[1.0309360617405645, 0.8248114506980854, -0.18709442169900778]"
232,2019-01-21,there’s handful companies are excellent what do modern world could collapse without them... google apple coca cola disney tesla paving the path a future electric transportation .,161.0,"[1.0309360617405645, 0.8248114506980854, -0.18709442169900778]"
233,2019-01-21,superior disney disney/pixar movies moana the lion king brother bear lilo &amp; stitch atlantis up inside out not debatable,161.0,"[1.0309360617405645, 0.8248114506980854, -0.18709442169900778]"
234,2019-01-21,that your next disney movie right there. disgusting,161.0,"[1.0309360617405645, 0.8248114506980854, -0.18709442169900778]"
235,2019-01-21,vikkikitty backwards god you t never to karaoke me or a car blasting disney songs,161.0,"[1.0309360617405645, 0.8248114506980854, -0.18709442169900778]"
236,2019-01-21,"panicking rn thinking money. sincerely thinking selling disney dvds, kat tun jin stuff i regret abflsjfmsnsls",161.0,"[1.0309360617405645, 0.8248114506980854, -0.18709442169900778]"
237,2019-01-21,disney,161.0,"[1.0309360617405645, 0.8248114506980854, -0.18709442169900778]"
238,2019-01-21,and isn the first time disney movie airs cartoonnetwork the muppets &amp; muppets most wanted aired few times,161.0,"[1.0309360617405645, 0.8248114506980854, -0.18709442169900778]"
239,2019-01-21,check disney pixar finding dory lip smackers lot tube set / flavors sealed disney via ebay,161.0,"[1.0309360617405645, 0.8248114506980854, -0.18709442169900778]"
240,2019-01-21,excellent meal disney springs,161.0,"[1.0309360617405645, 0.8248114506980854, -0.18709442169900778]"
241,2019-01-21,"new characters star wars. we all this. it also brings mine recent run marvel comics disney kingdoms tied disney parks attractions as the haunted mansion, enchanted tiki room, seekers the weird, figment big thunder mountain railroad.",161.0,"[1.0309360617405645, 0.8248114506980854, -0.18709442169900778]"
242,2019-01-22,kenolabar anarchangel disney disneyparks nope. now it’s protected,169.0,"[0.7287048682291801, 0.6483135921777603, -0.20002755885464502]"
243,2019-01-22,get uber orlando the driver playing rap / disney mashups. precisely my taste music,169.0,"[0.7287048682291801, 0.6483135921777603, -0.20002755885464502]"
244,2019-01-22,rauschalvaro disney,169.0,"[0.7287048682291801, 0.6483135921777603, -0.20002755885464502]"
245,2019-01-22,offcltst fuckebdnsj friend going disney music i heard riff and lost my mind,169.0,"[0.7287048682291801, 0.6483135921777603, -0.20002755885464502]"
246,2019-01-22,ro ofdier disney the best anime,169.0,"[0.7287048682291801, 0.6483135921777603, -0.20002755885464502]"
247,2019-01-22,"""i dont remember pooping this?"" treasure planet november , disney treasureplanet treasureisland martinshort bengunn toys toyphotos toyphotography toycommunity…",169.0,"[0.7287048682291801, 0.6483135921777603, -0.20002755885464502]"
248,2019-01-22,disney you need fire jack morrissey his tweet the magk made post without thinking t hypocrites plz,169.0,"[0.7287048682291801, 0.6483135921777603, -0.20002755885464502]"
249,2019-01-22,pagesix elana avalor disney first latina princess. she been around a years.,169.0,"[0.7287048682291801, 0.6483135921777603, -0.20002755885464502]"
250,2019-01-22,rare version fisher price disney donald duck cart pull toy pull string,169.0,"[0.7287048682291801, 0.6483135921777603, -0.20002755885464502]"
251,2019-01-22,charliekirk rocketsales cnn bakari sellers sorry the corp like cnn disney gillette been silent regards disgusting completely unacceptable behavior their employees.,169.0,"[0.7287048682291801, 0.6483135921777603, -0.20002755885464502]"
252,2019-01-22,disney institute brandvoice leadership preparing leaders tomorrow starts today leadership management,169.0,"[0.7287048682291801, 0.6483135921777603, -0.20002755885464502]"
253,2019-01-23,know makes good combination? disney vtechtoys i hope win go go smart wheels mickey magical wonderland toy. interested? read details the giveaway giftideas giftcards shopping toys,175.0,"[0.5464276284910494, 0.6727311764723495, -0.22689624768313407]"
254,2019-01-23,disney i hope boycott disney they fire producer his tweet...this someone promotes disney beliefs ? he posted put kids a woodchipper ...i spent alot disney every year. . year alone not anymore. i notify dod it,175.0,"[0.5464276284910494, 0.6727311764723495, -0.22689624768313407]"
255,2019-01-23,wow hard believe it’s almost february now. there’s still lot i share disney’s marathon weekend. it’s always blast i can’t wait to start training…,175.0,"[0.5464276284910494, 0.6727311764723495, -0.22689624768313407]"
256,2019-01-23,slinky dog dash . . . . waltdisneyworld wdw disneyshollywoodstudis toystoryland disney themeparks florida nikon mykissimmee igers wdw igers orlando fdlook wdwtoday waltdisneyworld wdwbestdayever disneyphotographyinstitute idpmember,175.0,"[0.5464276284910494, 0.6727311764723495, -0.22689624768313407]"
257,2019-01-23,family k steam night disney elementary jan. you won’t want miss event the year teamdisneypod spslearning bellamaestra fogledisney s crumpylou misspohle,175.0,"[0.5464276284910494, 0.6727311764723495, -0.22689624768313407]"
258,2019-01-23,"worldstar that’s raven ,shake up, the old disney movies somerthing ‍️",175.0,"[0.5464276284910494, 0.6727311764723495, -0.22689624768313407]"
259,2019-01-23,jjohnsonlaw disney might able book him.,175.0,"[0.5464276284910494, 0.6727311764723495, -0.22689624768313407]"
260,2019-01-23,"stonekettle aoc supreme ruler earth she’ll end billionaires, make vaccines safe, redistribute the wealth, make disney parks free everyone amen.",175.0,"[0.5464276284910494, 0.6727311764723495, -0.22689624768313407]"
261,2019-01-23,"j.j. abrams disney, universal, apple, netflix bidding him quartz",175.0,"[0.5464276284910494, 0.6727311764723495, -0.22689624768313407]"
262,2019-01-23,too bad i don’t know save cause i’d really love go to disney my th,175.0,"[0.5464276284910494, 0.6727311764723495, -0.22689624768313407]"
263,2019-01-23,"buddycraftedcp awesome only thing im looking is five nights freddys, pokemon, minecraft, roblox disney",175.0,"[0.5464276284910494, 0.6727311764723495, -0.22689624768313407]"
264,2019-01-24,kwizten i as well. i dropped maker the disney buyout never joined another haha,187.0,"[0.5158962506062257, 0.5437936863177909, -0.17465220568001963]"
265,2019-01-24,more excited lego movie anything disney gonna release year,198.0,"[0.05453191105932556, 0.05039102955842665, -0.06955199801335114]"
266,2019-01-24,house party raw unedited footage disney college program via youtube,187.0,"[0.5158962506062257, 0.5437936863177909, -0.17465220568001963]"
267,2019-01-24,when anime gets disney’s hands,187.0,"[0.5158962506062257, 0.5437936863177909, -0.17465220568001963]"
