,date,tweet,topic,sentiment
129,2019-01-12,andrewatter leaveeuofficial labourleave paulembery a facile statement ... i voted dennis skinner . you voted david cameron &amp; george osborne were bankrolled us investment banks like goldman sachs ... whose socialist ?,91.0,"[1.1204582664240539, 1.2177451206542163, -0.2959052264501318]"
130,2019-01-13,funder here a mitch mcconnell biggest donors. what kind of ballot measures we introduce make corporate lives hellish? blackstone altrianews goldmansachs davitahlthsolns metlife comcast mitchshutdown,96.0,"[0.693982058316936, 0.7295344863478964, -0.27724194407228986]"
131,2019-01-13,bunceebryan buncee hlundqvistfdn goldmansachs such honor witness important work hlundqvistfdn doing inspirational youngambassadors,96.0,"[0.693982058316936, 0.7295344863478964, -0.27724194407228986]"
132,2019-01-13,winkinj and did former goldman sachs ceo jon corzine u.s. senate &amp; for governor. then lost to chris christie. running nationwide obviously much difficult undertaking running statewide nj.,96.0,"[0.693982058316936, 0.7295344863478964, -0.27724194407228986]"
133,2019-01-13,"ing drops to the top tax dodgers chart bigger, not bad goldman sachs &amp; jp morgan pay zilch",96.0,"[0.693982058316936, 0.7295344863478964, -0.27724194407228986]"
134,2019-01-13,"goldman sachs its dog whistle perspectives, his own.",96.0,"[0.693982058316936, 0.7295344863478964, -0.27724194407228986]"
135,2019-01-13,"for two decades, greg palm waged one battle another goldman sachs group inc. he to step aside its top lawyer. mdb lestweforget",96.0,"[0.693982058316936, 0.7295344863478964, -0.27724194407228986]"
136,2019-01-13,everything need know keep knowing goldman sachs,96.0,"[0.693982058316936, 0.7295344863478964, -0.27724194407228986]"
137,2019-01-13,"kyler murray negotiating a position power. nobody would question leverage attempt, mlb &amp; nfl replaced goldman sachs &amp; mckinsey. please stop giving business decisions sports different morality standards those decisions other industries",96.0,"[0.693982058316936, 0.7295344863478964, -0.27724194407228986]"
138,2019-01-13,"in asia now starbucks be next us brand warn china trouble apple, goldman sachs says",96.0,"[0.693982058316936, 0.7295344863478964, -0.27724194407228986]"
139,2019-01-13,goldman sachs ceo david solomon shares number one piece advice millennials want get ahead in...,96.0,"[0.693982058316936, 0.7295344863478964, -0.27724194407228986]"
140,2019-01-14,goldman sachs leads immersive labs cyber security investment business mattersbusiness matters,110.0,"[0.8067581346733835, 0.7063491241846295, -0.15663297926441752]"
141,2019-01-14,goldman sachs leads immersive labs cyber security investment business mattersbusiness matters securityguard,110.0,"[0.8067581346733835, 0.7063491241846295, -0.15663297926441752]"
142,2019-01-14,goldman sachs leads funding gchq veteran’s cybersecurity startup cybersecurity dataprivacy ransomwareprotection hacker ransomware malware phishing tech,110.0,"[0.8067581346733835, 0.7063491241846295, -0.15663297926441752]"
143,2019-01-14,goldman outlines ‘where invest now’ u.s. equities markets investments investing stocks goldmansachs,110.0,"[0.8067581346733835, 0.7063491241846295, -0.15663297926441752]"
144,2019-01-14,goldman sachs downgrade hits shares schnitzer steel indus nasdaq schn,110.0,"[0.8067581346733835, 0.7063491241846295, -0.15663297926441752]"
145,2019-01-14,shares schnitzer steel indus nasdaq schn struck with downgrade from goldman sachs. should investors concerned?,110.0,"[0.8067581346733835, 0.7063491241846295, -0.15663297926441752]"
146,2019-01-14,"jpetkfull sarafischer adlandia goldmansachs axios on it, thank",110.0,"[0.8067581346733835, 0.7063491241846295, -0.15663297926441752]"
147,2019-01-14,goldmansachs away zymergen tailopez this still poignant.,110.0,"[0.8067581346733835, 0.7063491241846295, -0.15663297926441752]"
148,2019-01-14,hillaryclinton says you. puppet wall street goldman sachs,110.0,"[0.8067581346733835, 0.7063491241846295, -0.15663297926441752]"
149,2019-01-14,goldman sachs investors should get defensive market realist,110.0,"[0.8067581346733835, 0.7063491241846295, -0.15663297926441752]"
150,2019-01-15,"after leaving cia graduating the wharton school the university pennsylvania ,[] mcmullin began working the investment banking division goldman sachs",117.0,"[1.0669275750178646, 1.0088799849001069, -0.17485057314464605]"
151,2019-01-15,goldmansachs split culturally speaking. one the fortune public company/ global empire the is systemic &amp; incestuous betrayal/ ripping of clients greed sake.,117.0,"[1.0669275750178646, 1.0088799849001069, -0.17485057314464605]"
152,2019-01-15,never thought i’d see stopbigmoney goldman sachs nancy pelosi’s payroll. i just curious i some looking around. wtf democrats,117.0,"[1.0669275750178646, 1.0088799849001069, -0.17485057314464605]"
153,2019-01-15,"when i’m looking guidance my life i always turn a dow company,” comments wsjournal reader robert middleton. “p&amp;g gillette my relationship women. goldman sachs child rearing. chevron a mid life crisis. walgreen’s spiritual insights,” adds.",117.0,"[1.0669275750178646, 1.0088799849001069, -0.17485057314464605]"
154,2019-01-15,ninaandtito goldman sachs set aside b future defense costs of mdb. may be enough.,117.0,"[1.0669275750178646, 1.0088799849001069, -0.17485057314464605]"
155,2019-01-15,"michell jaredbeck but he t pick cabinet remember podestaemails &amp; dncleaks goldman sachs picked hillary cabinet? they all pre selected, like trump &amp; hillary pre selected.",117.0,"[1.0669275750178646, 1.0088799849001069, -0.17485057314464605]"
156,2019-01-15,wilde goldman sachs puppet?,123.0,"[-0.0006642752862417896, -0.0010339399531980379, -0.03675495483565879]"
157,2019-01-15,goldman sachs major volatility ahead big stocks as earnings season kicks off cryptocurrency bitcoin eth btc ico news,117.0,"[1.0669275750178646, 1.0088799849001069, -0.17485057314464605]"
158,2019-01-15,"chrislacoursier kaseycundy wsj cnbc finra sec enforcement weylandtechinc tzeroblockchain damsconsulting jonnajarian elonmusk overstockceo secretservice potus mcuban realdonaldtrump goldmansachs morganstanley fidelity are on naked shorting. technology exists eliminate it. quit destroying lives, ruining companies running rigged game. revolutionize wall street allow retail/ mom &amp; pops to invest fairly again",117.0,"[1.0669275750178646, 1.0088799849001069, -0.17485057314464605]"
159,2019-01-15,"bank america, goldman sachs report what know markets wednesday heidi chung",117.0,"[1.0669275750178646, 1.0088799849001069, -0.17485057314464605]"
160,2019-01-16,a ho hum day stocks. dow leads most gain thanks goldman sachs,122.0,"[0.9512597786272314, 0.930949207135772, -0.278525419475595]"
161,2019-01-16,a ho hum day stocks. dow leads most gain thanks goldman sachs,122.0,"[0.9512597786272314, 0.930949207135772, -0.278525419475595]"
162,2019-01-16,goldman sachs ceo david solomon shares number one piece advice millennials want get ahead their careers,122.0,"[0.9512597786272314, 0.930949207135772, -0.278525419475595]"
163,2019-01-16,cernovich jcharles she thinks can take powerful wallstreet rothschild globalist bankers? remember obama promises? he immediately brought timothy geithner goldman sachs gang run the show. i knew right who really charge. pass the,122.0,"[0.9512597786272314, 0.930949207135772, -0.278525419475595]"
164,2019-01-16,oddstats goldmansachs you some amazing stats... very interesting,122.0,"[0.9512597786272314, 0.930949207135772, -0.278525419475595]"
165,2019-01-16,goldman sachs chief apologises malaysians mdb scandal via ft,122.0,"[0.9512597786272314, 0.930949207135772, -0.278525419475595]"
166,2019-01-16,goldman sachs shakes thematics five new funds etf,122.0,"[0.9512597786272314, 0.930949207135772, -0.278525419475595]"
167,2019-01-16,goldman sachs apologises ex banker’s role mdb scandal – business news – the star online – goldman sachs,122.0,"[0.9512597786272314, 0.930949207135772, -0.278525419475595]"
168,2019-01-16,"reddogt gs goldman sachs . = . billion gain. gs made notable gains of last trading sessions, days consecutively jan . finance investment banking brokerage",122.0,"[0.9512597786272314, 0.930949207135772, -0.278525419475595]"
169,2019-01-16,"reddogt gs goldman sachs . = . billion gain. gs made notable gains of last trading sessions, days consecutively jan . finance investment banking brokerage",122.0,"[0.9512597786272314, 0.930949207135772, -0.278525419475595]"
170,2019-01-17,"steventdennis why pelosi need go afghanistan? osama bin laden killed second time obama . pelosi not kill for rd time. if donald stops the goldman sachs boys going davos, i starting gain faith him.",133.0,"[0.8146269606507135, 0.7195610944120261, -0.2610199824353231]"
171,2019-01-17,"thank you, gop for first time history, six biggest wall street banks — ️made billion profit a year jpmorgan chase bankofamerica wellsfargo citi goldmansachs repmaxinewaters fscdems via business",133.0,"[0.8146269606507135, 0.7195610944120261, -0.2610199824353231]"
172,2019-01-17,goldman sachs – attractively valued but be aware of the .b risk,133.0,"[0.8146269606507135, 0.7195610944120261, -0.2610199824353231]"
173,2019-01-17,goldman sachs | gs gs how fast it go up? long short goldman sachs wcx,133.0,"[0.8146269606507135, 0.7195610944120261, -0.2610199824353231]"
174,2019-01-17,"unico sells smith tower goldman sachs million, building deal",133.0,"[0.8146269606507135, 0.7195610944120261, -0.2610199824353231]"
175,2019-01-17,"unico sells smith tower goldman sachs million, building deal",133.0,"[0.8146269606507135, 0.7195610944120261, -0.2610199824353231]"
176,2019-01-17,"unico sells smith tower goldman sachs million, building deal",133.0,"[0.8146269606507135, 0.7195610944120261, -0.2610199824353231]"
177,2019-01-17,goldman sachs backed startup unveils cold storage cryptocurrency trading bitcoin bitcoinbusinesses bitcointechnology bitcointrading bitgo coldstorage goldmansachs,133.0,"[0.8146269606507135, 0.7195610944120261, -0.2610199824353231]"
178,2019-01-17,capify secures million goldman sachs sme loans,133.0,"[0.8146269606507135, 0.7195610944120261, -0.2610199824353231]"
179,2019-01-17,goldman sachs ceo apologises ex banker’s role mdb scandal nation | the star online,133.0,"[0.8146269606507135, 0.7195610944120261, -0.2610199824353231]"
180,2019-01-18,senecaindian goldmansachs away no don t. that the problem.,140.0,"[0.8679390940385255, 0.7455210808924666, -0.3078908820342722]"
181,2019-01-18,"episode goldman sachs the mdb corruption scandal corruption, crime &amp; compliance via mikevolkov",140.0,"[0.8679390940385255, 0.7455210808924666, -0.3078908820342722]"
182,2019-01-18,news us banks profited b in who these earners? at whose expense? is a mean acquire full market control power? plunder.. wrong headlines financial banks money bankofamerica jpmorgan wellsfargo citigroup goldmansachs morganstanley profit today,140.0,"[0.8679390940385255, 0.7455210808924666, -0.3078908820342722]"
183,2019-01-18,don bother goldmansachs,140.0,"[0.8679390940385255, 0.7455210808924666, -0.3078908820342722]"
184,2019-01-18,"sputnikint still waiting the day goldman sachs, jp morgan, federal reserve ceo s/presidents/staff shutdown permanently imprisoned life.",140.0,"[0.8679390940385255, 0.7455210808924666, -0.3078908820342722]"
185,2019-01-18,askslim market week goldman sachs gs cycle analysis via youtube,140.0,"[0.8679390940385255, 0.7455210808924666, -0.3078908820342722]"
186,2019-01-18,"goldman sachs, lies mdb the australian financial review",140.0,"[0.8679390940385255, 0.7455210808924666, -0.3078908820342722]"
187,2019-01-18,"miltime goldmansachs away wokest vampire squid the game, though",140.0,"[0.8679390940385255, 0.7455210808924666, -0.3078908820342722]"
188,2019-01-18,complex goldman sachs leads m round cyber security skills platform immersive labs end,140.0,"[0.8679390940385255, 0.7455210808924666, -0.3078908820342722]"
189,2019-01-18,rwpusa menuchen isn’t much better. goldmansachs yikes.,140.0,"[0.8679390940385255, 0.7455210808924666, -0.3078908820342722]"
190,2019-01-19,goldmansachs hahahahahaaaa revenue whom? the creators,151.0,"[0.8702598941673683, 0.8893464552602776, -0.17901175281900622]"
191,2019-01-19,"what goldman sachs was nothing less what peddlers the ""white powder"" cocaine and done. mdb lestweforget.",151.0,"[0.8702598941673683, 0.8893464552602776, -0.17901175281900622]"
192,2019-01-19,"davos list year includes bill gates, george soros, uber ceo dara khosrowshahi, new goldman sachs ceo david solomon bridgewater founder ray dalio. on public side, expect see german chancellor angela merkel, israeli prime minister benjamin…",151.0,"[0.8702598941673683, 0.8893464552602776, -0.17901175281900622]"
193,2019-01-19,goldman sachs middle market lending corp. statement changes beneficial ownership securities,151.0,"[0.8702598941673683, 0.8893464552602776, -0.17901175281900622]"
194,2019-01-19,"profplum paranoidbull stevephenni suvyboy realdonaldtrump goldmansachs if exec branch gains control fiscal, trump get weak dollar",151.0,"[0.8702598941673683, 0.8893464552602776, -0.17901175281900622]"
195,2019-01-19,kolumnisawani the black credit card goldman sachs malaysia awaninews,151.0,"[0.8702598941673683, 0.8893464552602776, -0.17901175281900622]"
196,2019-01-19,times tesla’s stock taken nosedive when goldman sachs talks… breaking news,151.0,"[0.8702598941673683, 0.8893464552602776, -0.17901175281900622]"
197,2019-01-19,goldman sachs ceo david solomon shares story how became dj,151.0,"[0.8702598941673683, 0.8893464552602776, -0.17901175281900622]"
198,2019-01-19,"null the black credit card goldman sachs malaysia in case mdb,",151.0,"[0.8702598941673683, 0.8893464552602776, -0.17901175281900622]"
199,2019-01-19,"goldman sachs slashes oil price forecast amid oversupply concerns january , energy",151.0,"[0.8702598941673683, 0.8893464552602776, -0.17901175281900622]"
200,2019-01-20,"goldman sachs invests million supportive housing new jersey aiming provide housing options the state “most vulnerable populations,” goldman sachs partnering new jersey community capital provide million be ...",152.0,"[0.7970591991240422, 0.7328653550114934, -0.26109242337379246]"
201,2019-01-20,ex goldman sachs trader tells truth trading part via youtube,152.0,"[0.7970591991240422, 0.7328653550114934, -0.26109242337379246]"
202,2019-01-20,would u if u found i lowkey quant consultant goldman sachs?,152.0,"[0.7970591991240422, 0.7328653550114934, -0.26109242337379246]"
203,2019-01-20,davidsirota that what happens goldman sachs picks cabinet.,152.0,"[0.7970591991240422, 0.7328653550114934, -0.26109242337379246]"
204,2019-01-20,goldmansachs away when ever are facts support opinion always say “subtle” is it’s done “unconsciously”,152.0,"[0.7970591991240422, 0.7328653550114934, -0.26109242337379246]"
205,2019-01-20,thesundaily goldman sachs ceo says sorry mdb scandal.,152.0,"[0.7970591991240422, 0.7328653550114934, -0.26109242337379246]"
206,2019-01-20,goldman sachs top percent own half stocks us,152.0,"[0.7970591991240422, 0.7328653550114934, -0.26109242337379246]"
207,2019-01-20,pinnacle west capital nyse pnw stock rating reaffirmed goldman sachs group investingnews,152.0,"[0.7970591991240422, 0.7328653550114934, -0.26109242337379246]"
208,2019-01-20,goldmansachs away interesting,152.0,"[0.7970591991240422, 0.7328653550114934, -0.26109242337379246]"
209,2019-01-20,"us goldman sachs jp morgan, according our contract, every year sum how much money have pay pay family members all jewish young generations my great contributions wall street investment banks permanent and strict contract,",152.0,"[0.7970591991240422, 0.7328653550114934, -0.26109242337379246]"
210,2019-01-21,banker deaths climb goldman sachs managing director found dead via fpptim,162.0,"[0.6442288210362388, 0.8074517110863931, -0.14615125622856143]"
211,2019-01-21,". jimcramer, please remind wall street america hurting had . presidentbush or. potus waited days / clean their mess they wldn exist . dowjones . nasdaq . goldmansachs must step lobby end trumpshutdown philanthropy where the",162.0,"[0.6442288210362388, 0.8074517110863931, -0.14615125622856143]"
212,2019-01-21,anncoulter she totally irrelevant zero chance trump bring on goldman sachs puppets,162.0,"[0.6442288210362388, 0.8074517110863931, -0.14615125622856143]"
213,2019-01-21,kangcotton bx realheine goldman sachs,162.0,"[0.6442288210362388, 0.8074517110863931, -0.14615125622856143]"
214,2019-01-21,ldixon wallstxyz mikemerlinator aoc rokhanna sensanders senatemajldr justicedems ayannapressley ilhanmn rashidatlaib that why spend billions dollars their candidates. why ceo goldman sachs telling the freshman congress elects how pass legislation who should work for? that pretty scary know a company power votes congress.,162.0,"[0.6442288210362388, 0.8074517110863931, -0.14615125622856143]"
215,2019-01-21,"irony teaching college without a college degree. . here a snapshots me teaching entrepreneurs the goldman sachs , small business initiative. . so many entrepreneurs dive the...",162.0,"[0.6442288210362388, 0.8074517110863931, -0.14615125622856143]"
216,2019-01-21,"irony teaching college without a college degree. . here a snapshots me teaching entrepreneurs the goldman sachs , small business initiative. . so many…",162.0,"[0.6442288210362388, 0.8074517110863931, -0.14615125622856143]"
217,2019-01-21,jonfavs podsaveamerica sengillibrand crookedmedia how much her campaign be financed wall st? will pledge not put anyone goldmansachs her cabinet high level treasury positions?,162.0,"[0.6442288210362388, 0.8074517110863931, -0.14615125622856143]"
218,2019-01-21,"daveweigel reporter, mebbe could ask goldman sachs they are doing end shut",162.0,"[0.6442288210362388, 0.8074517110863931, -0.14615125622856143]"
219,2019-01-21,nytimes theeconomist goldmansachs business foxnews sentedcruz sensanders lindseygrahamsc aoc thehill thenation the us congress not mexico. therefore is nothing negotiate. roll video... donald trump says will make mexico pay wall,162.0,"[0.6442288210362388, 0.8074517110863931, -0.14615125622856143]"
220,2019-01-22,penn pennsas nomura goldmansachs mbatsinghua tsinghua sem brookingsthu tsinghuambas sem tsinghua tsinghua uni tsinghua pbcsf hbsexeced harvard harvardbiostats harvardbiz hbsalumni harvardhbs mit whnsc wharton mitsloan depsecdef secpompeo harvard law harvardphysics harvardmath realdonaldtrump harvardksr nsagov chartdata wef pc aims invalidate valid facts support ideas contrary the pc agenda. the basis excluding facts an arguments rooted the pseudo law practice pc lawyers not ignore arguments also ignore important facts. nomura goldmansachs mbatsinghua mit,171.0,"[1.5779587676834936, 1.355778783436129, -0.037214570467211994]"
221,2019-01-22,goldmansachs away anyone thinks gender bias isn’t real...is man.,171.0,"[1.5779587676834936, 1.355778783436129, -0.037214570467211994]"
222,2019-01-22,goldman sachs a prelude to a favorable first quarter,171.0,"[1.5779587676834936, 1.355778783436129, -0.037214570467211994]"
223,2019-01-22,scobbiejames alexmassie it a political rumble eu wanted fear italy /spain worse in than out got goldman sachs make the numbers...the early boom the bribe.,171.0,"[1.5779587676834936, 1.355778783436129, -0.037214570467211994]"
224,2019-01-22,the next interview be goldman sachs private wealth managment summer internship program.,171.0,"[1.5779587676834936, 1.355778783436129, -0.037214570467211994]"
225,2019-01-22,oh happy day some good news the music industry. goldmansachs musicstreaming industrytrends kc,171.0,"[1.5779587676834936, 1.355778783436129, -0.037214570467211994]"
226,2019-01-22,informative discussion held wef lagarde imfnews &amp; goldmansachs global ceo david solomon having women leaders. both acknowledged remains work do great see many companies leading way. side note of gs reps davos women,171.0,"[1.5779587676834936, 1.355778783436129, -0.037214570467211994]"
227,2019-01-22,"trump campaign promise “i’m gonna drain swamp ” what hes done gave tax cut the top put former coal lobbyist charge the epa goldman sachs members administration longest government shutdown us history if was his show, he’d fired",171.0,"[1.5779587676834936, 1.355778783436129, -0.037214570467211994]"
228,2019-01-22,leftiblog bourgeoisalien there huge choice be made comes trump vs a turd way dem will be goldman sachs bloat off labor the wealth gap continues widen will it be goldman sachs bloat off labor the wealth gap continues to widen?,171.0,"[1.5779587676834936, 1.355778783436129, -0.037214570467211994]"
229,2019-01-22,honored be named one fortunemagazine mostadmired companies th consecutive year. learn &amp; see the full list,171.0,"[1.5779587676834936, 1.355778783436129, -0.037214570467211994]"
230,2019-01-23,sirnotting wallstreet goldmansachs jpmorgan,180.0,"[1.5513327241359138, 1.714498119833077, -0.017707071520028463]"
231,2019-01-23,"wall street firms including goldman sachs citigroup walked away u.s. ipos chinese pp lenders recent months, another troubling sign the industry bloombergdeals",180.0,"[1.5513327241359138, 1.714498119833077, -0.017707071520028463]"
232,2019-01-23,congrats worldbusinesschicago board members pncbank cibc fifththird goldmansachs making bloomberg gender equality index; companies show commitment equality &amp; advancing women the workplace.,180.0,"[1.5513327241359138, 1.714498119833077, -0.017707071520028463]"
233,2019-01-23,"sales luxury jewelry, watches boats risk stock market swoons spending watches, jewelry, boats other luxury goods could tumble of recent stock market jitters, according analysis goldman sachs. declines stock",180.0,"[1.5513327241359138, 1.714498119833077, -0.017707071520028463]"
234,2019-01-23,"sales luxury jewelry, watches boats risk stock market swoons spending watches, jewelry, boats other luxury goods could tumble of recent stock market jitters, according analysis goldman sachs. declines stock",180.0,"[1.5513327241359138, 1.714498119833077, -0.017707071520028463]"
235,2019-01-23,"sales luxury jewelry, watches boats risk stock market swoons spending watches, jewelry, boats other luxury goods could tumble of recent stock market jitters, according analysis goldman sachs. declines stock",180.0,"[1.5513327241359138, 1.714498119833077, -0.017707071520028463]"
236,2019-01-23,rt goldmansachs the smartphone sales growth formula hit stumbling block—here what fuel shipments the future smithbusinessco realnews,180.0,"[1.5513327241359138, 1.714498119833077, -0.017707071520028463]"
237,2019-01-23,"recession fears spreading, goldman sachs says t worry",180.0,"[1.5513327241359138, 1.714498119833077, -0.017707071520028463]"
238,2019-01-23,"capitalism climate change = profiteering of human misery. just like goldman sachs &amp; ""curing diseases bad business"" nonsense. capitalism horrible healthcare system=... these greedy villains ensuring guillotines make bloody return. guillotine",180.0,"[1.5513327241359138, 1.714498119833077, -0.017707071520028463]"
239,2019-01-23,"davidcro markmywordsjcpm jenniegensec i agree. not sure blair thinks is though. who he represent? saudi arabia, pay £ million pa? goldman sachs? sure hell doesn’t represent labour party...",180.0,"[1.5513327241359138, 1.714498119833077, -0.017707071520028463]"
240,2019-01-24,sue goldmansachs last minute downgrade starbucks stock before earnings report. preventing big breakout share price. utter option price manipulation their hand. wallstreet stocks banks investmentbank,185.0,"[1.3674836755041568, 1.2925994524657614, -0.05589623583771257]"
241,2019-01-24,dataroom investment bank goldman sachs believed have hired the ipo one new zealand’s major ports bridgetcarterb ausbiz nz ports,185.0,"[1.3674836755041568, 1.2925994524657614, -0.05589623583771257]"
242,2019-01-24,jp morgan ceo jamie dimon goldman sachs ceo david solomon recently private meetings top democratic wall street critic maxine waters,185.0,"[1.3674836755041568, 1.2925994524657614, -0.05589623583771257]"
243,2019-01-24,therickwilson supposedly trump &amp; goldman sachs may after gold. see kelly more this theory.,185.0,"[1.3674836755041568, 1.2925994524657614, -0.05589623583771257]"
244,2019-01-24,did say goldman sachs? who lehman brothers again? corlebra,185.0,"[1.3674836755041568, 1.2925994524657614, -0.05589623583771257]"
245,2019-01-24,cyantist impcapital mattschaar kimmaicutler it’s insane we rolled right back the kardashians the nypd caught choking all goldman sachs execs. i don’t feel safe wearing apple watch anywhere south tribeca of stop frisk.,185.0,"[1.3674836755041568, 1.2925994524657614, -0.05589623583771257]"
246,2019-01-24,"representatives wells fargo, jpmorgan, bank america, goldman sachs other large banks expected soon receive requests testify the house financial services committee, according people familiar the plans. via wsj",185.0,"[1.3674836755041568, 1.2925994524657614, -0.05589623583771257]"
247,2019-01-24,"box great panel ai capitalmarkets bank america, goldman sachs, state street, lightpoint hosted bijonmehta stevenpae alkymi inc",185.0,"[1.3674836755041568, 1.2925994524657614, -0.05589623583771257]"
248,2019-01-24,mick mulvaney brought you goldman sachs russia launders cash.,185.0,"[1.3674836755041568, 1.2925994524657614, -0.05589623583771257]"
249,2019-01-24,"jacqnut standupbrexit esthermcvey sony, panasonic, goldman sachs already relocated thousands jobs. airbus, bombardier, bmw, nissan, toyota &amp; honda issued clear statements saying frictionless trade goes go. financial services firm moving droves. wake",185.0,"[1.3674836755041568, 1.2925994524657614, -0.05589623583771257]"
