,date,tweet,topic,sentiment
250,2019-01-25,goldmansachs away goldmansachs omg gs talking morals. morally bankrupt &amp; spineless. keep promoting tho. clearly s working. desperate times call desperate actions. your pr department .,199.0,"[1.0257189078970996, 0.7889897349870543, -0.14048762474716128]"
251,2019-01-25,". goldmansachs, morganstanley ask cancel jardine matheson holdings trades us b flash crash",199.0,"[1.0257189078970996, 0.7889897349870543, -0.14048762474716128]"
252,2019-01-25,watch cnbc full interview goldman sachs ceo david solomon davos,199.0,"[1.0257189078970996, 0.7889897349870543, -0.14048762474716128]"
253,2019-01-25,goldman sachs never made honest dollar its life,199.0,"[1.0257189078970996, 0.7889897349870543, -0.14048762474716128]"
254,2019-01-25,"goldmansachs one time partner south east asia chairman, tim leissner, discussing pleading guilty criminal charges stemming an alleged scheme steal billions a malaysian state investment fund known mdb, wall street journal reported",199.0,"[1.0257189078970996, 0.7889897349870543, -0.14048762474716128]"
255,2019-01-25,goldmansachs away how enforcing “diversity” the front trading desk every investment bank? then can talk this “gender equality” bs......,199.0,"[1.0257189078970996, 0.7889897349870543, -0.14048762474716128]"
256,2019-01-25,goldman sachs trump isn’t jeopardizing america’s preeminent standing the world – yahoo finance – goldman sachs,199.0,"[1.0257189078970996, 0.7889897349870543, -0.14048762474716128]"
257,2019-01-25,"gregmannarino goldman sachs schitz down, black white, is out, bad is good etc... kinda like mad hatter",199.0,"[1.0257189078970996, 0.7889897349870543, -0.14048762474716128]"
258,2019-01-25,goldman sachs predicts recession but sees pretty sharp slowdown,199.0,"[1.0257189078970996, 0.7889897349870543, -0.14048762474716128]"
259,2019-01-25,rousing opening reception last night kicked th annual africandnetwork investment symposium keynote aishetu fatima dozie formerly goldmansachs made case investing africa. excited see media community colleagues tom. computerhistory adis,199.0,"[1.0257189078970996, 0.7889897349870543, -0.14048762474716128]"
260,2019-01-26,"published may ""goldman sachs bought venezuela state oil company bonds last week""",211.0,"[0.34567806224376574, 0.29783356199787064, -0.1730679576089541]"
261,2019-01-26,some you never wear uniform you need know you working inventing for. darpa goldmansachs nomura wharton ocs mitelectionlab medialab dartmouth cornell wharton defenseintel medialab mitjlab mitmath caltech wharton,205.0,"[0.5796244217606372, 0.4363310183325403, -0.04699964758763715]"
262,2019-01-26,goldman sachs bought venezuela’s state oil company’s bonds last week via wsj,211.0,"[0.34567806224376574, 0.29783356199787064, -0.1730679576089541]"
263,2019-01-26,"adamcbest he spoke generalities. he no real accomplishments. he overplayed ""she gave speech goldman sachs."" he acted entitled. winning caucuses not same winning votes. his supporters rude rabid. he not dem. don me days bernie bros.",205.0,"[0.5796244217606372, 0.4363310183325403, -0.04699964758763715]"
264,2019-01-26,semgroup nyse semg upgraded goldman sachs group neutral investingnews,211.0,"[0.34567806224376574, 0.29783356199787064, -0.1730679576089541]"
265,2019-01-26,goldmansachs jenn rtr renttherunway annabelcarr interesting,211.0,"[0.34567806224376574, 0.29783356199787064, -0.1730679576089541]"
266,2019-01-26,sentedcruz could stop an utter embarrassment our state just one damn minute? is too much ask? collect check let goldman sachs wife whine about being able afford nd home.,211.0,"[0.34567806224376574, 0.29783356199787064, -0.1730679576089541]"
267,2019-01-26,dailymail does wife still work goldman sachs? socialist hypocrite.,205.0,"[0.5796244217606372, 0.4363310183325403, -0.04699964758763715]"
268,2019-01-26,goldmansachs i’ll take “because has va j j” alex.,205.0,"[0.5796244217606372, 0.4363310183325403, -0.04699964758763715]"
269,2019-01-26,"ray phenicie andreaw ketchmeifucan shannonrwatts she failed pursue one west owned the current freasury secretary steven mnuchin, former goldman sachs guy, negotiated sweetheart deal allow one west recapture loses foreclosures rather modify mortgages help people including veterans.",205.0,"[0.5796244217606372, 0.4363310183325403, -0.04699964758763715]"
270,2019-01-27,"walkerbragman it hard write public position won get the way the private position. right, goldmansachs?",214.0,"[0.83513551742618, 0.6644099347031089, -0.1612610517565231]"
271,2019-01-27,goldman sachs bought venezuela’s state oil company’s bonds last week,214.0,"[0.83513551742618, 0.6644099347031089, -0.1612610517565231]"
272,2019-01-27,deadbunnyfrank i guess bernie focus dirty politics whole life amass million net worth sucking to goldman sachs. oh wait. that hillary. bernie net worth million. keep drinking kool aid.,214.0,"[0.83513551742618, 0.6644099347031089, -0.1612610517565231]"
273,2019-01-27,goldman sachs bought venezuela’s state oil company’s bonds last week,214.0,"[0.83513551742618, 0.6644099347031089, -0.1612610517565231]"
274,2019-01-27,sydney fintech capify secures multimillion dollar funding m goldman sachs. fintech fintechsydney sydneyfintech funding sme smefinance multimillionaire credit…,214.0,"[0.83513551742618, 0.6644099347031089, -0.1612610517565231]"
275,2019-01-27,here what attendees a goldman sachs conference think markets do,214.0,"[0.83513551742618, 0.6644099347031089, -0.1612610517565231]"
276,2019-01-27,here what attendees a goldman sachs conference think markets do,214.0,"[0.83513551742618, 0.6644099347031089, -0.1612610517565231]"
277,2019-01-27,"trainpicker goldman sachs finally seeing justice. but hsbc, deutsche bank, whole lot em slime. especially central banks, beginning the federal reserve. but . . . i digress.",214.0,"[0.83513551742618, 0.6644099347031089, -0.1612610517565231]"
278,2019-01-27,"partyweirdo thesilverfox please. the main advocates remain david cameron, george osbourne, tory party, tory cabinet, parliament, lords, big business, goldman sachs, morgan stanley entire establishment. you on the same side them. remember?",214.0,"[0.83513551742618, 0.6644099347031089, -0.1612610517565231]"
279,2019-01-27,here a good lawyer joke gentlemen. if realdonaldtrump splits flotus gets the house the company. he always get whitehouse the company aka cia . jokeoftheday jimmyfallon jimmyfallon whnsc nomura goldmansachs wharton,214.0,"[0.83513551742618, 0.6644099347031089, -0.1612610517565231]"
280,2019-01-28,"sportingnews kdtrey right. people get mad cuz are young rich black men exercising power choose play. no one gets pissed baller bankers move morgan stanley to goldman sachs. if have bs reason bothers you, that’s something gotta deal",218.0,"[0.8507436833109697, 0.8833841933295714, -0.1387201452151699]"
281,2019-01-28,goldman sachs affiliate buys office portfolio m,218.0,"[0.8507436833109697, 0.8833841933295714, -0.1387201452151699]"
282,2019-01-28,"mtaibbi one thing i’d like see democratic candidates s pledge not hire wall street assholes stop the revolving door goldman sachs. it may a fantastical idea, any suggestions how can help?",218.0,"[0.8507436833109697, 0.8833841933295714, -0.1387201452151699]"
283,2019-01-28,nectarina senecaindian goldmansachs away yes do. maybe don make much some man particular. this due your lack skills.,218.0,"[0.8507436833109697, 0.8833841933295714, -0.1387201452151699]"
284,2019-01-28,pcguy dan goldmansachs away not true lol,218.0,"[0.8507436833109697, 0.8833841933295714, -0.1387201452151699]"
285,2019-01-28,"goldman warned nvidia could blow because china says companies could next according goldman sachs, broadcom, micron technology, qualcomm, qorvo, skyworks solutions wynn get than half sales china.",218.0,"[0.8507436833109697, 0.8833841933295714, -0.1387201452151699]"
286,2019-01-28,vp potus he also invalidate goldman sachs claims those assets were a .b loan madero. this loan kept in power,218.0,"[0.8507436833109697, 0.8833841933295714, -0.1387201452151699]"
287,2019-01-28,karmalovesgumbo goldmansachs away try wearing jacket.,218.0,"[0.8507436833109697, 0.8833841933295714, -0.1387201452151699]"
288,2019-01-28,don worry can always give nukes back we problem sir. ambjohnbolton whnsc jokeoftheday dprk news harvardclub harvardclubuk nomura goldmansachs mbatsinghua tsinghua sem brookingsthu tsinghuambas tsinghua uni tsinghua pbcsf hbsexeced depsecdef,218.0,"[0.8507436833109697, 0.8833841933295714, -0.1387201452151699]"
289,2019-01-28,"sunchartist “for investors want hedge international risks, goldman sachs put together basket companies focused domestic sales.” are trying offload stocks?",218.0,"[0.8507436833109697, 0.8833841933295714, -0.1387201452151699]"
290,2019-01-29,"goldman sachs guy, right? trump said hillary going put sachs people her administration she won. hillary warned us she correct the puppet",227.0,"[1.0460304903115296, 0.9213257157392103, -0.18343549606196619]"
291,2019-01-29,"pinterest taps goldman sachs, jpmorgan lead ipo sources",227.0,"[1.0460304903115296, 0.9213257157392103, -0.18343549606196619]"
292,2019-01-29,goldman sachs securities division engineering co head retire memo,227.0,"[1.0460304903115296, 0.9213257157392103, -0.18343549606196619]"
293,2019-01-29,goldman sachs securities division engineering co head retire memo,227.0,"[1.0460304903115296, 0.9213257157392103, -0.18343549606196619]"
294,2019-01-29,"digital asset why goldman sachs wants launch bitcoin trading operation? do really need big institutions cryptocurrency i mean, are pros cons, haven they already messed the fiat stock economy enough? sharesteem",227.0,"[1.0460304903115296, 0.9213257157392103, -0.18343549606196619]"
295,2019-01-29,"blockchains distributed ledgers being piloted many organizations including walmart, microsoft, goldman sachs, maersk, ubs, barclays, credit suisse, unilever, amazon, fedex, ups, nestle, others. cbinsights",227.0,"[1.0460304903115296, 0.9213257157392103, -0.18343549606196619]"
296,2019-01-29,"fishfunsun brianlehrer lol trump literally embodiment the corruption claim hate. he a venal, crooked dope &amp; always been. we doing nothing new. his cabinet economics team the types goldman sachs stooges obama only somehow dumber. you being conned.",227.0,"[1.0460304903115296, 0.9213257157392103, -0.18343549606196619]"
297,2019-01-29,mcwm darrencohen didn’t apple sign deal goldman sachs future services together?,227.0,"[1.0460304903115296, 0.9213257157392103, -0.18343549606196619]"
298,2019-01-29,goldman sachs securities division engineering co head retire memo,227.0,"[1.0460304903115296, 0.9213257157392103, -0.18343549606196619]"
299,2019-01-29,"the rally defaulted venezuelan bonds sparked hopes regime change handed juicy early year gains the country’s biggest creditors, as blackrock, t rowe price, stone harbor goldman sachs asset management.",227.0,"[1.0460304903115296, 0.9213257157392103, -0.18343549606196619]"
300,2019-01-30,goldman sachs hires firefighting lawyer doj ties via financialtimes,235.0,"[1.2815353021578608, 1.3363205984709479, -0.16554236962822402]"
301,2019-01-30,"toddasorenson iamsuesue mgranville sensanders i can’t. the glass jawed idiot blocked me. guess couldn’t come with good reason hillary didn’t release goldman sachs speeches. i’m crushed, course.",235.0,"[1.2815353021578608, 1.3363205984709479, -0.16554236962822402]"
302,2019-01-30,i just posted new blog goldman sachs ditches single use plastic products,235.0,"[1.2815353021578608, 1.3363205984709479, -0.16554236962822402]"
303,2019-01-30,"not goldman sachs, troy gowd fox news host as donald trump circles drain such severe fashion even fox can’t figure how keep propping up, network’s real remaining avenue ratings to ramp the lies its favorite democratic scapegoats.",235.0,"[1.2815353021578608, 1.3363205984709479, -0.16554236962822402]"
304,2019-01-30,"""goldman sachs ditches single use plastic products""",235.0,"[1.2815353021578608, 1.3363205984709479, -0.16554236962822402]"
305,2019-01-30,itvpeston guardiananushka goldmansachs no brexit????? what hell. groundhog day. anyone take notice parliament yesterday? parliament accepted result referendum. no deal removes backstop. paperless eu worked and says possible is political decision what going on? ask raab,235.0,"[1.2815353021578608, 1.3363205984709479, -0.16554236962822402]"
306,2019-01-30,"goldman sachs ditches single use plastic products goldman sachs group inc told employees wednesday will longer carry widely used, throw away plastic items like water bottles silverware its offices an... via youhalal reutersindia business",235.0,"[1.2815353021578608, 1.3363205984709479, -0.16554236962822402]"
307,2019-01-30,"girlsreallyrule change paradigm. . our population owning wealth...both parties get screwed. wages been flat yrs. i started goldman sachs, &amp; fix to tax the shit of uber wealthy. they afford it, will benefit, &amp; will still wealthy",235.0,"[1.2815353021578608, 1.3363205984709479, -0.16554236962822402]"
308,2019-01-30,goldman sachs ditches single use plastic products,235.0,"[1.2815353021578608, 1.3363205984709479, -0.16554236962822402]"
309,2019-01-30,"""the effect adding supervalu a co borrower caused significant harm unfi because—unbeknownst the company well known goldman sachs—the change part an unlawful quid pro quo the bank credit default swap cds holders...""",235.0,"[1.2815353021578608, 1.3363205984709479, -0.16554236962822402]"
310,2019-01-31,a preview the us nonfarm payroll report due friday via goldman sachs,243.0,"[1.2401800582991827, 1.222519655609899, -0.3210103481091094]"
311,2019-01-31,a preview the us nonfarm payroll report due friday via goldman sachs,243.0,"[1.2401800582991827, 1.222519655609899, -0.3210103481091094]"
312,2019-01-31,bethlynch the d trip everything short outright vote tampering tamp bernie the populist left that another goldman sachs approved centrist lose trump all donors get another tax cut?,243.0,"[1.2401800582991827, 1.222519655609899, -0.3210103481091094]"
313,2019-01-31,"goldman sachs managing director david lehman, testified front congress the financial crisis, be leading gov. ned lamont economic development team; not know other about days ago;",243.0,"[1.2401800582991827, 1.222519655609899, -0.3210103481091094]"
314,2019-01-31,"breaking goldman sachs managing director be named gov. ned lamont chief economic adviser, overseeing department economic community development; old greenwich resident be leaving wall street;",243.0,"[1.2401800582991827, 1.222519655609899, -0.3210103481091094]"
315,2019-01-31,"so r consortium started a group nine companies, barclays, bbva, commonwealth bank australia, credit suisse, goldman sachs, j.p. morgan,royal bank scotland, state street, ubs. hmmm i guess all some xrp",243.0,"[1.2401800582991827, 1.222519655609899, -0.3210103481091094]"
316,2019-01-31,"the three indra nooyi, recently retired chairman ceo pepsoco; james smith, retired ceo the parent webster bank david lehman, head global real estate finance goldman sachs investment bank.",243.0,"[1.2401800582991827, 1.222519655609899, -0.3210103481091094]"
317,2019-01-31,this what i worried about. the reason i not supported lamont pre convention because i tired rich controlling government. goldman sachs executives not we need lead the middle working classes forward ct in country.,243.0,"[1.2401800582991827, 1.222519655609899, -0.3210103481091094]"
318,2019-01-31,united natural foods sues goldman sachs its help supervalu deal,243.0,"[1.2401800582991827, 1.222519655609899, -0.3210103481091094]"
319,2019-01-31,"“yes, virginia, is acsanta clause” could be beginning the end the vampire’s wall street? we but hope more legal woes goldman sachs food company client files suit barron",243.0,"[1.2401800582991827, 1.222519655609899, -0.3210103481091094]"
